Text,Author
"– DISCIPLINA: MEDOTOLOGIA ENSINO BIOLOGIA DOCENTE: DISCENTE: EXERCÍCIO 1) OPINIÃO, PRÁTICA VEM ACONTECENDO? QUAIS CONSIDERAÇÕES ACERCA DESTE QUESTIONAMENTO? R= SIM NÃO, POIS MANEIRA ABORDAGENS FEITAS SALA AULA, ACABAM DEMONSTRANDO MODIFICAÇÕES FEITAS FORMAS DISTINTAS, TANTO PRA BOM QUANTO PRA RUIM. NOTÓRIO QUESTÕES CIÊNCIAS MANEIRA ESTIMULE CURIOSIDADE ACERCA ASSUNTOS DISCUTIDOS. EDUCAÇÃO SI NECESSITA FORMAS AMPLAS PASSAR CONHECIMENTO, POIS MUDANÇAS TRANSFORMAÇÕES OCORRENDO FORMA ACELERADA. DESSA FORMA, DEVER PASSAR CONTEÚDOS CERTA MANEIRA INTENÇÕES TRANSFORMAR FORMA CIÊNCIA VISTA, FIQUE CLARA. 2) ALUNOS SENTEM DIFICULDADES APRENDER CIÊNCIAS? DISCIPLINA ESTUDA VIDA PROCESSOS MOTIVA INTERESSAR APRENDER? R= PORQUE GERALMENTE MANEIRA CIÊNCIA ABORDADA SALA AULA, FORMA COMPLEXA ACABA DEMONSTRANDO POUCO INTERESSE ALUNOS. ASSUNTOS CIÊNCIAS DEVEM SER ABORDADOS JEITO ESTIMULE INTERESSE ACERCA CONTEÚDO DESTAQUE, SEJA, PROFESSOR DEVE ENCONTRAR SAÍDAS MOTIVEM EDUCANDOS BUSCAR CONHECIMENTO. AULAS PRÁTICAS BOA SAÍDA ISTO. 3) ENTENDE TRABALHAR INTERDISCIPLINARIDADE TRANSVERSALIDADE? ELABORE TEXTO COMPARTILHE COMPREENSÃO! R= APÓS APROFUNDAMENTO ACERCA QUESTIONAMENTO, INTERDISCIPLINARIDADE SAÍDA GARANTE CONSTRUÇÃO CONHECIMENTOS ELEVAM FRONTEIRAS DISCIPLINAS, SEJA, TROCA ÁREAS CONHECIMENTO. BUSCA ENVOLVIMENTO, COMPROMISSO, RECIPROCIDADE DIANTE CONHECIMENTOS SITUADOS ÂMBITO EDUCACIONAL. TRANSVERSALIDADE COMPREENDE POSSIBILIDADE SITUAR, PRÁTICA EDUCATIVA, RELAÇÃO APRENDER SOBRE REALIDADE APRENDER REALIDADE REALIDADE. FORMA CLARA, TRANSVERSALIDADE ULTRAPASSA DIFERENTES CAMPOS CONHECIMENTO. DUAS, CERTA FORMA, ANDAM JUNTAS VANTAGEM NISTO, POIS TRABALHAR PÚBLICO INFANTO-JUVENIL, EXEMPLO, MOSTRAR INTERDISCIPLINARIDADE VISANDO TRANSVERSALIDADE. SEJA, CONSTRUIR CONHECIMENTOS MOSTRANDO ENSINAR REALIDADE REALIDADE. OCORRE ENSINO CIÊNCIAS, POIS CIÊNCIAS VÁRIOS CAMINHOS ELEVAM MANEIRA ABSORVER CONHECIMENTO.",SDLL
"3) ENTENDE TRABALHAR INTERDISCIPLINARIDADE TRANSVERSALIDADE? ELABORE TEXTO COMPARTILHE COMPREENSÃO! R - PERSPECTIVA AULAS CIÊNCIAS MINISTRADAS MEDIADORES DENTRO CAMPO CIENTÍFICO PODE EXPRESSAR TERMOS FINALIDADES HUMANISTAS, SOCIAIS ECONÔMICAS TODAS PROBLEMÁTICAS VIVIDAS DESDE ORIGEM HISTÓRIA FAZENDO DISCUTISSE CAUSAS FEITOS SOCIAS ATUAIS ALAVANCAR MÉTODOS INOVADORES SURTA IMPACTOS SATISFATÓRIOS SOCIEDADE. OBJETIVOS ESTUDOS CIÊNCIA AULAS LABORATORIAIS EXPERIMENTAL VISAM CAPACITAR ESTUDANTES SITUAR UNIVERSO TÉCNICO-CIENTÍFICO PODER UTILIZAR CIÊNCIAS DECODIFICAR MUNDO, TORNA ENTÃO MENOS MISTERIOSO (OU MENOS MISTIFICADOR). TRATA-SE TEMPO PODER MANTER AUTONOMIA CRÍTICA SOCIEDADE FAMILIARIZAR-SE GRANDES IDEIAS PROVENIENTES CIÊNCIAS MELHOR PONTUANDO TRATA-SE PODER PARTICIPAR CULTURA TEMPO. PROFESSORES GERAL TRABALHAR CONTEÚDOS MODO INTERDISCIPLINAR SENTEM DIFICULDADE MONTAR SITUAÇÕES HIPOTÉTICAS POSTO PRECISA CONHECIMENTO PRÉVIO OUTRAS ÁREAS CONHECIMENTO PODE DAR REPRESENTAÇÃO PASSA SER FAZER COMPREENDER DISCENTES. ENTANTO, INTERDISCIPLINARIDADE FORMAS UTILIZAR EXEMPLO HIPOTÉTICO DESTE ESCLARECER SITUAÇÃO. IMPORTANTE FAZER PROFESSORES ENTENDAM PRECISO DESENVOLVER METODOLOGIAS NOVAS CAUSE REFLEXÃO SOBRE ABORDAGEM CONTEÚDO SALA DISCENTES, FAZENDO PERCEBAM DISCIPLINAS ENCONTRAM SENTIDO, FORNECENDO ABORDAGEM PARCIAL, RIGOROSA SITUAÇÕES ESTUDADAS. FALA TRANSVERSALIDADE ENTENDE-SE ASSOCIAÇÃO VÁRIOS CONTEÚDOS EDUCATIVOS IRÁ CONTRIBUIR EXEMPLIFICAR DETERMINADA SITUAÇÃO PROBLEMA, TENDO LIGAÇÃO ALGUMA NENHUMA OUTRA MATÉRIA PARTICULAR, SENDO COMUM TODAS DISCIPLINAS SEGUINDO PERSPECTIVA GLOBAL MODO FUNDAMENTAR TEMA QUER TRABALHAR SALA AULA. ISSO, FACILITA FORMA APRENDER ESTUDANTE ATRAVÉS FATOS CONTEXTUALIZADOS TEMA SENDO TRABALHADO PROFESSOR SALA APLICANDO-SE QUESTÕES ATUAIS SOCIEDADE. PORTANTO, INTERDISCIPLINARIDADE TRANSVERSALIDADE IRÃO TRABALHAR COMUM EIXO PRINCIPAL ÁREA CONHECIMENTO VOLTADO EDUCAÇÃO DEMAIS PROJETOS CIENTÍFICOS.",BMM
"– – | DOCENTE: DISCENTES: . 1º) OPINIÃO, PRÁTICA VEM ACONTECENDO? QUAIS CONSIDERAÇÕES ACERCA DESTE QUESTIONAMENTO? R- NÃO, SENDO LEI LDBN NORMATIVA INSTALADA BNCC ( BASE NACIONAL COMUM CURRICULAR), 2017, SEGUNDO COMPETÊNCIA DEFINIDA MOBILIZAÇÃO CONHECIMENTOS (CONCEITOS PROCEDIMENTOS), HABILIDADES (PRÁTICAS, COGNITIVAS SOCIOEMOCIONAIS), ATITUDES VALORES RESOLVER DEMANDAS COMPLEXAS VIDA COTIDIANA, PLENO EXERCÍCIO CIDADANIA MUNDO TRABALHO. SOCIEDADE AINDA RECEBE PERSPECTIVA RELAÇÕES SOCIOCULTURAIS CONTEÚDO CONSTRUÍDO SALA AULA, MOTIVOS FALTA CAPACITAÇÃO PROFISSIONAL DOCENTES. MUITOS AINDA ATUAM FORMA TRADICIONAL PERMANENTE CONTEXTO, APENAS PASSAR CONTEÚDO CORRELACIONAR CIDADANIA . 2º) ALUNOS SENTEM DIFICULDADES APRENDER CIÊNCIAS? DISCIPLINA ESTUDA VIDA PROCESSOS MOTIVA INTERESSAR APRENDER? R- MOTIVAÇÃO DISCENTE DERIVA MANEIRA MOTIVADO, PROFESSOR NESSE CONTEXTO, PAPEL IMPORTANTE REALIZA MANEIRAS PROPOR INTERESSE CONTEÚDOS DISCIPLINA CIÊNCIAS/ BIOLOGIA. BNCC RESSALTA DISCUTIR, TAMBÉM, PERSPECTIVA HISTÓRICA APROPRIAÇÃO HUMANA DESSES RECURSOS, BASE, EXEMPLO, IDENTIFICAÇÃO USO MATERIAIS DIFERENTES AMBIENTES ÉPOCAS RELAÇÃO SOCIEDADE TECNOLOGIA FACILITAM INTERESSE CONTEÚDO. PRATICA AJUDA DESENVOLVER MOTIVAÇÃO, POIS ESTUDAR VIDA, PRESENTE ENTORNO MUITOS DOCENTES FIXAM REALIDADE MATERIAL DIDÁTICO TRABALHADO SALA AULA. EXEMPLO DESSA REALIDADE APRENDER BOTÂNICA, MUITAS VEZES PASSADA FORMA EXTREMAMENTE TEÓRICA, CONSTRUÇÃO CONTEÚDO PRATICA. ACABA DIFICULTANDO RECONHECIMENTO AMBIENTE AUSÊNCIA PRÁTICA. CONHECIMENTO OBJETO ESTUDO, EVITA PERPETUAÇÃO VIDA COTIDIANO, PREJUDICANDO PROPAGAÇÃO CIÊNCIA, COMPREENDIMENTO RELAÇÕES OUTRAS ÁREAS ESTUDO. 3º) ENTENDE TRABALHAR INTERDISCIPLINARIDADE TRANSVERSALIDADE? ELABORE TEXTO COMPARTILHE COMPREENSÃO! INTERDISCIPLINARIDADE MÉTODO INTEGRAR CONHECIMENTOS PASSANDO CONCEPÇÃO FRAGMENTADA CONCEPÇÃO UNITÁRIA CONHECIMENTO, CONSIDERANDO ESTUDO PESQUISA PARTIR CONTRIBUIÇÃO DIVERSAS CIÊNCIAS DURANTE PROCESSO ENSINO APRENDIZADO. APRESENTA DIMENSÃO QUESTIONAR SEGMENTAÇÃO DIFERENTES CAMPOS ABORDAGENS LEVA CONTA INTER-RELAÇÃO INFLUENCIA ELES, QUESTIONA VISÃO COMPARTIMENTADA REALIDADE SOBRE ESCOLA APRESENTA, TAL CONHECIDA, HISTORICAMENTE CONSTITUIU. TRANSVERSALIDADE MOSTRA TEMAS TRANSVERSAIS CONJUNTO CONTEÚDOS EDUCATIVOS EIXOS CONDUTORES ATIVIDADE ESCOLAR QUE, ESTANDO LIGADOS NENHUMA MATÉRIA PARTICULAR, PODE CONSIDERAR COMUNS TODOS FORMA, CRIAR NOVAS DISCIPLINAS, TRAZ VALORES IMPORTANTES DEMOCRACIA. PRATICA EDUCATIVA RELAÇÃO APRENDER CONHECIMENTO TEORICAMENTE SISTEMATIZADO DIANTE REALIDADE QUESTÕES VIDA REAL TRANSFORMAÇÕES, APRENDER REALIDADE REALIDADE.",FODM
"– METODOLOGIA ENSINO BIOLOGIA- RESUMO: ENSINO CIÊNCIAS BRASIL: HISTÓRIA, FORMAÇÃO PROFESSORES DESAFIOS. ARTIGO REPRODUZ SEQUENCIA HISTÓRICA SOBRE TRAJETÓRIA ENSINO CIÊNCIAS LONGO DÉCADAS, DESDE PASSOU SER INSTITUÍDO DADO VALIA POLÍTICAS CIENTIFICAS TECNOLÓGICAS CONTRIBUINDO CRESCIMENTO PROGRESSO BRASIL PARTIR ANOS 1950 DILEMAS FORMAÇÃO ATUAÇÃO PROFESSOR CIÊNCIAS BIOLOGIA. CIÊNCIA APÓS SER CONSIDERADA, TROUXE GRANDE INTERFERÊNCIA SOCIEDADE PASSOU SER VISTA POSSIBILIDADE COMPREENSÃO CONQUISTA NATUREZA MATERIALIZANDO TECNOLOGIA, CONSEQUENTEMENTE TECNOLOGIA TRAZIA IDEIA DESENVOLVIMENTO. REVOLUÇÃO INDUSTRIAL PODE SER CONSIDERADA GRANDE VEÍCULO DISSEMINAÇÃO DESSAS DUAS ÁREAS PROLETARIADO, ÉPOCA ACESSO VERDADE CONSTRUÇÃO IDEIAS, MODOS PENSAR AGIR DISPONÍVEIS APENAS BURGUESIA, NECESSÁRIO OBTENÇÃO DESTES CONHECIMENTOS ENSINO CIÊNCIAS ESCOLAS MANUSEIO MAQUINÁRIO INOVADOR PRODUÇÃO GRANDE ESCALA; PODE-SE DESTACAR AÍ PRESENTE INFLUÊNCIA ESCOLA FORMADORA MODELOS SOCIAIS ATENDAM NECESSIDADES SOCIEDADE. INDUSTRIALIZAÇÃO TROUXE IDEIA EMPREENDIMENTO SÓCIO ECONÔMICO DESCOBERTAS USO TECNOLÓGICO. “AULAS PRÁTICAS (...) POSSIBILITAVA REALIZAÇÃO PESQUISAS COMPREENSÃO MUNDO VIVIAM” TRECHO DEMONSTRA NESSA ÉPOCA DESCOBERTAS, CONTATO EXPERIMENTO FAZIAM NECESSÁRIOS DESCOBERTAS CIENTÍFICAS TECNOLÓGICAS, INDEPENDENTE NÍVEL TECNOLOGIA DISPONÍVEL FRENTE PESQUISAS OBSERVAÇÕES. QUANTO FORMAÇÃO PROFESSORES NECESSÁRIO COMPREENDER IMPORTÂNCIA RECEBIDO CIÊNCIA QUANTO AINDA EDUCAÇÃO BÁSICA, POIS MOMENTO FORMAÇÃO CONSTRUÇÃO CONHECIMENTOS IRÃO INFLUENCIAR DIRETAMENTE CONCEPÇÃO CONTEÚDO ESTAR FRENTE SALA AULA, CONDUZINDO PROCESSO ENSINO APRENDIZAGEM ALUNOS TRAZENDO CONSIGO MEMÓRIAS EXPERIÊNCIAS VIVENCIADAS; PORTANTO FORMAÇÃO DOCENTE INICIA-SE ANTES INGRESSO CURSO . SEGUNDO DELIZOICOV ANGOTTI (1990) MEADOS 1980 DURANTE 1990 PROPOSTAS EDUCATIVAS ENFATIZAVAM NECESSIDADE LEVAR ESTUDANTES DESENVOLVEREM PENSAMENTO REFLEXIVO CRÍTICO; QUESTIONAREM RELAÇÕES EXISTENTES CIÊNCIA, TECNOLOGIA, SOCIEDADE MEIO AMBIENTE APROPRIAREM CONHECIMENTOS RELEVANTES CIENTIFICA, SOCIAL CULTURALMENTE. DEVE SER APENAS DISPOSTO DOCENTE CIÊNCIAS. PAPEL PROFESSOR ATRELAR VISÃO QUESTIONAMENTOS CRÍTICOS ALUNOS, REQUERENDO LICENCIADO HABILIDADE SABER, FAZER SABER FAZER. CONTUDO PAPEL PROFESSOR, FORMADOR ADULTOS CRÍTICOS VISTO HOJE ESTRATÉGIA POLITICAS EDUCACIONAIS, VISTO INFLUENCIA PODEM REPRESENTAR TRANSFORMAÇÕES SOCIAIS EDUCATIVAS.",SABA
"– REGISTRO TEXTO: ENSINO CIÊNCIAS BRASIL: HISTÓRIA, FORMAÇÃO PROFESSORES DESAFIOS ATUAIS : PRODUÇÃO CIENTÍFICA TECNOLÓGICA BRASILEIRA RELAÇÕES SOCIEDADE INICIALMENTE PRODUÇÃO CIENTÍFICA TECNOLÓGICA BRASILEIRA REGIDA FORMAS ACADÊMICAS INTERNACIONAIS PRATICAR CIÊNCIAS SOFREU INSTABILIDADE AUTORITARISMO, ONDE GOVERNO ACIMA POPULAÇÃO. ANOS 1950, CIÊNCIA TECNOLOGIA PASSARAM GRANDE PROCESSO INSTITUCIONALIZAÇÃO JUNTO CRESCIMENTO PROGRESSO PAÍS. MANEIRA MECANICISTA, NESSE PERÍODO, ANALISAVA INTERFERÊNCIAS CIÊNCIA TECNOLOGIA SOBRE SOCIEDADE. FINAL DESTE PERÍODO, ENTRANDO DÉCADAS 1960 1970 PRODUÇÃO CIENTÍFICA BRASILEIRA QUASE TOTALMENTE SOBRE DOMÍNIO ESTADO, PREDOMINANDO MUITOS SETORES SEPARAÇÃO FORMAL PESQUISA CIENTÍFICA PRODUÇÃO TECNOLÓGICA. CIÊNCIA BRASILEIRA PASSOU CONTAR LEGITIMIDADE NOVAS FORMAS ORGANIZAÇÃO. NESTE PERÍODO, ATIVIDADE CIENTÍFICA FOCALIZAVA PRINCIPALMENTE INTERESSES INTERNACIONAIS. COMEÇO DÉCADA 1990 TORNANDO EXPLICITO NECESSIDADE ANALISAR JUNÇÃO EXISTENTE CIÊNCIA, TECNOLOGIA SOCIEDADE, SURGINDO PANORAMAS COMPLEXOS INCERTEZAS RELAÇÃO PRODUÇÃO CIENTIFICA TECNOLÓGICA PAÍS. FATO MOSTROU EVIDÊNCIA EXISTIA FALTA RELAÇÃO RESPEITO DESSAS PRODUÇÕES POPULAÇÃO BRASILEIRA. ATUALMENTE ENTENDE-SE CIÊNCIA MATERIALIZA TECNOLOGIA ÚLTIMA TRAZ CONSIGO IDEIA DESENVOLVIMENTO PAÍS. ENTANTO, CONCEITO DESENVOLVIMENTO ACOMPANHOU VEM ACOMPANHANDO PROGRESSO CIÊNCIA TECNOLOGIA BRASIL SIDO PAUTADO IDEIA CRESCIMENTO ECONÔMICO ASSOCIADO MAIOR PRODUTIVIDADE AUMENTO CONSUMO CIDADÃOS. TORNA-SE NECESSÁRIO REFLETIR PROPOR AÇÕES SOBRE CONSEQUÊNCIAS PROBLEMÁTICAS NATUREZA SOCIAL AMBIENTAL GERADAS DESENVOLVIMENTO CIENTÍFICO TECNOLÓGICO, PRINCIPALMENTE REFERE EQUIDADE DISTRIBUIÇÃO CUSTOS AMBIENTAIS PROVOCADOS INOVAÇÕES TECNOLÓGICAS. INFLUÊNCIAS DESENVOLVIMENTO CIENTÍFICO TECNOLÓGICO IDEÁRIO EDUCACIONAL SOBRE ENSINO CIÊNCIAS MUNDO DESENVOLVIMENTO TECNOLÓGICO CIENTÍFICO VEM EXERCENDO FORTE INFLUÊNCIA ENSINO CIÊNCIAS. PARTIR ANOS 1950, PARTIR SEGUNDA GUERRA MUNDIAL ÁREAS CIÊNCIAS TECNOLOGIA TRANSFORMARAM-SE ENORME EMPREENDIMENTO SOCIOECONÔMICO ASSIM TRAZENDO PREOCUPAÇÃO ESTUDO CIÊNCIAS DIVERSOS NÍVEIS ENSINO. ASPECTO MARCANTE DÉCADA 1960 CHEGADA BRASIL TEORIAS COGNITIVISTAS, CONSIDERAVAM CONHECIMENTO SENDO PRODUTO INTERAÇÃO HOMEM MUNDO ENFATIZAVAM PROCESSOS MENTAIS ESTUDANTES DURANTE APRENDIZAGEM. GOLPE MILITAR 1964 POSSIBILITOU SURGIMENTO MODELO ECONÔMICO GEROU MAIOR DEMANDA SOCIAL EDUCAÇÃO. CRISE SISTEMA EDUCACIONAL BRASILEIRO AGRAVADA FATO EXPANSÃO REDE ENSINO TER SIDO ACOMPANHADA INVESTIMENTOS EDUCAÇÃO MESMA PROPORÇÃO PARTE GOVERNO. DÉCADA 1970, PROJETO NACIONAL GOVERNO MILITAR PRECONIZAVA MODERNIZAR DESENVOLVER PAÍS CURTO PERÍODO TEMPO. ENSINO CIÊNCIAS CONSIDERADO IMPORTANTE COMPONENTE PREPARAÇÃO TRABALHADORES QUALIFICADOS, CONFORME ESTABELECIDO LEI DIRETRIZES BASES EDUCAÇÃO NACIONAL (LDBEN N° 5692/71). ENTANTO, TEMPO LEGISLAÇÃO VALORIZAVA DISCIPLINAS CIENTÍFICAS, PRÁTICA BASTANTE PREJUDICADAS CRIAÇÃO DISCIPLINAS PRETENDIAM POSSIBILITAR ESTUDANTES INGRESSO MUNDO TRABALHO. APESAR PREOCUPAÇÃO POSSIBILITAR ESTUDANTES COMPREENSÃO PROCESSOS PRODUÇÃO CONHECIMENTO CIENTÍFICO, ENSINO CIÊNCIAS CONTINUOU SENDO DESENVOLVIDO MODO INFORMATIVO, PRINCIPALMENTE DEVIDO PRECÁRIAS CONDIÇÕES OBJETIVAS TRABALHO PROFESSORES ENCONTRAVAM ESCOLAS CARÊNCIAS FORMAÇÃO ESPECÍFICA APRESENTAVAM. DIFICULDADES PROFESSORES ROMPER PROFUNDA CONCEPÇÃO POSITIVISTA CIÊNCIA CONCEPÇÃO CONSERVADORA AUTORITÁRIA ENSINO-APRENDIZAGEM ACUMULAÇÃO INFORMAÇÕES PRODUTOS CIÊNCIA, SEGUEM INFLUENCIANDO ORIENTANDO PRÁTICAS EDUCATIVAS; CARÊNCIAS FORMAÇÃO GERAL, CIENTÍFICA PEDAGÓGICA; INADEQUADAS CONDIÇÕES OBJETIVAS TRABALHO ENCONTRAM EXERCÍCIO PROFISSÃO DETERMINADAS POLÍTICAS EDUCACIONAIS FUNDAMENTADAS PRINCÍPIOS CONTRADITÓRIOS FORMAÇÃO CRÍTICA CIDADÃOS. FORMAÇÃO PROFESSORES CIÊNCIAS BRASIL PAPEL PROFESSOR CIÊNCIAS REDUZIDO SIMPLES EXECUÇÃO TAREFAS PROGRAMADAS CONTROLADAS, SENDO PREPARADO MEMORIZAR INFORMAÇÕES CIENTÍFICAS EXIGIDAS ESTUDANTES APLICAR PROCEDIMENTOS DIDÁTICOS SUGERIDOS ESPECIALISTAS EDUCAÇÃO. FORMAÇÃO DISCIPLINAR, ORIGINADA SOB PRESSUPOSTO DISCIPLINARIDADE CIENTÍFICA POSSIBILITOU CRIAÇÃO CURRÍCULOS FRAGMENTADOS ESPECIALIZAÇÃO SABERES, MATERIAIS DIDÁTICOS FORMAÇÃO DOCENTE. NESSE PERÍODO, TEORIAS COMPORTAMENTALISTAS ENSINO-APRENDIZAGEM INFLUENCIARAM SIGNIFICATIVAMENTE FORMAÇÃO PROFESSORES. PROFESSOR VISTO TÉCNICO CAPAZ ESTABELECER CLAROS PRECISOS OBJETIVOS ENSINO PLANEJAR ATIVIDADES EDUCATIVAS FORMA OBTER CONTROLE APRENDIZAGEM ESTUDANTES, MODIFICANDO, ELIMINANDO INTRODUZINDO NOVOS COMPORTAMENTOS MESMOS. DIAS ATUAIS FORMAÇÃO PROFESSORES VEM SENDO CONSIDERADA ATIVIDADE ESTRATÉGICA ÂMBITO POLÍTICAS EDUCACIONAIS, PRINCIPALMENTE DEVIDO IMPORTANTE PAPEL PROFISSIONAIS PODEM REPRESENTAR TRANSFORMAÇÕES EDUCATIVAS SOCIAIS. PERSPECTIVAS ENSINO CIÊNCIAS CONTEXTO ATUAL COMPLEXIDADE PROBLEMAS CIENTÍFICOS TECNOLÓGICOS ATUAIS PASSOU EXIGIR MAIOR FLEXIBILIDADE INTERPRETATIVA PARTIR DISTINTOS REFERENCIAIS TEÓRICOS. QUESTIONAMENTO IDEAIS CIENTIFICIDADE, IMPÕEM CIÊNCIA CRITÉRIOS FINALIDADES CARÁTER OBJETIVO, NEUTRO DESCONTEXTUALIZADO, PASSOU FAZER PARTE ESTUDOS PROCURAVAM MOSTRAR RELAÇÕES EXISTENTES CIÊNCIA, TECNOLOGIA SOCIEDADE (ESTUDOS CTS). DESSE MODO, RELAÇÕES CIÊNCIA, TECNOLOGIA SOCIEDADE, REFLETIDAS PESQUISAS ACADÊMICAS, PODERIAM INFLUENCIAR CONSTRUÇÃO NOVOS PROGRAMAS EDUCATIVOS ELABORAÇÃO SUBSÍDIOS DIDÁTICOS ENSINO CIÊNCIAS PERSPECTIVA CRÍTICA CONTEXTUALIZADA. MODO GERAL, CIÊNCIA AINDA PERCEBIDA SUJEITOS ALGO DISTANTE, APARENTEMENTE QUALQUER INFLUÊNCIA DIRETA SOBRE REALIDADE VIVENCIAL. DIFICULDADES COMPREENSÃO COMPLEXAS RELAÇÕES EXISTENTES TEORIAS CIENTÍFICAS TÉCNICAS, CIÊNCIA PURA APLICADA TEORIA PRÁTICA LEVA-OS PERCEBEREM CIÊNCIAS APENAS RESULTADOS APLICAÇÕES, FAVORECENDO SURGIMENTO CIENTIFICISMO, FUSÃO CIÊNCIA/TÉCNICA MITO NEUTRALIDADE CIENTÍFICA. COTIDIANO SALA AULA PROFESSOR DEFRONTA-SE MÚLTIPLAS SITUAÇÕES DIVERGENTES, QUAIS APRENDE LIDAR DURANTE CURSO FORMAÇÃO, REQUER NOVAS FORMAS AGIR CONSTRUÇÃO CONHECIMENTOS ESPECÍFICOS DOCÊNCIA FORMA REFLEXIVA, CRÍTICA PROCESSUAL, INCORPORANDO TRANSCENDENDO CONHECIMENTOS ADVINDOS RACIONALIDADE TÉCNICA. MELHORAR FORMAÇÃO PROFESSORES CIÊNCIAS PRESSUPÕE REFORÇAR PAPEL SOCIALIZAÇÃO VALORIZAÇÃO HUMANA REQUER CONSIDERADOS PESSOAS CIDADÃS, SOBRE QUAIS RECAEM RESPONSABILIDADES PROFISSIONAIS SOCIAIS.",VE
"– REGISTRO TEXTO: ENSINO CIÊNCIAS BRASIL: HISTÓRIA, FORMAÇÃO PROFESSORES DESAFIOS ATUAIS : PRODUÇÃO CIENTÍFICA TECNOLÓGICA BRASILEIRA RELAÇÕES SOCIEDADE PRODUÇÃO CIENTIFICA TECNOLÓGICA, PARTIR ANOS 50, REGIDA FORMULA ACADÊMICA INTERNACIONAL, SENDO NACIONAL FALTA INSTABILIDADE AUTORITARISMO GOVERNO SOBRE POPULAÇÃO. NESTE PERÍODO POLÍTICAS CIENTÍFICAS TECNOLÓGICAS PASSARAM GRANDE PROCESSO INSTITUCIONALIZAÇÃO BASE CRESCIMENTO PAÍS. ASPECTOS MARCANTES, MOSTRADOS TEXTO MANEIRA MECANICISTA ANALISAR INTERFERÊNCIAS CIÊNCIA TECNOLOGIA SOCIEDADE. TEXTO MENCIONADO DURANTE DÉCADA 60 70 SOBRE FATO PRODUÇÃO CIENTÍFICA TECNOLÓGICA, PAÍS, QUASE SOB DOMÍNIO ESTADO. TECNOLOGIA MANTEVE-SE SUSTENTADA ÓRGÃOS SETORIAIS, NESTE PERÍODO, ATIVIDADE CIENTÍFICA FOCO PRINCIPALMENTE INTERESSES COMUNIDADE INTERNACIONAL ALHEIA ESCALA NACIONAL. ANOS 1970 MARCADOS PRIVILEGIAR CIÊNCIA PURA, PRATICAMENTE HAVENDO MENÇÃO TECNOLOGIAS PRODUZIDAS BASE CONHECIMENTOS CIENTÍFICOS. DURANTE ANOS 1980 1990, ESTADO PASSOU DIMINUIR FUNÇÕES REGULADORAS PRODUTIVAS ABRIU ECONOMIA COMÉRCIO COMPETITIVIDADES INTERNACIONAIS. ATUALMENTE ENTENDE-SE CIÊNCIA MATERIALIZA TECNOLOGIA ÚLTIMA TRAZ CONSIGO IDEIA DESENVOLVIMENTO PAÍS. CIÊNCIA TECNOLOGIA BRASILEIRAS ATUAIS ATIVIDADES EXTREMAMENTE EFICAZES; ENTRETANTO, NECESSÁRIO QUESTIONAR OBJETIVOS SOCIALMENTE VÁLIDOS, CONSIDERANDO PROBLEMAS SOCIAIS AMBIENTAIS CAUSADOS PROGRESSO CIENTÍFICO TECNOLÓGICO, TORNA-SE NECESSÁRIO ABRIR CIÊNCIA CONHECIMENTO PÚBLICO. INFLUÊNCIAS DESENVOLVIMENTO CIENTÍFICO TECNOLÓGICO IDEÁRIO EDUCACIONAL SOBRE ENSINO CIÊNCIAS APÓS EVENTOS OCORRIDOS SEGUNDA GUERRA MUNDIAL, CIÊNCIA TECNOLOGIA TRANSFORMARAM-SE ENORME EMPREENDIMENTO SOCIOECONÔMICO, ASSIM TRAZENDO MAIOR PREOCUPAÇÃO ESTUDO CIÊNCIAS. ANOS 50 PROPOSTAS EDUCATIVAS PROCURAVAM POSSIBILITAR TODOS ESTUDANTES ACESSO VERDADES CIENTIFICAS DESENVOLVIMENTO MANEIRA CIENTIFICA PENSAR AGIR. INÍCIO ANOS 60 HAVIA SURGIDO BRASIL PROGRAMA OFICIAL ENSINO CIÊNCIAS, ESTABELECIDO MEC. NESTE PERÍODO SIGNIFICATIVA BUSCA MELHORIAS ENSINO CIÊNCIAS ÂMBITO NACIONAL INICIATIVA GRUPO DOCENTES UFSP, DEDICOU ELABORAÇÃO MATERIAIS DIDÁTICOS EXPERIMENTAIS PROFESSORES CIDADÃOS INTERESSADOS ASSUNTOS CIENTÍFICOS. GOLPE MILITAR 1964 POSSIBILITOU SURGIMENTO MODELO ECONÔMICO GEROU MAIOR DEMANDA SOCIAL EDUCAÇÃO. PARTIR 1964, PROPOSTAS EDUCATIVAS ENSINO CIÊNCIAS SOFRERAM GRANDE INFLUÊNCIA PROJETOS RENOVAÇÃO CURRICULAR DESENVOLVIDOS ESTADOS UNIDOS INGLATERRA. PROJETOS LIDERADOS RENOMADOS CIENTISTAS PREOCUPADOS FORMAÇÃO JOVENS INGRESSAVAM UNIVERSIDADES, SEJA, FUTUROS CIENTISTAS. PARTIR CRESCENTE INDUSTRIALIZAÇÃO BRASILEIRA RELATIVO DESENVOLVIMENTO CIENTÍFICO TECNOLÓGICO, PARTIR MEADOS ANOS 1960 IMPORTANTES TEMAS RELACIONADOS DESCOBERTAS CIENTÍFICAS PASSARAM FAZER PARTE ENSINO CIÊNCIAS. ENSINOS PASSARAM TER OBJETIVO SUMA IMPORTÂNCIA LEVAR ALUNOS ADQUIRIR CONHECIMENTOS CIENTÍFICOS ATUALIZADOS REPRESENTANDO DESENVOLVIMENTO CIENTIFICO TECNOLÓGICO PROPORCIONAR VIVENCIA PROCESSOS INVESTIGAÇÃO CIENTIFICA. NESSE PERÍODO, MUDANÇAS CURRICULARES PRECONIZAVAM SUBSTITUIÇÃO MÉTODOS EXPOSITIVOS ENSINO MÉTODOS ATIVOS ENFATIZAVAM IMPORTÂNCIA UTILIZAÇÃO LABORATÓRIO OFERECIMENTO FORMAÇÃO CIENTÍFICA QUALIDADE ESTUDANTES. ATIVIDADES EDUCATIVAS FINALIDADE MOTIVÁ-LOS AUXILIÁ-LOS COMPREENSÃO FATOS CONCEITOS CIENTÍFICOS, FACILITANDO-LHES APROPRIAÇÃO PRODUTOS CIÊNCIA. NESSE PERÍODO, PROPOSTAS MELHORIA ENSINO CIÊNCIAS FUNDAMENTADAS TEORIAS COMPORTAMENTALISTAS ENSINO-APRENDIZAGEM, GRANDE IMPACTO EDUCAÇÃO BRASILEIRA. CONHECIMENTO CIENTÍFICO ASSUMIA CARÁTER UNIVERSALISTA, POIS, PROCESSO HEGEMONIZAR-SE ÚNICA REFERÊNCIA EXPLICAÇÃO REAL, CIÊNCIA PROCURAVA LEVAR SUJEITOS SUBSTITUIR CRENÇAS RELIGIOSAS, DETERMINADAS PRÁTICAS COTIDIANAS IDEIAS SENSO COMUM NOVA CRENÇA. PARTIR FINAL ANOS 90, EDUCAÇÃO CIENTÍFICA PASSOU SER CONSIDERADA ATIVIDADE ESTRATÉGICA DESENVOLVIMENTO PAÍS, SENDO IDEIA COMPARTILHADA, MENOS VERBALMENTE, CLASSE POLÍTICA, CIENTISTAS EDUCADORES, INDEPENDENTEMENTE VISÕES IDEOLÓGICAS. IDEIA APONTAVA EXISTÊNCIA COMPLEXAS INTERAÇÕES CIÊNCIA SOCIEDADE; PORTANTO, SIMPLES OFERECIMENTO EDUCAÇÃO CIENTÍFICA ESCOLAR SUFICIENTE FORMAÇÃO CIDADÃOS CAPAZES RESISTIR INFORMAÇÕES PSEUDOCIENTÍFICAS INVADIAM SOCIEDADE ÉPOCA. SENDO CAPITAL HUMANO CONSIDERADO FATOR ESSENCIAL DESENVOLVIMENTO PAÍS, EDUCAÇÃO CIENTÍFICA PASSOU SER VISTA PRIORIDADE TODOS. FORMAÇÃO PROFESSORES CIÊNCIAS BRASIL ÚLTIMOS ANOS FORMAÇÃO PROFESSORES SIDO OBJETIVO PESQUISA ACADÊMICA CONSTITUIU FOCO POLÍTICAS EDUCACIONAIS. PROGRAMADAS CONTROLADAS, SENDO PREPARADO MEMORIZAR INFORMAÇÕES CIENTÍFICAS EXIGIDAS ESTUDANTES APLICAR PROCEDIMENTOS DIDÁTICOS SUGERIDOS ESPECIALISTAS EDUCAÇÃO. NESSE PERÍODO, TEORIAS COMPORTAMENTALISTAS ENSINO-APRENDIZAGEM INFLUENCIARAM SIGNIFICATIVAMENTE FORMAÇÃO PROFESSORES. PROFESSOR VISTO TÉCNICO CAPAZ ESTABELECER CLAROS PRECISOS OBJETIVOS ENSINO PLANEJAR ATIVIDADES EDUCATIVAS FORMA OBTER CONTROLE APRENDIZAGEM ESTUDANTES, MODIFICANDO, ELIMINANDO INTRODUZINDO NOVOS COMPORTAMENTOS MESMOS. ATUALMENTE, FORMAÇÃO PROFESSORES VEM SENDO CONSIDERADA ATIVIDADE ESTRATÉGICA ÂMBITO POLÍTICAS EDUCACIONAIS, PRINCIPALMENTE DEVIDO IMPORTANTE PAPEL PROFISSIONAIS PODEM REPRESENTAR TRANSFORMAÇÕES EDUCATIVAS SOCIAIS. PERSPECTIVAS ENSINO CIÊNCIAS CONTEXTO ATUAL MODO GERAL, CIÊNCIA AINDA PERCEBIDA SUJEITOS ALGO DISTANTE, APARENTEMENTE QUALQUER INFLUÊNCIA DIRETA SOBRE REALIDADE VIVENCIAL. DIFICULDADES COMPREENSÃO COMPLEXAS RELAÇÕES EXISTENTES TEORIAS CIENTÍFICAS TÉCNICAS, CIÊNCIA PURA APLICADA TEORIA PRÁTICA LEVA-OS PERCEBEREM CIÊNCIAS APENAS RESULTADOS APLICAÇÕES, FAVORECENDO SURGIMENTO CIENTIFICISMO, FUSÃO CIÊNCIA/TÉCNICA MITO NEUTRALIDADE CIENTÍFICA. CIÊNCIA TECNOLOGIA DEVEM TER REPRESENTAÇÃO SOCIAL CONCRETA, POIS, ENQUANTO SISTEMA CONHECIMENTOS CONJUNTO CONSTITUÍDO SABER/FAZER, ATIVIDADES EMBASAM VIVÊNCIAS SUJEITOS. NESSA PERSPECTIVA, SISTEMA CIÊNCIA/TECNOLOGIA ATINGE REALIDADE VIVENCIAL APROPRIAÇÃO CONHECIMENTO CIENTÍFICO PROMOVE QUESTIONAMENTO SABERES COTIDIANOS, PODENDO POSSIBILITAR-LHES INTERVENÇÃO CRIATIVA CRÍTICA REALIDADE INSEREM, TENDO VISTA COMPREENSÃO POSSÍVEL TRANSFORMAÇÃO. ATUALMENTE, ALGUMAS INICIATIVAS TÊM PROCURADO APONTAR CAMINHOS SUPERAÇÃO PROBLEMAS EXISTENTES CURSOS FORMAÇÃO PROFESSORES, TAIS FÓRUNS PERMANENTES DISCUSSÃO DELIBERAÇÃO RESPEITO PROBLEMÁTICAS VIVENCIADAS LICENCIATURAS PROPOSTAS REFORMULAÇÃO CURSOS VIGOR ALGUMAS UNIVERSIDADES PÚBLICAS BRASILEIRAS. FORMAÇÃO CRÍTICO-REFLEXIVA PROFESSORES CIÊNCIAS DEVE CONSIDERAR CONSTRUÇÃO COLETIVA PROPOSTAS EDUCATIVAS ÂMBITO ESCOLAS, POIS CONSTRUÇÃO CONHECIMENTOS ESPECÍFICOS DOCÊNCIA SURGE PARTIR APLICAÇÃO PROCEDIMENTOS TÉCNICOS ELABORADOS IMPOSTOS AGENTES EDUCACIONAIS EXTERNOS, REQUER PROCESSO SISTEMÁTICO CONTÍNUO FORMAÇÃO PROFISSIONAL.",SDEG
