Text,Author"O ENSINO DE CIÊNCIAS NO  BRASIL: HISTÓRIA, FORMAÇÃO DE PROFESSORES E DESAFIOS ATUAIS              NA DÉCADA DE 50, AS POLÍTICAS CIENTÍFICAS  E TECNOLÓGICAS PASSARAM POR UM  INTENSO PROCESSO DE INSTITUCIONALIZAÇÃO, COM O GRANDE CRESCIMENTO E PROGRESSO DO PAÍS. UM ASPECTO RELEVANTE NESSE PERÍODO FOI A MANEIRA MECANICISTA DE ANLISAR AS INTERFERÊNCIAS DA CIÊNCIA  E DA TECNOLOGIA SOBRE A SOCIEDADE , QUE DEIXAVA DE CONSIDERAR OS INTERESSES  E HÁBITOS DE DIFERENTES ATORES SOCIAIS EM SUAS MÚLTIPLAS RELAÇÕES, QUE CONSTITUIU UMA DEBILIDADE IMPORTANTE DO PENSAMENTO DESSA ÉPOCA .  NO FINAL  DA DÉCADA DE 1950 E DURANTE AS DÉCADAS DE 1960 E 1970, A PRODUÇÃO CIENTÍFICA E TECNOLÓGICA BRASILEIRA ESTEVE QUASE QUE EXCLUSIVAMENTE SOB O DOMÍNIO DO ESTADO, INCLUINDO AS QUE ERAM PRODUZIDAS NAS UNIVERSIDADES, ENTÃO  APOIANDO –SE EM CRITÉRIOS DE QUALIDADE E EXCELÊNCIA , A CIÊNCIA BRASILEIRA PASSOU A CONTAR COM NOVAS FORMAS DE ORGANIZAÇÃO.  A TECNOLOGIA MANTEVE-SE SUSTENTADA EM ÓRGÃOS SETORIAIS E FOI LEGITIMADA UM MODELO DE PLANIFICAÇÃO ESTATAL DESTINADO À RESOLUÇÃO DE PROBLEMAS PRÁTICOS E À TRANSFERÊNCIA  DE TECNOLOGIAS AOS SETORES PRODUTIVOS E DEFESA.               OS ANOS 1970 FORAM MARCADOS POR PRIVILEGIAR A CIÊNCIA PURA,  PRATICAMENTE NÃO HAVENDO MENÇÃO ÀS TECNOLOGIAS PRODUZIDAS COM BASE EM CONHECIMENTOS CIENTÍFICOS.               DURANTE OS ANOS 1980 E 1990, O ESTADO PASSOU A DIMINUR  SUAS FUNÕES REGULADORAS E PRODUTIVAS E ABRIU A ECONOMIA AO COMÉRCIO E À COMPETITIVIDADE INTERNACIONAIS. NESSE PERÍODO, A GLOBALIZAÇÃO DA ECONOMIA E A HOMOGENIZAÇÃOS DOS CRITÉRIOS DE COMPETITIVIDADE  INTERNACIONAIS. A PARTIR DO ANOS 90 TORNOU-SE CLARA A NECESSIDADE DE ANALISAR A ARTICULAÇÃO EXISTENTE ENTRE CIÊNCIA, TECNOLOGIA E SOCIEDADE. ATUALMENTE ENTENDE-SE QUE A CIÊNCIA SE MATERIALIZA EM TECNOLOGIA E QUE TRAZ CONSIGO A IDEIA DE DESENVOLVIMENTO NO PAÍS. PORÉM O CONCEITO DE DESENVOLVIMENTO QUE VEM ACOMPANHANDO O PROGRESSO DA CIÊNCIA E DA TECNOLOGIA NO BRASIL TEM SIDO PAUTADO NA IDEIA DE CRESCIMENTO ECONÔMICO, ASSOCIADO A UMA MAIOR PRODUTIVIDADE E AO AUMENTO DO CONSUMO PELOS CIDADÃOS.                 A CIÊNCIA  E  A TECNOLOGIA DEIXARAM DE SER VISTAS COMO ATIVIDADES AUTÔNOMAS QUE SEGUEM APENAS UMA LÓGICA INTERNA DE DESENVOLVIMENTO E PASSARAM A SER ENTENDIDAS COMO PROCESSOS E PRODUTOS NOS QUAIS ASPECTOS NÃO TÉCNICOS, COMO VALORES , INTERESSES PESSOAIS E PROFISSIONAIS , PRESSÕES ECONÔMICAS , ENTRE OUTROS , DESEMPENHAM UM PAPEL DECISIVO EM SUA PRODUÇÃO E UTILIZAÇÃO.                     O DESENVOLVIMENTO CIENTIFICO E TECNOLÓGICO MUNDIAL E BRASILEIRO EXERCEU E VEM EXERCENDO FORTE INFLUENCIA SOBRE O ENSINO DE CIÊNCIAS.                  A PARTIR DA SEGUNDA GUERRA MUNDIAL, A CIÊNCIA E A TECNOLOGIA TRANSFORMARAM-SE EM ENORME EMPREENDIMENTO SOCIOECONÔMICO, TRAZENDO UMA MAIOR PREOCUPAÇÃO COM O ESTUDO DAS CIÊNCIAS NOS DIVERSOS NÍVEIS DE ENSINO.                 NO ÍNICIO DOS ANOS 60 HAVIA NO BRASIL UM PROGRAMA OFICIAL PARA O ENSINO DE CIÊNCIAS, ESTABELECIDO PELO MINISTÉRIO DA EDUCAÇÃO E CULTURA (MEC). EM 1961, A LEI DE DIRETRIZES E BASES DA EDUCAÇÃO NACIONAL (LDBEN NO. 4024/61) DESCENTRALIZOU AS DECISÕES CURRICULARES QUE ESTAVAM SOB A RESPONSABILIDADE DO MEC.  NESSE PERÍODO A MAIS SIGNIFICATIVA BUSCA POR MELHORIAS NO ENSINO DE CIÊNCIAS NO ÂMBITO NACIONAL FOI A INICIATIVA DE UM GRUPO DE DOCENTES DA UNIVERSIDADE DE SÃO PAULO, SEDIADOS NO INSTITUTO BRASILEIRO DE EDUCAÇÃO, CIÊNCIA E CULTURA (IBECC), QUE SE DEDICOU À ELABORAÇÃO  DE MATERIAIS DIDÁTICOS E EXPERIMENTAIS PARA PROFESSORES E CIDADÃOS INTERESSADOS EM ASSUNTOS CIENTÍFICOS.                  AS TEORIAS DE BRUNER E O CONSTRUTIVISMO INTERACIONISTA DE PIAGET VALORIZAVAM A APRENDIZAGEM PELA DESCOBERTA; O DESENVOLVIMENTO DE HABILIDADES COGNITIVAS; SUGERIAM QUE OS ESTUDANTES DEVERIAM LIDAR DIRETAMENTE COM MATERIAIS E REALIZAR EXPERIÊNCIAS PARA APRENDER DE MODO SIGNIFICATIVO E QUE O PROFESSOR NÃO DEVERIA SER UM TRANSMISSOR DE INFORMAÇÕES , MAS ORIENTADOR DO ENSINO E DA APRENDIZAGEM.                      EM 1965, O MEC CRIOU CENTROS DE CIÊNCIAS NOS ESTADOS DA BAHIA, MINAS GERAIS, PERNAMBUCO, RIO DE JANEIRO , RIO GRANDE DO SUL E SÃO PAULO, TENDO EM VISTA DIVULGAR A CIÊNCIA NA SOCIEDADE E CONTRIBUIR COM A MELHORIA DO ENSINO DE CIÊNCIAS QUE VINHA SENDO OFERECIDO NAS ESCOLAS.                    CRIADA EM 1967, A FUNDAÇÃO BRASILEIRA PARA O DESENVOLVIMENTO DO ENSINO DE CIÊNCIAS (FUNBEC), SEDIADA NA UNIVERSIDADE DE SÃO PAULO, PRODUZIA GUIAS DIDÁTICOS E DE LABORATÓRIO, KITS PARA A REALIZAÇÃO DE EXPERIMENTOS COM O USO DE MATÉRIAS DE BAIXO CUSTO E OFERECIA ATIVIDADES DE TREINAMENTO AOS PROFESSORES. DESENVOLVIDAS PARALELAMENTE ÀS PROPOSTAS OFICIAIS DO MEC, AS ATIVIDADES EDUCATIVAS PROMOVIDAS POR ESTA INSTITUIÇÃO PROCURAVAM LEVAR OS ESTUDANTES A DESCOBRIREM COMO FUNCIONAVA A CIÊNCIA E A DESENVOLVEREM O PENSAMENTO CIENTÍFICO.                   AO LONGO DA DÉCADA DE 1980, AS PREOCUPAÇÕES COM O DESINTERESSE DOS ESTUDANTES PELAS CIÊNCIAS , A BAIXA PROCURA POR PROFISSÕES DE BASE CIENTÍFICA E A EMERGÊNCIA DE QUESTÕES CIENTÍFICAS E TECNOLÓGICAS DE IMPORTÂNCIA SOCIAL, POSSIBILITARAM MUDANÇAS CURRICULARES NO ENSINO DE CIÊNCIAS, TENDO EM VISTA COLABORAR COM A CONSTRUÇÃO DE UMA SOCIEDADE CIENTIFICAMENTE ALFABETIZADA. FUNDAMENTADAS PELAS TEORIAS COGNITIVAS , AS PESQUISAS SOBRE O ENSINO DE CIÊNCIAS PASSARAM A EVIDENCIAR AS APRENDIZAGENS INDIVIDUAIS QUE OCORRIAM EM SITUAÇÕES EDUCATIVAS, COMO TAMBÉM AS APRENDIZAGENS QUE OCORRIAM EM CONTEXTOS ESPECÍFICOS E QUE PODERIAM PERMITIR  AOS ESTUDANTES COMPREENDER  E AGIR SOBRE AS DISTINTAS REALIDADES EM QUE VIVIAM. NO ENTANTO, APESAR DE TER SIDO ACENTUADA A NECESSIDADE POSSIBILITAR-LHES O DESENVOLVIMENTO DE HABILIDADES COMO AUTONOMIA, PARTICIPAÇÃO, RESPONSABILIDADE INDIVIDUAL E SOCIAL, FORAM ENALTECIDAS PRINCIPALMENTE AS DIMENSÕES COMPORTAMENTAIS E COGNITIVAS RELACIONAS À APRENDIZAGEM DAS CIÊNCIAS , EM DETRIMENTO DA RELEVÂNCIA SOCIAL DESSE ENSINO.  OS RESULTADOS DE MUITAS DESSAS PESQUISAS PASSARAM A ORIENTAR A ELABORAÇÃO DE NOVAS PROPOSTAS CURRICULARES E A DETERMINAR NOVOS RUMOS PARA A INVESTIGAÇÃO SOBRE O ENSINO E A APRENDIZAGEM DAS CIÊNCIAS. AS PROPOSTAS EDUCATIVAS FUNDAMENTADAS PELAS TEORIAS COGNITIVISTAS REITERAVAM A NECESSIDADE DOS ESTUDANTES NÃO SEREM RECEPTORES PASSIVOS DE INFORMAÇÕES OU MEROS APRENDIZES, POIS DEVERIAM SABER USAR, QUESTIONAR, CONFRONTAR E RECONSTRUIR OS CONHECIMENTOS CIENTÍFICOS.                A PARTIR DO FINAL DOS ANOS 90 , A EDUCAÇÃO CIENTÍFICA PASSOU A SER CONSIDERADA UMA ATIVIDADE ESTRATÉGICA PARA O DESENVOLVIMENTO DO PAÍS, SENDO ESTA IDEIA COMPARTILHADA, AO MENOS VERBALMENTE, PELA CLASSE POLÍTICA, POR CIENTISTAS E EDUCADORES, INDEPENDENTEMENTE DE SUAS VISÕES IDEOLÓGICAS. ESTA IDEIA APONTAVA A EXISTÊNCIA DE COMPLEXAS INTERAÇÕES ENTRE A CIÊNCIA E A SOCIEDADE; PORTANTO O SIMPLES OFRECIEMNTO DE UM EDUCAÇÃO CIENTÍFICA ESCOLAR NÃO SERIA SUFICIENTE PARA A FORMAÇÃO DE CIDADÃOS CAPAZES DE RESISTIR ÀS INFORMAÇÕES PSEUDO-CIENTIFICAS QUE INVADIAM A SOCIEDADE DA ÉPOCA.                   NA DÉCADA DE 2000, AS DISCUSSÕES A RESPEITO DA EDUCAÇÃO CIENTÍFICA PASSARAM A CONSIDERAR COM MAIOR ÊNFASE A NECESSIDADE DE HAVER RESPONSABILIDADE SOCIAL E AMBIENTAL POR PARTE DE TODOS OS CIDADÃOS.                ATUALMENTE, O MOVIMENTO EDUCAÇÃO CIENTIFICO-TECNOLÓGICA PARA TODOS E A IDEIA DE ALFABETIZAÇÃO CIENTIFICA PARA TODOS  PRESSUPÕEM A FORMAÇÃO DE CIDADÃOS CAPAZES DE FAZER OPÇÕES DE MODO CONSCIENTE, BEM COMO A EXISTÊNCIA DE AMPLAS RELAÇÕES ENTRE A CIÊNCIA, A TECNOLOGIA, A SOCIEDADE E O MEIO AMBIENTE. A FORMAÇÃO DE PROFESSORES VEM SENDO CONSIDERADA UMA ATIVIDADE ESTRATÉGICA NO ÂMBITO DAS POLÍTICAS EDUCACIONAIS, PRINCIPALMENTE DEVIDO AO IMPORTANTE PAPEL QUE ESSES PROFISSIONAIS PODEM REPRESENTAR NAS TRANSFORMAÇÕES EDUCATIVAS E SOCIAIS.                      O PLANO NACIONAL DE EDUCAÇÃO (PNE) , APROVADO PELA LEI NO. 10.172, DE 09/01/2001, ESTA EM CONSONÂNCIA COM A CONSTITUIÇÃO FEDERAL E COM A LDBEN NO. 9394/96, SENDO UM DE SEUS OBJETIVOS A VALORIZAÇÃO DOS PROFISSIONAIS DE EDUCAÇÃO.                   NO PROCESSO DE FORMAÇÃO DE PROFESSORES DE CIÊNCIAS DEVE PREVALECER UM CONHECIMENTO-EMANCIPAÇÃO, POSSIBILITANDO-LHES REFLETIR SOBRE SUAS PRÓPRIAS PRÁTICAS EDUCATIVAS, ANALISAR E INTERPRETAR SUA ATIVIDADE PROFISSIONAL, FAZENDO DA REFLEXÃO UM INSTRUMENTO DE DESENVOLVIMENTO DO PENSAMENTO E DA AÇÃO CRÍTICA. REFLETINDO CRITICAMENTE SOBRE SEU PAPEL E SOBRE AS POSSIBILIDADES EDUCATIVAS DO ENSINO DE CIÊNCIAS, OS PROFESSORES PODERÃO DESENVOLVER UMA MAIOR COMPETÊNCIA PEDAGÓGICA E AUXILIAR OS ESTUDANTES NA CONSTRUÇÃO DE SABERES ESTRATÉGICOS E EMANCIPATÓRIOS.  NESSE PROCESSO , OS CONHECIMENTOS QUE OS PROFESSORES DEVEM CONSTRUIR VÃO ALÉM DE REGRAS , FATOS , PROCEDIMENTOS E TEORIAS ESTABELECIDAS PELA INVESTIGAÇÃO CIENTIFICA.  A REFLEXÃO SOBRE AS PRÓPRIAS PRÁTICAS EDUCATIVAS PODE FAVORECER-LHES A CONSTRUÇÃO DE TEORIAS ADEQUADAS ÀS SINGULARES SITUAÇÕES NAS QUAIS SE ENCONTRAM E POSSIBILITAR-LHES O DESENVOLVIMENTO DE ESTRATÉGIAS DE AÇÃO NUM PROCESSO NO QUAL SE REEDUCAM CRITICAMENTE E APERFEIÇOAM CONSTANTEMENTE SUA PRÁTICAS EDUCATIVAS.                NA FORMAÇÃO DO PROFESSOR DE CIÊNCIAS DEFENDE-SE A ARTICULAÇÃO ENTRE TEORIA E PRÁTICA PEDAGÓGICA, PESQUISA E ENSINO, REFLEXÃO E AÇÃO DIDÁTICA. A FORMAÇÃO DO PROFESSOR INICIA-SE ANTES MESMO DE SEU INGRESSO NO CURSO DE , PROSSEGUINDO AO LONGO DE TODA SUA CARREIRA PROFISSIONAL. O FUTURO PROFESSOR DE CIÊNCIAS CHEGA AO CURSO DE FORMAÇÃO CARREGANDO IMAGENS A RESPEITO DA CIÊNCIA, DO ENSINO DE CIÊNCIAS, DA FUNÇÃO DA ESCOLA E DA ATIVIDADE DOCENTE. SUA FORMAÇÃO DEVE ESTAR FUNDAMENTADA NA REFLEXÃO CRÍTICA SOBRE AS PRÁTICAS EDUCATIVAS E NA (RE)CONSTRUÇÃO PERMANENTE DE SUA EXPERIÊNCIA. AS MUDANÇAS NOS PROCESSOS DE FORMAÇÃO DE PROFESSORES DE CIÊNCIAS DEVERÃO OCORRER TANTO NO ÂMBITO PESSOAL QUANTO NO ÂMBITO INSTITUCIONAL.                ENSINAR CIÊNCIAS NO CENÁRIO ATUAL REQUER QUE OS PROFESSORES COMPREENDAM AS ORIGENS DAS INOVAÇÕES CIENTIFICAS E TECNOLÓGICAS; LUTEM CONTRA AS DESIGUALDADES IMPOSTAS PELO CAPITAL E PELO EXERCÍCIO DO PODER; E ABRAM NOVOS HORIZONTES AOS ESTUDANTES NO SENTIDO DE SE DESENVOLVEREM HUMANA E INTEGRALMENTE.  A EFICÁCIA DO TRABALHO DO PROFESSOR DE CIÊNCIAS ESTÁ DIRETAMENTE RELACIONADA À CAPACIDADE DE ARTICULAR PRÁTICAS EDUCATIVAS ÀS PRÁTICAS SOCIAIS, OU SEJA, O TRABALHO DESENVOLVIDO NAS ESCOLAS COM O PROCESSO DE DEMOCRATIZAÇÃO E RECONSTRUÇÃO DA SOCIEDADE.",SDMJ
"?”.    AS CIÊNCIAS NATURAIS SÃO UM CONJUNTO DA QUÍMICA, FÍSICA E BIOLÓGICA, ENVOLVENDO TAMBÉM CONTEÚDOS COMO O HISTÓRICO DA NATUREZA E DA NOSSA SOCIEDADE. A NECESSIDADE E A IMPORTÂNCIA DE ENSINAR E APRENDER CIÊNCIAS ESTA RELACIONADO AOS RESULTADOS E AOS PRODUTOS DOS AVANÇOS TECNOLÓGICOS EM QUE O CONHECIMENTO CIENTÍFICO TEM ESPECIFICIDADES QUE FAZEM DELE UM INSTRUMENTO VALIOSO PARA O INDIVIDUO VIVER NA SOCIEDADE, ESTANDO SUJEITO ÀS MUDANÇAS NA QUALIDADE DA INTERAÇÃO ENTRE O SER HUMANO E O MUNDO EM QUE VIVE.   AO LEVAR-SE EM CONTA A LEGISLAÇÃO EM VIGOR, O ENSINO DEVE ESTAR PRESENTE DESDE O INICIO DO PROCESSO DE ESCOLARIZAÇÃO, POIS DE ACORDO COM OS PARÂMETROS CURRICULARES NACIONAIS – PCN FAZ REFERENCIA PARA UMA EDUCAÇÃO NO ENSINO FUNDAMENTAL E, TODO O PAÍS.  OU SEJA, ENSINAR CIÊNCIAS É UMA TRAJETÓRIA EM QUE SE COLHEM OS CONHECIMENTOS DOS ALUNOS COMO SE ENSINA E COMO SE APRENDE. ENTRETANTO, O TRABALHO EXPERIMENTAL DEVE SER UM ATO DELIBERADO DE ENSINO E, PORTANTO, ANTECIPADAMENTE PLANEJADO PARA QUE SE TORNE ACESSÍVEL AOS DISCENTES ESTIMULANDO O CONHECIMENTO CRITICO E DAR CONDIÇÕES PARA QUE SE POSSAM IDENTIFICAR PROBLEMAS, LEVANTAR HIPÓTESES, TESTÁ-LAS E ABANDONÁ-LAS QUANDO FOR O CASO. A PARTIR DESSA PERSPECTIVA OS PROFESSORES DE CIÊNCIAS CONSEGUE PERCEBER QUE O APRENDIZADO SE TORNA, MAS SATISFATÓRIO QUANDO OS ALUNOS COLOCAM ESSAS TEORIAS EM PRATICAS DESENVOLVENDO O SENSO COMUM. O PROFESSOR EM SALA ESTARÁ SISTEMATIZANDO O CONTEÚDO PARA REALIDADE DO  FAZENDO INTERVENÇÕES, DEBATES EM SALA DE AULA E AVALIANDO O CONHECIMENTO APRENDIDO.   COM ISSO A EXPERIMENTAÇÃO É UM PROCEDIMENTO DO FAZER CIENTIFICO QUE SE DISTINGUE DAS EXPERIÊNCIAS USUAIS DO DIA-A-DIA, PORQUE É ORIENTADO POR UMA INTENÇÃO DO OBSERVADOR, QUE POR MEIO DA PESQUISA, DA EXPERIMENTAÇÃO, BUSCA RESPOSTAS A DETERMINADOS PROBLEMAS DE NATUREZA CIENTIFICA.       CONSIDERA-SE QUE APENAS O FATO DE CRIAR EXPERIMENTOS NÃO GARANTE O CONHECIMENTO CIENTIFICO, MAS OS PROFESSORES DEVEM INCENTIVAR A ORGANIZAÇÃO E REGISTRAR AS INFORMAÇÕES POR MEIO DE DESENHOS, QUADROS, LISTAS E PEQUENOS TEXTOS COMO DEMONSTRAÇÃO DO QUE SE APRENDEU DURANTE TODO O PROCESSO DE ENSINO MEDIADO PELO DOCENTE, POIS MOMENTO EM QUE O  PASSA A DESENVOLVER UMA ATIVIDADE PRÁTICA-EXPERIMENTAL, PROPOSIÇÕES SÃO FEITAS E, DIANTE DE UMA DADA SITUAÇÃO-PROBLEMA, ELE PODERÁ IDENTIFICAR POSSÍVEIS ESTRATÉGIAS PARA RESOLVÊ-LAS E INTERPRETAR OS RESULTADOS POSSIBILITANDO AOS DISCENTES UMA APROXIMAÇÃO DO ESTUDO CIENTIFICO COM UMA MELHOR COMPREENSÃO DOS PROCESSOS DE AÇÃO DAS CIÊNCIAS.  	  	RELATORIO: O ENSINO DE CIÊNCIAS NO BRASIL: HISTÓRIA, FORMAÇÃO DE PROFESSORES E DESAFIOS ATUAIS.    DURANTE O PERÍODO DO PÓS-GUERRA MARCADO PELA GUERRA FRIA E NO MUNDO INTEIRO, A PARTIR DOS ANOS 1950, AS POLÍTICAS CIENTÍFICAS E TECNOLÓGICAS PASSARAM POR UM INTENSO PROCESSO DE INSTITUCIONALIZAÇÃO, TENDO EM VISTA O CRESCIMENTO E O PROGRESSO DO PAÍS E COM ISSO TROUXE AO RESTO NO MUNDO UM CONJUNTO DE NECESSIDADES, AQUI NO BRASIL SE TINHA A NECESSIDADE DE INDUSTRIALIZAÇÃO E NA MEDIDA EM QUE ISSO FOI MUDANDO E OS PROBLEMAS SOCIAIS FORAM SURGINDO E O MEIO AMBIENTE FOI SE REESTRUTURANDO NESSE CONTEXTO FOI HAVENDO UMA SERIE DE MUDANÇAS E A CARÊNCIA DE UM PROCESSO DO ENSINO DE CIÊNCIAS ELITISTAS VOLTANDO PARA O TRABALHADO E NÃO SENDO SATISFATÓRIO COM AS ALTERAÇÕES DAS LEIS FOI MOLDANDO E APERFEIÇOANDO O ENSINO DE CIÊNCIAS.  NO FINAL DA DÉCADA DE 1950 E DURANTE AS DÉCADAS DE 1960 E 1970, A PRODUÇÃO CIENTÍFICA E TECNOLÓGICA BRASILEIRA ESTEVE QUASE QUE EXCLUSIVAMENTE SOB O DOMÍNIO DO ESTADO, INCLUINDO AQUELA GERADA NAS UNIVERSIDADES, PREDOMINANDO EM MUITOS SETORES UMA SEPARAÇÃO FORMAL ENTRE PESQUISA CIENTÍFICA E PRODUÇÃO TECNOLÓGICA. APOIANDO-SE EM CRITÉRIOS DE QUALIDADE E EXCELÊNCIA, A CIÊNCIA BRASILEIRA PASSOU A CONTAR COM LEGITIMIDADE E NOVAS FORMAS DE ORGANIZAÇÃO. NA FORMAÇÃO DE PROFESSORES É PRECISO FAZER COM QUE O CONHECIMENTO DO  DURANTE UMA ATIVIDADE DIDÁTICA SE TRANSFORME EM UM CONCEITO CIENTIFICO E QUE DURANTE A AULA OS ALUNOS SEJAM LEVADOS A UMA TOMA DE CONSCIÊNCIA PROVOCATIVA, FAZER QUESTIONAMENTOS E ENTENDER O PROCESSO CONSTRUÇÃO DO MATERIAL ELABORADO E TER UMA DISCUSSÃO DOS PROFESSORES SOBRE A TEORIA E EXPLICAÇÕES. OS PROFESSORES EM SALA PRECISAM TER UM MATERIAL DIDÁTICO, GOSTAR DE TRABALHAR EM UMA AULA QUE LEVE OS ALUNOS A PENSAREM E SEMPRE FAZER COM QUE OS ALUNOS SE APROXIMEM DO CONHECIMENTO. NO ENTANTO, A BNCC E OS CURRÍCULOS SE IDENTIFICAM NA COMUNHÃO DE PRINCÍPIOS E VALORES QUE, COMO JÁ MENCIONADO, ORIENTAM A LDB E AS DCN. DESSA MANEIRA, RECONHECEM QUE A EDUCAÇÃO TEM UM COMPROMISSO COM A FORMAÇÃO E O DESENVOLVIMENTO HUMANO GLOBAL, EM SUAS DIMENSÕES INTELECTUAL, FÍSICA, AFETIVA, SOCIAL, ÉTICA, MORAL E SIMBÓLICA. PARA A FORMAÇÃO DOS DOCENTES É PRECISO CRIAR E DISPONIBILIZAR MATERIAIS DE     ORIENTAÇÃO PARA ESTES, BEM COMO MANTER PROCESSOS PERMANENTES DE FORMAÇÃO DOCENTE QUE POSSIBILITEM CONTÍNUO APERFEIÇOAMENTO DOS PROCESSOS DE ENSINO E APRENDIZAGEM.   CONSIDERA-SE QUE O ENSINO DE CIÊNCIAS SENDO UMA ATIVIDADE HUMANA, A CIÊNCIA E A TECNOLOGIA SÃO FORTEMENTE ASSOCIADAS ÀS QUESTÕES SOCIAIS E POLITICAS. MOTIVAÇÕES APARENTEMENTE COMO A CURIOSIDADE OU PRAZER DE CONHECER SÃO IMPORTANTES NA BUSCA DE CONHECIMENTO PARA O INDIVIDUO QUE INVESTIGA A NATUREZA, MAS ESTIMULADO POR INTERESSES ECONÔMICOS E POLÍTICOS SEMPRE CONDUZEM A PRODUÇÃO CIENTIFICA OU TECNOLÓGICA.",BMM
"–    –      | DOCENTE:     DISCENTES:  DE   .   SINTESE DO ARTIGO: O ENSINO DE CIÊNCIAS NO BRASIL: HISTÓRIA, FORMAÇÃO DE PROFESSORES E DESAFIOS ATUAIS    AO LONGO DA HISTÓRIA, A PRODUÇÃO CIENTÍFICA E TECNOLÓGICA BRASILEIRA FOI REGIDA IDEOLOGICAMENTE POR UMA FORMA ACADÊMICA E INTERNACIONAL DE FAZER CIÊNCIA E SOFREU COM A FALTA DE ESTABILIDADE POLÍTICA E O AUTORITARISMO. OS PAÍSES DE PRIMEIRO MUNDO DOMINAVAM OS CRITÉRIOS CIENTÍFICOS E INVESTIAM EM NOVAS ATIVIDADES CIENTIFICA E NO ENSINO DA DISCIPLINA NAS ESCOLAS DE FORMA SIMPLES, COM EXPOSIÇÕES ORAIS, EXERCÍCIOS DE FIXAÇÃO E EVENTUALMENTE DEMONSTRAÇÕES PRÁTICAS. AS ATIVIDADES DIDÁTICAS PRESSUPUNHAM A RESOLUÇÃO DE PROBLEMAS ATRAVÉS DE ETAPAS BEM DEMARCADAS, QUE DEVERIAM POSSIBILITAR AOS ESTUDANTES PENSAR E AGIR CIENTIFICAMENTE.   AINDA QUE O MÉTODO CIENTÍFICO FOSSE UM PRESSUPOSTO EDUCATIVO AMPLAMENTE ACEITO NO CENÁRIO EDUCACIONAL, FORAM GRANDES AS DIFICULDADES DE FORMAÇÃO E TREINAMENTO DE PROFESSORES, PRINCIPALMENTE NO SENTIDO DE LEVÁ-LOS A IMPLEMENTAR DETERMINADAS PROPOSTAS EDUCATIVAS, MESMO CONSIDERANDO A ELABORAÇÃO DE SUBSÍDIOS IMPORTANTES COMO A DIDÁTICA DE CIÊNCIAS ATRAVÉS DE MÓDULOS INSTRUCIONAIS, FUNDAMENTADA NAS TEORIAS COMPORTAMENTALISTAS DE ENSINO-APRENDIZAGEM (JOULLIÉ E MAFRA, 1980).   DURANTE A GUERRA FRIA, O MÉTODO CIENTIFICO ERA VOLTADO PARA A FORMAÇÃO DOS CIDADÃOS VISANDO A POLÍTICA; PROFISSIONAIS LIBERAIS E OPERÁRIOS. AS MELHORIAS SOCIAIS SOMENTE SERIAM ALCANÇADAS SE FOSSE RESPEITADA A AUTONOMIA DA CIÊNCIA, OU SEJA, SE DEIXASSE OS INTERESSES SOCIAIS PARA ATENDER EXCLUSIVAMENTE A CRITÉRIOS INTERNOS DE EFICÁCIA TÉCNICA. CIÊNCIA E TECNOLOGIA, PORTANTO, ERAM VISTAS COMO FORMAS AUTÔNOMAS DA CULTURA E COMO POSSIBILIDADES DE COMPREENSÃO E CONQUISTA DA NATUREZA (ECHEVERRÍA, 1995; GONZÁLEZ ET AL., 1996).  NO INÍCIO DOS ANOS 1980, A EDUCAÇÃO PASSOU A SER ENTENDIDA COMO UMA PRÁTICA SOCIAL EM ÍNTIMA CONEXÃO COM OS SISTEMAS POLÍTICO-ECONÔMICOS. DESSE MODO, NUMA PERSPECTIVA CRÍTICA, O ENSINO DE CIÊNCIAS PODERIA CONTRIBUIR PARA A MANUTENÇÃO DA SITUAÇÃO VIGENTE NO PAÍS OU PARA A TRANSFORMAÇÃO DA SOCIEDADE BRASILEIRA. HAVIA MUITOS DIPLOMAS E POUCA QUALIFICAÇÃO, O ÂMBITO EDUCACIONAL SOFRIA E NECESSITAVA DA MODIFICAÇÃO DAS LICENCIATURAS CIÊNCIA INTEGRADA MAIS COMPLEMENTAÇÃO EM QUÍMICA, FÍSICA, BIOLOGIA OU MATEMÁTICA. SE O INDIVIDUO FIZESSE ESTE CURSO, ELE ESTAVA APTO PARA LICENCIAR ESSAS QUATRO DISCIPLINAS.   NA DÉCADA DE 1990, O ENSINO DE CIÊNCIAS PASSOU A CONTESTAR AS METODOLOGIAS ATIVAS E A INCORPORAR O DISCURSO DA FORMAÇÃO DO CIDADÃO CRÍTICO, CONSCIENTE E PARTICIPATIVO. TORNOU-SE EXPLÍCITA A NECESSIDADE ANALISAR A ARTICULAÇÃO EXISTENTE ENTRE CIÊNCIA, TECNOLOGIA E SOCIEDADE, O QUE POSSIBILITOU O SURGIMENTO DE UM PANORAMA MUITO MAIS COMPLEXO E DE INCERTEZAS A RESPEITO DA PRODUÇÃO CIENTÍFICA E TECNOLÓGICA, MAS DEIXANDO EVIDENTE A FALTA DE RELAÇÃO DESSA PRODUÇÃO COM AS NECESSIDADES DA MAIORIA DA POPULAÇÃO BRASILEIRA. A DEMANDA ERA ALTA, MAS NEM TODOS TINHAM ACESSO A ESSA CIÊNCIA DESENVOLVIDA.    ATUALMENTE, O MOVIMENTO EDUCAÇÃO CIENTÍFICO-TECNOLÓGICA PARA TODOS (FOUREZ, 1997) E A IDEIA DE ALFABETIZAÇÃO CIENTÍFICA PARA TODOS (MARCO, 1997) PRESSUPÕEM A FORMAÇÃO DE CIDADÃOS CAPAZES DE FAZER OPÇÕES DE MODO CONSCIENTE, BEM COMO A EXISTÊNCIA DE AMPLAS RELAÇÕES ENTRE A CIÊNCIA, A TECNOLOGIA, A SOCIEDADE E O MEIO AMBIENTE (JIMÉNEZ E OTERO, 1990; GIL PÉREZ, 1991; MEMBIELA, 1995; FOUREZ, 1997; YUS, 1997; HODSON E REID, 1998; GIL PÉREZ, 1999; VEIGA, 2002). O PAPEL DO PROFESSOR NO ENSINO DE CIÊNCIAS É NÃO IGNORAR A IMPORTÂNCIA DA CIÊNCIA E DA TECNOLOGIA, A COMPLEXIDADE DESSAS TRANSFORMAÇÕES IMPÕE AO MUNDO NOVOS OLHARES SOBRE A PRESERVAÇÃO DA VIDA DE TODAS AS ESPÉCIES  ESSAS INTENSAS TRANSFORMAÇÕES NOS PARADIGMAS DA CIÊNCIA E DO CONHECIMENTO, INFLUINDO NA PESQUISA, NA PRODUÇÃO DE CONHECIMENTOS, NOS PROCESSOS DE ENSINO E APRENDIZAGEM. NO COTIDIANO DA SALA DE AULA O PROFESSOR DEFRONTA-SE COM MÚLTIPLAS SITUAÇÕES DIVERGENTES, COM AS QUAIS NÃO APRENDE A LIDAR DURANTE SEU CURSO DE FORMAÇÃO, O QUE REQUER NOVAS FORMAS DE AGIR E A CONSTRUÇÃO DE CONHECIMENTOS ESPECÍFICOS DA DOCÊNCIA DE FORMA REFLEXIVA, CRÍTICA E PROCESSUAL, INCORPORANDO E TRANSCENDENDO OS CONHECIMENTOS ADVINDOS DA RACIONALIDADE TÉCNICA (MIZUKAMI ET AL., 2002).”  O PLANO NACIONAL DE EDUCAÇÃO (PNE), APROVADO PELA LEI Nº 10.172, DE 09/01/2001, ESTÁ EM CONSONÂNCIA COM A CONSTITUIÇÃO FEDERAL E COM A LDBEN N° 9394/96, SENDO UM DE SEUS OBJETIVOS A VALORIZAÇÃO DOS PROFISSIONAIS DA EDUCAÇÃO. NO ENTANTO, AINDA QUE NOS ÚLTIMOS ANOS TENHAM SIDO PRODUZIDOS SIGNIFICATIVOS CONHECIMENTOS A RESPEITO DE PRÁTICAS FORMATIVAS E EDUCATIVAS REALIZADAS EM DISTINTOS CONTEXTOS, AINDA SÃO EVIDENTES AS DIFICULDADES DE IMPLEMENTAÇÃO DE MUDANÇAS NAS PROPOSTAS DE FORMAÇÃO DE PROFESSORES DE CIÊNCIAS, PRINCIPALMENTE PELO FATO DE MUITOS CURSOS DE FORMAÇÃO CONTINUAREM APRESENTANDO UM CARÁTER ESTRITAMENTE DISCIPLINAR E ESSENCIALMENTE COGNITIVO. QUALIDADES E CAPACIDADES PROFISSIONAIS NECESSÁRIOS À FORMAÇÃO DOCENTE, COMO: SER ESPECIALISTA NO CONTEÚDO QUE ENSINA E NOS PROCESSOS INVESTIGATIVOS DA MATÉRIA, E É PORTADOR DE UMA RAZOÁVEL CULTURA GERAL; SABER LIDAR COM AS TECNOLOGIAS DA INFORMAÇÃO E COMUNICAÇÃO, TANTO NO QUE SE REFERE AOS CONTEÚDOS QUANTO AO SEU MANEJO; OUTRO EXEMPLO É A AJUDAR OS DISCENTES A PENSAR E AGIR EM RELAÇÃO A VALORES E ATITUDES.",FODM
"ESCOLHA UM CONTEÚDO DE CIÊNCIAS NATURAIS E DESCREVA UMA AULA DE FORMA  INTERDISCIPLINAR.    RESPOSTA    TEMA: BOTÂNICA —  A IMPORTÂNCIA DA FOTOSSÍNTESE E O BALANCEAMENTO QUÍMICO NO PROCESSO DE PRODUÇÃO DE ENERGIA.    NESSA AULA, OS ALUNOS SERIAM QUESTIONADOS E DISCUTIRIAM SOBRE A IMPORTÂNCIA DAS PLANTAS E OUTROS ORGANISMOS FOTOSSINTETIZANTES PARA OS DEMAIS SERES VIVOS, SOBRE O QUE É A FOTOSSÍNTESE E COMO ELA OCORRE QUIMICAMENTE. O TEMA SERIA ABORDADO EM FORMA DE DEBATES CONSTRUTIVOS, ONDES AS RESPOSTAS PRODUZIDAS LEVARIA A NOVAS PERGUNTAS, A CONCLUSÕES OU NOVAS REFLEXÕES. SERIA IMPORTANTE USAR O QUADRO PARA ANOTAR, ORGANIZAR PARTES IMPORTANTES DO DEBATE E EXPLICAR NOVOS PONTOS.        (IMAGEM REPRESENTATIVA)",PDJE
"–           EXERCÍCIO DE METODOLOGIA DO ENSINO DE CIÊNCIAS E DA BIOLOGIA           UTILIZANDO O LIVRO BIOLOGIA – VOLUME ÚNICO 3° EDIÇÃO. ARMÊNIO UZUNIAN & ERNESTO BIRNER. PARA ESTE EXERCÍCIO.    O CONTEÚDO DE CIÊNCIAS NATURAIS ESCOLHIDO SERÁ SOBRE GENÉTICA, ONDE SERÁ ABORDADO COM OS ALUNOS UMA INTRODUÇÃO SOBRE GENÉTICA, SOBRE MENDEL E SUA PRIMEIRA LEI, OS SEUS CONCEITOS, GENÓTIPO E FENÓTIPO, HOMOZIGOTO E HETEROZIGOTO, CROMOSSOMOS AUTOSSÔMICOS E ÁRVORES GENEALÓGICAS. DE UMA FORMA INTERDISCIPLINAR O PROFESSOR PODE ASSOCIAR OS ASSUNTOS DE GENÉTICA COM OS DE EVOLUÇÃO, NO QUE SERIA A FREQUÊNCIA DE CARACTERÍSTICAS DOMINANTES, FREQUÊNCIAS GENÉTICAS DE UMA POPULAÇÃO AO LONGO DO TEMPO, OS FATORES QUE ALTERAM A FREQUÊNCIA GENÉTICA E O SURGIMENTO DE NOVAS ESPÉCIES.",(OMVE
"–           EXERCÍCIO DE METODOLOGIA DO ENSINO DE CIÊNCIAS E DA BIOLOGIA      DA     FOI UTILIZADO O LIVRO BIOLOGIA – VOLUME ÚNICO 3° EDIÇÃO. ARMÊNIO UZUNIAN & ERNESTO BIRNER.    A ESCOLHA DE UM CONTEÚDO PARA A AULA SERÁ SOBRE O ESTUDO DA VIDA. E SOBRE ECOLOGIA, ONDE OS ALUNOS APRENDERIAM SOBRE OS ORGANISMOS E A BIOSFERA, ELEMENTOS ESSENCIAIS PARA A VIDA, AS ÁREAS DE ESTUDO DA BIOLOGIA, SE FAZENDO A PERGUNTA O QUE É VIDA? ESTUDO SOBRE SOLVENTES E SOLÚVEIS, E DE UMA FORMA INTERDISCIPLINAR, O PROFESSOR PODE ABORDAR O ASSUNTO SOBRE ECOLOGIA, NOS ASSUNTOS DE ORGANISMOS E BIOSFERA COM COMPONENTES BIÓTICOS DOS ECOSSISTEMAS, A PRODUTIVIDADE E FATORES LIMITANTES, OS ELEMENTOS ESSENCIAIS PARA A VIDA, COMO ÁGUA, CARBONO OXIGÊNIO E NITROGÊNIO.",SDEG
"–           EXERCÍCIO DE METODOLOGIA DO ENSINO DE CIÊNCIAS E DA BIOLOGIA      DA     FOI UTILIZADO O LIVRO BIOLOGIA – VOLUME ÚNICO 3° EDIÇÃO. ARMÊNIO UZUNIAN & ERNESTO BIRNER.    A ESCOLHA DE UM CONTEÚDO PARA A AULA SERÁ SOBRE O ESTUDO DA VIDA. E SOBRE ECOLOGIA, ONDE OS ALUNOS APRENDERIAM SOBRE OS ORGANISMOS E A BIOSFERA, ELEMENTOS ESSENCIAIS PARA A VIDA, AS ÁREAS DE ESTUDO DA BIOLOGIA, SE FAZENDO A PERGUNTA O QUE É VIDA? ESTUDO SOBRE SOLVENTES E SOLÚVEIS, E DE UMA FORMA INTERDISCIPLINAR, O PROFESSOR PODE ABORDAR O ASSUNTO SOBRE ECOLOGIA, NOS ASSUNTOS DE ORGANISMOS E BIOSFERA COM COMPONENTES BIÓTICOS DOS ECOSSISTEMAS, A PRODUTIVIDADE E FATORES LIMITANTES, OS ELEMENTOS ESSENCIAIS PARA A VIDA, COMO ÁGUA, CARBONO OXIGÊNIO E NITROGÊNIO.",SDFI
