Text,Author
"MUDAS ALGUMAS ESPÉCIES SUBMETIDAS EXPERIMENTOS SEREM TRANSPLANTADAS SACOS PLÁSTICOS PRETOS CAPACIDADE 4,5L, CONTENDO SUBSTRATO COMERCIAL OUTRAS PLANTAS ARBÓREAS SUBMETIDAS TRATAMENTO TOTAL CONTATO LUZ SOLAR LOCAL ABERTO TRANSPLANTADAS SOLO ADUBADO. AMBAS PLANTAS ONDE REALIZADOS EXPERIMENTOS RESULTADO, EXCETO ARBÓREAS MAIORES RESPOSTAS QUANTO CRESCIMENTO. CULTIVADAS SOLO ADUBADA MAIOR INCIDÊNCIA SOLAR, MOSTRARAM MAIOR SUCESSO CRESCIMENTO ESTABILIDADE ECOLÓGICA CULTIVADAS SACO PRETO CONTATO LUZ SOL. DEVIDO ALGUMAS ESPÉCIES SEREM CAPAZES ADAPTAR-SE DETERMINADO AMBIENTE, TANTO MAIOR MENOR GRAU (°), PLASTICIDADE FENOTÍPICA ACABA SER FUNDAMENTAL MANUTENÇÃO SOBREVIVÊNCIA ALGUMAS ESPÉCIES. ENTENDEM DEVEM ADAPTAR MANTER PROCESSO CRESCIMENTO. VEGETAIS NECESSARIAMENTE PRECISAM PLASTICIDADE FENOTÍPICA, POIS COMPOSIÇÃO INTERNA FATORES FAVOREÇAM CRESCIMENTO, EXISTA ALGO PERMITA ALTERAÇÃO FISIOLÓGICA MORFOLÓGICA, DETERMINADO AMBIENTE CLIMA. MEIOS EVOLUTIVOS CERTAS ESPÉCIES, PLASTICIDADE FENOTÍPICA FAVORECE PODE DESFAVORECER CERTO MODO, EXEMPLO, FOLHAS BOLDO MIRIM (PLECTRANTHUS NEOCHILUS SCHLTR.) CULTIVADAS SOMBRA TAMANHO 2 VEZES MAIOR CULTIVADAS SOL INTENSO, DEVIDO NECESSIDADE ENCONTRAR LUZ SOLAR.",ANNBIALEA
"RESPOSTAS ECOLOGIA EVOLUTIVA RETIRAR AMOSTRA PLANTA MATA REPLANTA-LA RECIPIENTE SOLO CARENTE ÁGUA. OUTRO AMBIENTE, DESDE POUCOS RECURSO HÍDRICOS. PLANTAS MESMA ESPÉCIE, POSSIVELMENTE RAÍZES TENDERIAM CRESCER BUSCA ÁGUA NUTRIENTES. CASO HAVER PLASTICIDADE FENOTÍPICA; PODERIA SER TER OCORRIDO EFEITO GARGALO GARRAFA, ALELOS POSSIBILITARAM PLASTICIDADE PERDIDOS SELEÇÃO NATURAL; PODERIA TER OCORRIDO OUTRO PROCESSO, EFEITO FUNDADOR, APÓS SELEÇÃO SOBROU POUCOS INDIVÍDUOS POSSUIRIAM ALELOS USAR ESTRATÉGIA. CASO TODAS POSSUÍREM ESTRATÉGIA, PODERIA SER FATO AMBIENTE PASSAVA PERÍODOS SECA SOMENTE INFORMAÇÃO GENÉTICA CONSEGUIAM SOBREVIVER REPRODUZIR, PROPAGANDO ALELOS PRÓXIMAS GERAÇÕES (SELEÇÃO NATURAL). PLANTAS POSSUÍSSEM PLASTICIDADE, PODERIAM TER SOBREVIVIDO DEVIDO OUTRAS CARACTERÍSTICAS TORNAVA CAPAZ SUPORTAR PRESSÕES MEIO. EXEMPLO CACTOS, PRECISAM CRESCER RAÍZES, POSSUEM ESTRUTURA ARMAZENA ÁGUA OUTRA EVITA PERDA ÁGUA MEIO. FAVORECERIA PRESENÇA DETERMINADA SITUAÇÃO ESTRESSE (PRESSÃO AMBIENTAL) REPETIDA INDIVÍDUOS POSSUÍSSEM DETERMINADA INFORMAÇÃO PLASTICIDADE, FAVOREÇA, CONSEGUIRIAM SUPORTAR REPRODUZIR CAUSA DESSA PLASTICIDADE, POSSUÍSSEM CONSEGUIRIAM SUPORTAR ELIMINADOS AMBIENTE. EXEMPLO PLANTA PASSA PERÍODOS SECA FREQUENTE, POSSUI ALELOS PERMITEM ALONGAMENTO RAÍZES, PLANTAS CONSEGUEM SOBREVIVER, POSSUÍSSEM ELIMINADAS AMBIENTE. FAVORECERIA AUSÊNCIA INDIVÍDUOS POSSUEM OUTRA CARACTERÍSTICAS FENOTÍPICAS POSSIBILITA SUPORTA PRESSÕES AMBIENTE, NESSE CASO PLASTICIDADE IRRELEVANTE. REPETINDO EXEMPLO CACTO, PLANTA VAI GASTAR ENERGIA FAZENDO RAÍZES CRESCEREM POSSUI OUTRAS ESTRUTURAS, DESENVOLVIDAS, SERVEM ARMAZENAR EVITAR PERDA ÁGUA NUTRIENTES, QUAIS DURAM TEMPO BASTANTE. APENAS DESPERDÍCIO ENERGIA!",PDJE
"1 - COMPETIÇÃO MEMBROS ESPÉCIES DIFERENTES USAM MESMOS RECURSOS LIMITADOS. RECURSOS COSTUMAM SER LIMITADOS HABITAT MUITAS ESPÉCIES PODEM COMPETIR CONSEGUI-LOS. EFEITO GERAL COMPETIÇÃO INTERESPECÍFICA NEGATIVO DUAS ESPÉCIES PARTICIPANTES, SEJA, CADA ESPÉCIE ESTARIA MELHOR OUTRA ESPÉCIE PRESENTE. TUDO REFERENTE COMPLEMENTARIDADE NICHO PRINCÍPIO EXCLUSÃO COMPETITIVA DIZ DUAS ESPÉCIES COMPETIDORAS PODEM CONCORRER DETERMINADO LOCAL, PRECISAM POSSUIR NICHOS REALIZADOS DIFERENTES. 2 - REFERENTE PRIMEIRO ESTUDO CASO (ASTERIONELLA FORMOSA/ SYNEDRA ULNA) OCORRÊNCIA COMPETITIVA DEVIDO RECURSO (SILICATO) APRESENTA PRINCÍPIO EXCLUSÃO COMPETITIVAS ONDE AMBAS OCUPANDO NICHO CAPACIDADE SUPORTE INFLUENCIA EXCLUSÃO ESPÉCIE. SEGUNDO CASO RELAÇÃO COEXISTÊNCIA DIVERSIDADE ESPÉCIE PEIXE-PALHAÇO RELACIONADA QUANTIDADE ANÊMONAS ONDE PRINCIPAL RECURSOS ABRIGO POSSIBILITANDO PRODUTIVIDADE PERPETUAÇÃO ESPÉCIE PEIXE, ALÉM DISSO, DEVIDO POPULAÇÃO DESSE PEIXE LIGADO RECURSO LIMITANTE ANÊMONA CRIANDO DIVERSIDADE UTILIZA DIFERENTES NICHOS DEVIDO DISTANCIAMENTO CADA ANÊMONA ESTUDO. 3 - PRINCÍPIO EXCLUSÃO COMPETITIVA OU, CHAMADO, LEI GAUSE, PROPOSIÇÃO AFIRMA QUE, AMBIENTE ESTÁVEL INDIVÍDUOS DISTRIBUEM FORMA HOMOGÊNEA, DUAS ESPÉCIES NICHOS ECOLÓGICOS PARECIDOS PODEM COEXISTIR, DEVIDO PRESSÃO EVOLUTIVA EXERCIDA COMPETIÇÃO. ACORDO PRINCÍPIO, COMPETIDORES TERMINARÁ SOBREPUJAR OUTRO, PODE ACARRETAR MUDANÇAS MORFOLÓGICAS, COMPORTAMENTAIS, DESLOCAMENTO NICHO ECOLÓGICO EXTINÇÃO ESPÉCIE DESVANTAGEM. SUMA, CONCEITO QUER DIZER COMPETIDORES COMPLETOS PODEM COEXISTIR.",FADJ
"EMBORA TEMÁTICA QUESTÃO AMBIENTAL CRESCENTE ANOS, INEGÁVEL MERGULHADOS CRISE AMBIENTAL. VEZ, NOTÁVEL TAL POSSUI ORIGEM SISTÊMICA, VEZ ESFERA MUNDIAL ATUAL GLOBALIZADA TUDO INTERLIGA, E, PODERIA SER DIFERENTE TOCANTE MEIO AMBIENTE.",SDJME
"EPISTEMOLOGIA: SIGNIFICA CIÊNCIA, CONHECIMENTO, ESTUDO CIENTÍFICO TRATA PROBLEMAS RELACIONADOS CRENÇA CONHECIMENTO, NATUREZA LIMITAÇÕES. EPISTEMOLOGIA ESTUDA ORIGEM, ESTRUTURA, MÉTODOS VALIDADE CONHECIMENTO, CONHECIDA TEORIA CONHECIMENTO RELACIONA-SE METAFÍSICA, LÓGICA FILOSOFIA CIÊNCIA. SUBSÍDIO: AUXÍLIO, AJUDA, APORTE, BENEFÍCIO. SUBSÍDIO CONTRIBUIÇÃO FINANCEIRA OUTRA ORDEM, PRESTA QUALQUER EMPRESA PARTICULARES FINALIDADE AJUDAR SOCORRER. PESSIMISTA: PESSIMISTA ADJETIVO QUALIFICA PESSOA PREFERE ENXERGAR LADO NEGATIVO COISAS, ESPERANDO SEMPRE PIOR TODAS SITUAÇÕES. PESSIMISTA OPOSTO OTIMISTA. EMPÍRICO: EMPÍRICO FATO APOIA SOMENTE EXPERIÊNCIAS VIVIDAS, OBSERVAÇÃO COISAS, TEORIAS MÉTODOS CIENTÍFICOS. EMPÍRICO CONHECIMENTO ADQUIRIDO DURANTE TODA VIDA, DIA-A-DIA, COMPROVAÇÃO CIENTÍFICA NENHUMA. DOGMA: DOGMA TERMO ORIGEM GREGA SIGNIFICA LITERALMENTE “O PENSA VERDADE”. ECÓTONO: ECÓTONO REGIÃO RESULTANTE CONTATO DOIS BIOMAS FRONTEIRIÇOS. ÁREAS TRANSIÇÃO AMBIENTAL, ONDE ENTRAM CONTATO DIFERENTES COMUNIDADES ECOLÓGICAS. RESUMO: ECOLOGIA CIÊNCIA PROPÕE AJUDAR BUSCA SOLUÇÕES PROBLEMAS ESTABELECIMENTO PRIORIDADES CONSERVAÇÃO. PORÉM, ALGUMAS MEDIDAS PLAUSÍVEIS ANALISAMOS ATENÇÃO. FATO FRAGMENTOS MENORES SEREM CONSIDERADOS MENOS PRIORITÁRIOS CONSERVAÇÃO, FRAGMENTOS MAIORES TAMANHO, LEVA REFLETIR ALGUMAS TEORIAS SER ANALISADAS CAUTELA.",JC
"CIÊNCIA VEM CADA DIA BUSCANDO ENTENDER RELAÇÕES ESTABELECIDAS SERES MEIO AMBIENTE, AFIN PROPORCIONAR HABITAT FAVORÁVEL DIVERSAS FORMA VIDA. SENDO NECESSÁRIO PRODUÇÃO CONHECIMENTO TEÓRICO COLOCADO PRÁTICA AFIN PODER ANALISAR CADA ESPÉCIE RESPECTIVAS CARACTERÍSTICAS, PODENDO ASSIM CONHECER PROCESSOS MIGRAÇÃO, EXTINÇÃO INTRODUÇÃO ESPÉCIES HABITAT, ASSIM PODER REALIZAR PROCEDIMENTOS PREVENTIVOS MANTER ESTABILIDADE, PRINCIPALMENTE AMBIENTES TIDO FRÁGEIS, BEM MANTER CONECTÂNCIA HABITATS APESAR DIMENSÕES FRACTAIS. IMPORTÂNCIA TER CONTROLE ESPÉCIES ENDÊMICAS EXÓTICAS OCORRA DESEQUILÍBRIO ECOSSISTEMA, SIM BUSQUE HARMONIA TODOS SERES DAQUELE AMBIENTE. CIÊNCIA, BUSCA SOLUÇÕES VISEM ESTABELECER PRIORIDADES CONSERVAÇÃO; FAZ-SE NECESSÁRIO CONHECIMENTO TEÓRICO PRÁTICA EFICAZ, GARANTINDO MELHORAMENTO CONSERVAÇÃO BIOLÓGICA. 2) AFIN EXPLICAR VARIAÇÃO RIQUEZA ESPÉCIES DURANTE TEMPO ECOLÓGICO. PROPÕE VARIAÇÃO RIQUEZA PODE SER CONSTANTE, AINDA MUDANÇAS TAXONÔMICAS. TEMPO ECOLÓGICO, CATÁSTROFE PERTURBAÇÕES IMPEDEM DIFICULTAM EQUILÍBRIO ESPÉCIES; IMIGRAÇÃO HOMOGÊNEOS DENTRO ARQUIPÉLAGOS. TODAS ESPÉCIES INDEPENDENTES EQUIVALENTS.. DIFICULDADE RELAÇÃO MUDANÇAS QUANTIDADE VARIEDADE EXISTENTE TÁXONS. 3) OBSTÁCULOS IMPLANTAÇÃO ESTUDOS MONITORAMENTO; PROBLEMAS DEFINIÇÃO NÚMEROS VARIÁVEIS SEREM EXAMINADAS DETERMINADAS. 4) DIVERSIDADE ESPÉCIES; CONECTÂNCIA; FORÇA INTERAÇÕES. 5) FAVORECE ELABORAÇÃO HIPÓTESES TODAVIA NAO VALOR DETERMINADO VISTO MUDANÇAS, PRINCIPALMENTE QUANTIDADE, VARIA RAPIDAMENTE, AINDA PODE FORNECER INFORMAÇÕES GRANDE IMPORTÂNCIA. 6) A: EXISTE POSTURA ÉTICA RELIGIOSA AFIN GARANTIR SOBREVIVÊNCIA DESSAS ESPÉCIES, TENDO VISTA TÊM PAPEL IMPORTANTE ECOSSISTEMA; RESTRIÇÃO DETERMINADA ÁREA SIGNIFICA FRAGILIDADE, RARAS ENDÊMICAS PRECISAM TER SEMPRE CUIDADOS AFIN MANTÊ-LAS BEM. B: PODEM CONSUMIR ESPÉCIES NATIVAS, INFECTÁ-LAS EXCLUÍ-LAS COMPETITIVAMENTE, ALTERANDO FUNCIONAMENTO ECOSSISTEMA. PODEM CONVIVER DESDE CONHECIMENTO INTERFERÊNCIA. 7) PROPÍCIO INTERFERENCIAS OUTROS AMBIENTES, VISTO CUIDAR PARTE AMBIENTE DEIXAR OUTRA PARTE DEVIDO CUIDADO NAO TENDO MUITAS VANTAGENS, DEIXA ARREDORES DEPENDENTES CONDIÇÕES MENOS FAVORECIDAS.",SDFI
"PODE-SE DIZER QUE, CONSERVAR DADO HABITAT DADA ESPÉCIE NORMALMENTE IMPLICA GASTOS RECURSOS. ENTANTO, ECOLOGIA PROPÕE AJUDAR BUSCA SOLUÇÕES PROBLEMAS AMBIENTAIS, ACREDITA-SE NECESSIDADE CRESCIMENTO TEÓRICO ECOLOGIA AUMENTAR PODER PREDITIVO CAPACIDADE RESOLVER PROBLEMAS PRÁTICOS, SEJA, CRÊ ECOLOGIA DEVA IR TEORIA EXPLICAÇÃO CASO. NISTO RESIDE GRANDE PAPEL BRASIL PODE DESEMPENHAR TERMOS AVANÇO CIENTÍFICO ECOLOGIA CONSERVAÇÃO. FRONTEIRAS GUARDAM GRANDE PARTE RIQUEZA BIOLÓGICA PLANETA, CABE DOMÍNIO SOBRE CIÊNCIAS.",BMM
"RESUMO ARTIGO - PRIORIDADES CONSERVAÇÃO: LINHA TÊNUE SEPARA TEORIAS DOGMAS ESSENCIAL ESTABELECER CRITÉRIOS PRIORIZAÇÃO AÇÕES CONSERVAÇÃO. ENTÃO ECOLOGIA SIDO MAIOR PARTE CIÊNCIA APLICADA BASES TEÓRICAS APESAR IMPORTANTES AINDA INSUFICIENTES PERTO DEMANDA COMPLEXIDADE NATUREZA EXIGE. TEORIA BIOGEOGRAFIA ILHAS DESTAS BASES. PROPÕE VARIAÇÃO RIQUEZA ESPÉCIES PODE SER CONSTANTE COMPOSIÇÃO TAXONÔMICA MUDE. EQUILÍBRIO DINÂMICO, PORTANTO. ALGUMAS IMPLICAÇÕES CONSERVAÇÃO RESERVAS MAIORES PREFERÍVEIS DEVIDO EFEITOS BORDA, AGRUPAMENTOS PREFERÍVEIS, MAIOR PROXIMIDADE FRAGMENTOS PREFERÍVEL FRAGMENTOS HABITAT DEVEM SER CONECTADOS. VARIAÇÕES CONSISTEM TEORIAS NEUTRAS ECOLOGIA. FALHAS TEORIA SIDO AMPLAMENTE EMPREGADA TRATADA QUASE DOGMA ALGUNS PESQUISADORES. ENTANTO, ESTUDO DEMONSTROU MAIOR RIQUEZA ESPÉCIES MENORES FRAGMENTOS (RODRIGUES, 1998). OUTRA QUESTÃO TEÓRICA IMPORTANTE ESTIMATIVA ESTABILIDADE. PODE SER ESTIMADA RESILIÊNCIA (VELOCIDADE RETORNO), COMPLEXIDADE DIMENSÃO FRACTAL. EXISTE IDEIA DIFUNDIDA SISTEMAS ALTA DIVERSIDADE FRÁGEIS; ENTANTO, ECOSSISTEMAS MENOS DIVERSOS RESTINGAS OUTROS ECÓTONOS PÕE MÁXIMA CHEQUE DEVIDO DOGMATIZAÇÃO MESMA EXCEÇÕES PROBLEMATIZADAS. ACREDITA-SE ATUALMENTE ECOLOGIA HOTSPOTS ÁREAS PRIORITÁRIAS PRA CONSERVAÇÃO. ALÉM ESTUDOS CIENTÍFICOS, POSIÇÃO MARCADA PERSPECTIVA “ARCA NÓE”, DEVE-SE SALVAR TODAS ESPÉCIES. RESTRIÇÃO GEOGRÁFICA NECESSARIAMENTE SINÔNIMO FRAGILIDADE ESPÉCIE. FIM, ESPÉCIES EXÓTICAS NORMALMENTE TIDAS VILÕES AMBIENTAIS. AINDA MUITAS VEZES FATO CAUSEM TRANSTORNOS, VEZ SER EXÓTICA SINÔNIMO SER INVASORA. FAZ NECESSÁRIO ECOLOGIA DESENVOLVA FACE TEÓRICA TOMADAS DECISÕES CONSERVAÇÃO ACERTADAS.",GNEM
"TERMOS: ALOCAR: DISPOR PÔR (ALGUMA COISA ALGUÉM) LOCAL ESPECÍFICO LISTAGEM SEQUÊNCIA LUGARES: ALOCAR ALUNOS. INSPECIONAR: EXAMINAR CONTROLAR: INSPECIONAR COLÉGIO. ALGORITMOS: ALGORITMO SEQUÊNCIA FINITA INSTRUÇÕES BEM DEFINIDAS AMBÍGUAS, CADA QUAIS DEVENDO SER EXECUTADAS MECÂNICA ELETRONICAMENTE INTERVALO TEMPO FINITO QUANTIDADE ESFORÇO FINITA. ENCOSTA: DECLIVE MONTANHA; PARTE MONTANHA VAI DIMINUINDO GRADUALMENTE. HOTSPOTS: INTERSEÇÃO ELEVADA CONCENTRAÇÃO ESPÉCIES ENCONTRADAS NENHUMA OUTRA PARTE NÍVEIS EXTRAORDINARIAMENTE ELEVADOS DESTRUIÇÃO HABITATS. RESUMO: ACORDO NORMAN MYERS, MAIORIA ESPÉCIES PLANTAS POSSUEM DISTRIBUIÇÃO DESIGUAL MUNDO. LEVANDO-O PENSAR QUE, ALGUMAS ÁREAS BIOLOGICAMENTE DIVERSA OUTRAS, TALVEZ MELHOR PROTEGER ÁREAS ABUNDANTES POBRES ESPÉCIES. SENDO ASSIM, BUSCOU ESTUDOS MANEIRA DECIDIR QUAIS LUGARES PLANETA IMPORTANTES PROTEGER BIODIVERSIDADE. NOTOU QUE, INFELIZMENTE, ÁREAS RICAS ESPÉCIES SOFREM DESTRUIÇÃO HABITATS, REGIÕES DENOMINOU HOTSPOTS. COMEÇARAM PESQUISAS SABER QUAIS ÁREAS IMPORTANTES SEREM CONSERVADAS, SIDO TRABALHO DIFÍCIL, VISTO HOTSPOTS GRANDE SEREM PROTEGIDOS TOTALMENTE.",JC
"ESTUDOS AMBIENTAIS, ENTENDE-SE HOTSPOT TODA ÁREA NATURAL CUJA PRESERVAÇÃO PRIORIDADE NÍVEIS MUNDIAIS RAZÃO ELEVADAS AMEAÇAS EXTINÇÃO. DEFINIÇÃO, CONSIDERADA HOTSPOT TODA ÁREA MENOS 1500 ESPÉCIES ENDÊMICAS (QUE EXISTEM NAQUELA REGIÃO) PERDEU ¾ VEGETAÇÃO ORIGINAL. BRASIL, DOIS DOMÍNIOS NATURAIS CLASSIFICADOS TAL: CERRADO MATA ATLÂNTICA. EXPRESSÃO HOTSPOT UTILIZADA VÁRIAS ÁREAS CONHECIMENTO, TECNOLOGIA INFORMAÇÃO GENÉTICA, QUER DIZER, TRADUÇÃO LIVRE, ?PONTOS QUENTES?. CIÊNCIAS AMBIENTAIS, CONCEITO DESENVOLVIDO ECÓLOGO INGLÊS NORMAN MYERS, 1988, OBJETIVO DELIMITAR ÁREAS PRESERVAÇÃO URGENTE PLANETA TERRA. ESTUDO, MYERS INICIALMENTE CLASSIFICOU DEZ DOMÍNIOS NATURAIS HOTSPOTS, INCLUINDO NOTADAMENTE FLORESTAS TROPICAIS. BRASIL, NESSE MOMENTO, INCLUIU-SE APENAS MATA ATLÂNTICA. DENTRE OUTRAS DESSAS ÁREAS, DESTACAM-SE ESPAÇO NATURAL MADAGASCAR ANDES, ÚLTIMO AMÉRICA SUL.",SDJME
"MATA ATLÂNTICA HOTSPOT MUNDO VIRTUDE GRANDE ENDEMISMO, ÁREAS SÃO, PORTANTO, LOCAIS NECESSITAM ATENÇÃO URGENTE, SENDO CONSIDERADOS PRIORITÁRIOS PROGRAMAS CONSERVAÇÃO. ATRAVÉS HOTSPOT GRUPOS CONSERVAÇÃO PODERIAM SALVAR ESPÉCIES MENOR ÁREA E, PRESUMIVELMENTE, CUSTO BAIXO OUTROS LUGARES. PROBLEMA ENCONTRADO HOTSPOT DIFICULDADE LOCALIZAR ONDE EXATAMENTE TODAS ESPÉCIES DESCONHECIDAS PODERIAM OCORRER. ISSO, COMUNIDADE CIENTÍFICA CONTINUA APERFEIÇOANDO CONHECIMENTOS SOBRE DISTRIBUIÇÕES ESPÉCIES. CIENTISTAS CADA VEZ USAM MODELOS COMPUTADORIZADOS APERFEIÇOAR ESFORÇOS. AVANÇOS SENSORIAMENTO REMOTO SISTEMAS INFORMAÇÕES GEOGRÁFICAS PERMITINDO ASSIM ESTENDER INFORMAÇÃO LIMITADA CAMPO ÁREAS GRANDES DEMAIS INSPECIONAR DETALHES. RESULTADOS DESSES MODELOS PODEM ENTÃO FORNECER DADOS ANÁLISES HOTSPOT ESCALAS REFINADAS.",BMM
"1- POOL GENÉTICO: CONJUNTO TODOS ALELOS ÚNICOS DETERMINADA POPULAÇÃO ESPÉCIE DADO MOMENTO OCUPAM DETERMINADA ÁREA GEOGRÁFICA TROCAM LIVREMENTE SI GENES FORMARÃO BASE FUNDO GENÉTICO GERAÇÃO SEGUINTE. INÓSPITAS: LOCAL CONDIÇÕES SER HABITADO ONDE CONSEGUE VIVER. INTERCAMBIÁVEIS: SIGNIFICA DUAS COISAS DIFERENTES PODEM SER USADAS ALTERNADAMENTE PROPÓSITO RESULTADO PREJUDICADO. AMORFA: FORMA DETERMINADA. FRAGMENTAÇÃO HABITATS: FRAGMENTAÇÃO HABITAT PROCESSO DIVISÃO MODIFICAÇÃO ÁREAS OCUPAÇÃO ESPÉCIE. DEFINIDA, CONCEITO, 'O CONJUNTO MECANISMOS LEVAM DESCONTINUIDADE DISTRIBUIÇÃO ESPACIAL RECURSOS CONDIÇÕES PRESENTES ÁREA, ESCALA, AFETA OCUPAÇÃO, REPRODUÇÃO SOBREVIVÊNCIA ESPÉCIE'. INSULARIDADE: PODE SER UTILIZADO CARACTERIZAR DEFINIR ILHA. CONSEGUE COMUNICAR TERRA OUTROS LOCAIS. 2- DÚVIDAS SÃO: PESSOAS SABEM IMPORTÂNCIA PRESERVARMOS NATUREZA MODO GERAL? QUAIS MEDIDAS DEVEM SER TOMADAS PRESERVAÇÃO BIODIVERSIDADE LEVADA SÉRIO? 3- LIVRO OFERECE VISÃO GERAL DESSA DIVERSIDADE BIOLÓGICA TRAZ AVISO URGENTE ALTERANDO DESTRUINDO AMBIENTES CRIARAM DIVERSIDADE FORMAS VIDA BILHÃO ANOS!",JC
"“O CONCEITO BIODIVERSIDADE HISTÓRIA ”. QUAIS TERMOS NOVOS ENCONTRADOS TEXTO? BUSQUE SIGNIFICADO DEFINIÇÃO TERMOS CONHECE. ESPÉCIES CARISMÁTICAS: ESPÉCIES FORTE APELO POPULAR SENSIBILIZANDO AFETO AFETO POPULAÇÃO CUIDADO. GERALMENTE ESPÉCIES PERFIL ELEITAS ENCABEÇAR CAMPANHAS CONSERVAÇÃO BIODIVERSIDADE. ESPÉCIES-BANDEIRAS. INTERCAMBIÁVEL: SIGNIFICA DUAS COISAS DIFERENTES PODEM SER USADAS ALTERNADAMENTE PROPÓSITO RESULTADO PREJUDICADO. AUSPÍCIOS: PROTEÇÃO, FAVOR, RECOMENDAÇÃO, APOIO, FINANCIAMENTO, MATERIAL ETC. PODE MEDIR QUANTIDADE BIODIVERSIDADE LOCAL? APENAS NÚMERO ESPÉCIES? ATUA SOMENTE GARANTIR CONSERVAÇÃO BIODIVERSIDADE? 3. ? CONCEITO BIODIVERSIDADE RECENTE IDEALIZADO WALTER G. ROSEN, NATIONAL RESEARCH COUNCIL/NATIONAL ACADEMY OF SCIENCES ( NRC/NAS ), 1985. WASHINGTON, 21 24 SETEMBRO 1986 ACONTECEU FÓRUM SOBRE DIVERSIDADE BIOLÓGICA, NOME NATIONAL FORUM ON BIODIVERSITY, SOB AUSPÍCIOS SMITHSONIAN INSTITUTE. BIODIVERSIDADE FORMA CONTRAÍDA DIVERSIDADE BIOLÓGICA APARECEU PRIMEIRA VEZ PUBLICAÇÃO 1988, JUSTAMENTE LIVRO ORGANIZADO PRESTIGIADO BIÓLOGO EDWARD O. WILSON TRAZIA RESULTADOS NATIONAL FORUM ON BIODIVERSITY. PRINCIPAL MANUAL AMERICANO SOBRE APRESENTA CAMPO CONHECIMENTO RESPOSTA COMUNIDADE CIENTÍFICA IMPACTOS HUMANOS SOBRE BIODIVERSIDADE, TAXA EXTINÇÃO ESPÉCIES HOJE 100 1000 VEZES ACIMA NORMAL ( PROCESSO EVOLUTIVO, ESPÉCIES DESAPARECEM SURGEM LONGO TEMPO ) SEJA, CRISE GLOBAL BIODIVERSIDADE.",TD
"QUESTÃO 01 1. PATRIMÔNIO NATURAL: PATRIMÔNIO NATURAL PAÍS REÚNE ÁREAS IMPORTÂNCIA PRESERVACIONISTA HISTÓRICA. ÁREAS TRANSMITEM IMPORTÂNCIA AMBIENTE NATURAL POSSAMOS LEMBRAR PASSADO, ONDE VIEMOS, FAZENDO AMBIENTE ONDE VAMOS. 2. DEMOGRAFIA:É ÁREA CIÊNCIAS SOCIAIS ESTUDA DINÂMICA POPULACIONAL HUMANA. OBJETO ESTUDO ENGLOBA DIMENSÕES, ESTATÍSTICAS, ESTRUTURA DISTRIBUIÇÃO DIVERSAS POPULAÇÕES HUMANAS. 3. LIMNOLOGIA: ESTUDO REAÇÕES FUNCIONAIS PRODUTIVIDADE COMUNIDADES BIÓTICAS LAGOS, RIOS, RESERVATÓRIOS REGIÃO COSTEIRA RELAÇÃO PARÂMETROS FÍSICOS, QUÍMICOS BIÓTICOS AMBIENTAIS. 4. INSULARIDADE: PODE SER UTILIZADO CARACTERIZAR DEFINIR ILHA. CONSEGUE COMUNICAR TERRA OUTROS LOCAIS. [FIGURADO] ESTADO DAQUILO ASSEMELHA POSSUI QUALIDADES ILHA. QUESTÃO 03 LITERATURA CIENTÍFICA, TERMOS INTERCAMBIÁVEIS DIVERSIDADE BIOLÓGICA BIODIVERSIDADE SURGIRAM DAR CONTA QUESTÕES RELACIONADAS TEMAS FUNDAMENTAIS ECOLOGIA BIOLOGIA EVOLUTIVA, RELACIONADOS DIVERSIDADE ESPÉCIES AMBIENTES SERVEM SUPORTE, TEMPO SUPORTADOS SÃO, SIMULTANEAMENTE, PALCO RESULTADO ? SEMPRE INACABADO ? PROCESSO EVOLUTIVO. BIODIVERSIDADE DIVERSIDADE BIOLÓGICA TORNARAM-SE AMPLO USO MEIOS CIENTÍFICOS ATIVISTAS CONSERVAÇÃO. SARKAR (2002)",SDJME
"CONCEITO BIODIVERSIDADE INTERDEPENDENTES. ARTIGO FRANCO APRESENTA SIGNIFICADO CONCEITO BIODIVERSIDADE HISTÓRIA , MOSTRANDO CAMINHOS PERCORRIDOS, PARTIR DIÁLOGO DIVERSOS PESQUISADORES. ABORDAGEM CRÍTICA AUTOR LEVA REFLETIR SOBRE CIÊNCIA, ÉTICA DESAFIO CONSERVAR PROTEGER BIODIVERSIDADE. 1. QUAIS TERMOS NOVOS ENCONTRADOS TEXTO? BUSQUE SIGNIFICADO DEFINIÇÃO TERMOS CONHECE. R -INSIGHT: COMPREENSÃO SÚBITA ALGUMA COISA DETERMINADA SITUAÇÃO; DEFINIÇÃO: DISCERNIMENTO, ESCLARECIMENTO. ECÓLOGO: ECOLOGIA; ECOLOGISTA; DEFINIÇÃO: ESTUDA SERES VIVOS INTERAÇÕES MEIO ONDE VIVEM. TURNOVER: VIRADA; RENOVAÇÃO; REVERSÃO; DEFINIÇÃO: ROTATIVIDADE PESSOAS. PROTÓTIPO: MODELO MOLDE FUTURAS PRODUÇÕES; DEFINIÇÕES: DESENVOLVIMENTO PRODUTOS. PROFÍCUA: PRODUTO; ÚTIL; DEFINIÇÃO: TENDE SER RENTÁVEL. DEPRESSÃO ENDOGÂMICA: FENÔMENO OCORRE ACASALAMENTOS CONSANGUÍNEOS. DEFINIÇÃO: AUMENTO HOMOZIGOSE. ORNITÓLOGO: PESSOA DEDICA ESTUDOS AVES; DEFINIÇÃO: RAMO ZOOLOGIA ESTUDA AVES. INSULARIDADE: ILHA CONJUNTO ILHAS; DEFINIÇÃO: ALGO ALGUÉM HABITA ÍNSULA (ILHA); INSULADO. ESTOCÁSTICO: DIZ-SE PROCESSOS DEPENDEM LEIS ACASO. DEFINIÇÃO: COLEÇÃO VARIÁVEIS ALEATÓRIAS QUE, GERAL, UTILIZADAS ESTUDAR EVOLUÇÃO FENÔMENOS (OU SISTEMAS) OBSERVADOS LONGO TEMPO. R - PÁG. 19, DANIEL SIMBELOFF: “ ARGUMENTAVA QUE, EMBORA RESERVAS GRANDES FUNDAMENTAIS, MUITAS PEQUENAS RESERVAS CUMPRIAM PAPEL IMPORTANTE”. PÁG. 14, “ELES ARGUMENTAM, SOBRETUDO, CONTRA GENERALIZAÇÕES, DEFENDENDO IDÉIA PEQUENAS RESERVAS ISOLADAS PODERIAM EVENTUALMENTE CONTER MAIOR NÚMERO ESPÉCIES ÚNICA GRANDE.” 3. ? R - “ PRESERVAÇÃO WILDERNES CONSERVAÇÃO BIODIVERSIDADE” TRADIÇÃO PRESERVAÇÃO WILDERNESS ABARCA AUTORES HENRY DAVID JOHN MIN, PASSANDO ALDO LEOPOLD DESEMBOCAR DEEP ECOLOGY ARNE NAESS, GEORGE SESSIONS BILL DEVALL. ENFATIZA AUTONOMIA NATUREZA SELVAGEM, ASPECTO INDOMADO SUBLIME. PERCEPÇÃO MUNDO NATURAL CRIADO HUMANOS HUMANOS CONDUZ AFIRMAÇÃO CARÁTER TRANSCENDENTAL ATRIBUIÇÃO VALOR INTRÍNSECO.",BMM
"INTERDISCIPLINARIDADE OCORRE “LIGAÇÃO” DUAS DISCIPLINAS, IMPORTANTE LEMBRAR SOMO FRAGMENTAMOS CIÊNCIAS EXATAS, NATURAIS HUMANAS; TERMO “LIGAÇÃO”. EXEMPLO BOM EXEMPLO INTERDISCIPLINARIDADE PROBLEMA SITUAÇÃO PRECISO USAR CIÊNCIAS EXATAS JUNTAS NATURAIS: SITUAÇÃO MERGULHADOR PRECISA DESCER DETERMINADA PROFUNDIDADE ENCONTRAR ORGANISMO MARINHO; NESSE CASO PRECISO CONSIDERAR PRESSÃO ÁGUA (FÍSICA), PROFUNDIDADE RELAÇÃO PRESSÃO (MATEMÁTICA), TEMPO ADAPTAÇÃO CORPO HUMANO (BIOLOGIA), ALÉM OUTROS FATORES. PERCEPTÍVEL PRECISO USAR DISCIPLINA ENTENDER TRABALHAR SITUAÇÃO. TRANSVERSALIDADE, CONTEXTO EDUCACIONAL, TRABALHO DIDÁTICO INTEGRAM TEMAS ESTUDADOS SITUAÇÕES REAIS, APROXIMAÇÃO CONHECIMENTO CIENTÍFICO ENSINADO SALA SITUAÇÕES VIVENCIADAS COTIDIANO. EXEMPLO, COMUNIDADE CIDADE SURTO DOENÇA VIRAL, RESPONSABILIDADE PROFESSORES CIÊNCIAS NATURAIS BIOLOGIA TRATAR DESTE TEMA SALA VISANDO COMPREENSÃO ASSOCIAÇÃO REALIDADE VIVIDA ALUNOS",PDJE
"SIM PARTE ALGUNS PROFESSORES POSSUEM PREPARO MAIOR, PARTE NOVOS PROFESSORES PROCURA CRIAR NOVOS MÉTODOS ENSINAR CIÊNCIAS SALA AULA ASSIM CONSEGUINDO ATENÇÃO . FALTA INTERESSE DIDÁTICA RUIM PROFESSOR. METODOLOGIA ENSINO PROFESSOR PODE ESTAR AGRADANDO ALUNOS, ASSIM POSSA SER FALTA RECURSOS AULA PRAZEROSA DIDÁTICA. INTERDISCIPLINARIDADE TRATA ENCONTRO DIVERSAS ÁREAS EDUCAÇÃO VISAM CONTRIBUIR APRENDIZADO . SEGUNDO (, 2010), ESTRATÉGIA SURGE NECESSIDADE MUDANÇAS MÉTODOS ENSINO VIABILIZAÇÃO ALGUMAS PRÁTICAS PEDAGÓGICAS DEVIDO NOVOS PROCESSOS ESPECIALIZAÇÃO SABER, INTERDISCIPLINARIDADE MOSTROU-SE RESPOSTAS COMPARTILHAR RELAÇÕES DIFERENTES ÁREAS CONHECIMENTO. TRANSVERSALIDADE TRABALHA ALGUNS TEMAS ÁREAS CONVENCIONAIS, SEJA, TEMAS DIA-A-DIA RELACIONADOS QUÍMICA, EXEMPLO, TRAZENDO MAIOR AMPLITUDE APRENDIZADO .",VE
"SOCIEDADE CONSTITUÍDAS DIFERENTES ÂNGULOS CULTURA, RELIGIÃO, COSTUMES, VARIAM INDIVÍDUOS, GRUPOS COMUNIDADE. ASSIM ESCOLA DEVE OFERECER ENSINO FORMA CONTEMPLE ALUNOS INSERIDO DENTRO DESTE CONTEXTO EDUCACIONAL. USO INTERDISCIPLINARIDADE FERRAMENTA CONTRIBUI CONHECIMENTO AMPLO, VEZ PERMITE CONHECER CONTEÚDOS FAZEM FAZEM PARTE CAMPO ESPECÍFICO, POSSIBILITANDO ASSOCIAÇÃO CONTEÚDOS OUTRAS DISCIPLINAS BEM EXPERIÊNCIAS VIVENCIADAS COTIDIANO. OUTRO PONTO IMPORTANTE, USO TRANSVERSALIDADE, DESENVOLVIDA OFERECER CONTEÚDOS PRESENTES TODAS ESFERAS, FAZENDO-SE NECESSÁRIO ACESSÍVEL COMPREENDER RELAÇÕES ESTABELECIDAS TODOS GRUPOS SOCIAIS, POIS CONTEÚDOS PRIORIZAM BEM ESTAR INDIVIDUAL COLETIVO EQUILÍBRIO HOMEM NATUREZA. USO FERRAMENTAS TECNOLÓGICAS SIMPLES USOS METODOLOGIAS DIDÁTICAS, PROFESSOR POSSA FAZER USO SALA AULA, PERMITE OFERTA LEQUE RELAÇÃO CONTEÚDOS TRABALHADOS SALA AULA, DANDO ALUNOS OPORTUNIDADE ESTUDAR REALIDADE, PENSAMENTO ANALÍTICO SOBRE ?, FAZER? FAZER?, BUSCANDO SER AGENTE TRANSFORMADOR REALIDADE FORMA CONTRIBUIR DESENVOLVIMENTO GERAL SOCIEDADE. PROFESSOR PAPEL FUNDAMENTAL NESSE PROCESSO VEZ AGENTE MEDIADOR SABERES CONSTRUÍDOS.",SDFI
"AINDA VIVENCIAMOS EDUCAÇÃO ESCOLAR TRADICIONAL, ONDE VEZES EXISTE RELAÇÃO PROFESSOR , RELAÇÃO ENSINO-APRENDIZAGEM. VEMOS ESCOLA APRISIONAM ALUNOS CATIVAM VONTADE DESCOBRIREM NOVOS CONHECIMENTO VEZES INCENTIVAM QUERER , DESEJO QUESTÃO PORQUÊ DAQUILO CONHECER PORQUE FENÔMENOS NATUREZA SEREM ASSIM TRANSFORMAR CIÊNCIA, POIS CIÊNCIA TUDO, TUDO MÉTODO CIENTÍFICO VALE ACERCA EXPERIÊNCIAS MÉTODOS CIENTÍFICOS PROFESSOR APRESENTA ALUNOS DURANTE SALA AULA, DEPENDE PROFESSOR ADMINISTRA AULAS POIS APRENDER CIÊNCIAS DIA DIA, BASTA PUXARMOS EXEMPLOS DIA DIA SINTA VONTADE ESTUDAR DESCOBRIR NOVOS CONHECIMENTOS. . INTERDISCIPLINARIDADE TRANSVERSALIDADE MÉTODOS ANDAM JUNTOS QUESTÃO TRABALHAR ALUNOS DISCIPLINAS ÂMBITO EDUCACIONAL, SEMPRE HAVER TROCA CONHECIMENTOS, ONDE PROFESSOR APRENDE FAZER AULAS JUNTOS, PODER APRENDER ENVOLVENDO REALIDADE, MOSTRANDO EXPERIÊNCIAS MUNDO, IDEIAS PEDAGÓGICAS DEVEM SER ABORDADOS SALA AULA, RELAÇÃO HOMEM-NATUREZA. DOIS MÉTODOS TRABALHAR SEMPRE HAVERÁ DIÁLOGO, CONHECER CADA SER NESSA REAÇÃO SEMPRE ENVOLVENDO ENSINO-APRENDIZAGEM. ENTÃO IMPORTANTE SABEMOS UTILIZAR PRÁTICAS EDUCACIONAIS SALA AULA. INTERDISCIPLINARIDADE ADMITIU GRANDE MELHORIA IDÉIA INTEGRAÇÃO CURRICULAR INTERESSES CADA DISCIPLINA CONSERVADOS.A TRANSVERSALIDADE INTERDISCIPLINARIDADE MODOS TRABALHAR CONHECIMENTO BUSCAM REINTEGRAÇÃO PROCEDIMENTOS ACADÊMICOS, FICARAM ISOLADOS UNS OUTROS MÉTODO DISCIPLINAR.",SSML
