Text,Author"AV. , 921 - , - ,   FONE: (81) 2122-3500 FAX: (81)3423-3066        DISCIPLINA:  – PROFª  – TURMA: CIÊNCIAS BIOLÓGICAS –  NOITE  :    DA     RESUMO ARTIGO 1  PRIORIDADE PARA CONSERVAÇÃO: A LINHA TÊNUE QUE SEPARA TEORIAS E DOGMAS         PODEMOS ANALISAR ATRAVÉS DA LEITURA DO ARTIGO “PRIORIDADE PARA CONSERVAÇÃO” A QUESTÃO DA PROBLEMÁTICA DA PRESERVAÇÃO DA NATUREZA, JÁ QUE NOSSOS GOVERNANTES NÃO VÊ ESSA QUESTÃO COMO BEM “LUCRATIVO”, ONDE SÓ HAVERÁ GASTOS FINANCEIROS PARA OS DEMAIS. PODEMOS  OBSERVAR A FALTA DE IMPORTÂNCIA QUE SE DÁ A CONSERVAÇÃO BIOLÓGICA NO NOSSO HABITAT.  PORÉM, MESMO COM OS FATORES DE RISCOS PARA A PRESERVAÇÃO DA BIODIVERSIDADE, FAUNA E FLORA, PODEMOS CONTAR COM A AJUDA DE VÁRIOS PROFISSIONAIS QUE VISAM E BUSCAM A DEFESA E CONSERVAÇÃO BIOLÓGICA EM NOSSO MEIO, COMO POR EXEMPLO OS PROFISSIONAIS DA ECOLOGIA QUE BUSCAR AJUDAR NA SOLUÇÃO DE PROBLEMAS REFERENTE AO ESTABELECIMENTO DE PRIORIDADES PARA CONSERVAÇÃO.     ALGUMAS  TEORIAS  JÁ FORAM DESENVOLVIDAS PARA EXPLICAR A VARIAÇÃO EM RIQUEZA DE ESPÉCIES DURANTE O TEMPO ECOLÓGICO. ELA PROPÕE QUE ESSA VARIAÇÃO EM RIQUEZA PODE SER CONSTANTE DURANTE O TEMPO ECOLÓGICO, AINDA QUE A COMPOSIÇÃO TAXONÔMICA MUDE. TAL TEORIA REPRESENTOU UM GRANDE AVANÇO, POIS ATÉ ENTÃO ASSUMIA-SE QUE A ESTRUTURA DE COMUNIDADES DE ILHAS OCEÂNICAS ERA ESTÁTICA E RESULTAVA DE EVENTOS ÚNICOS DE MIGRAÇÃO E EXTINÇÃO. APESAR DESSAS LIMITAÇÕES, A TBI SE CONSAGROU E EVOLUIU, AO LONGO DO TEMPO, COM RE-LEITURAS, REVISÕES E ADIÇÕES (BROWN & LOMOLINO, 1989; HUBBELL, 2001). ELA CONSISTE NUM PILAR DAS CHAMADAS TEORIAS NEUTRAS EM ECOLOGIA (VER DISCUSSÃO SOBRE TEORIAS NEUTRAS VS. TEORIAS DE NICHO EM SCARANO & DIAS, 2004). MAIS QUE ISSO, MESMO SE TRATANDO MAIS DE UMA TEORIA DESCRITIVA DE UM PADRÃO DO QUE PROPRIAMENTE EXPLICATIVA DOS PROCESSOS QUE LEVAM AO PADRÃO, SEU CONTEÚDO FOI RAPIDAMENTE INCORPORADO À PRÁTICA DA CONSERVAÇÃO. OBSERVAMOS QUE OS MÉRITOS DA TBI SÃO INEGÁVEIS, MAS NÃO DEIXA DE SER CURIOSO COMO UMA TEORIA NITIDAMENTE PROBLEMÁTICA VENHA SE PRESTANDO TÃO DECISIVAMENTE A APLICAÇÕES PRÁTICAS QUANTO À APLICAÇÃO DO DESENHO DE RESERVAS. O MAIOR RISCO NUM CENÁRIO COMO ESTE É QUE ELEMENTOS DERIVADOS DE UMA TEORIA INSUFICIENTEMENTE ROBUSTA PASSEM A SE TORNAR DOGMAS, OU ARTIGOS DE FÉ, COMO OS CHAMARIA ODUM (1975). UM EXEMPLO DE DOGMA, QUE SE DEPREENDE DA TBI, ASSIM COMO DE ESTUDOS POSTERIORES ACERCA DO EFEITO DE FRAGMENTAÇÃO DE HABITATS (VER MURCIA, 1995; LAURANCE ET AL., 1997, 1998; DIDHAM & LAWTON, 1999), É QUE FRAGMENTOS MENORES SERIAM MENOS PRIORITÁRIOS PARA CONSERVAÇÃO QUE FRAGMENTOS MAIORES EM TAMANHO. O EFEITO DE BORDA (ALTERAÇÕES FÍSICAS E MICROCLIMÁTICAS NAS BORDAS DOS FRAGMENTOS, POR VEZES COM REFLEXO NO SEU INTERIOR, IMPLICANDO REDUÇÃO DE DIVERSIDADE E OUTRAS ALTERAÇÕES BIÓTICAS) SERIA UM DOS PRINCIPAIS RESPONSÁVEIS POR ISSO.     TRATANDO-SE DO EQUILÍBRIO DINÂMICO, OU ESTABILIDADE, ENCONTRADO POR MACARTHUR & WILSON (1967) SE REFERIA A UMA RELATIVA CONSTÂNCIA NO NÚMERO DE ESPÉCIES APESAR DE MUDANÇAS EM COMPOSIÇÃO. ESTABILIDADE SERIA, PORTANTO, UMA PROPRIEDADE EMERGENTE DE ECOSSISTEMAS E RAPIDAMENTE TORNOU-SE EVIDENTE QUE SE TRATA DE UM IMPORTANTE PARÂMETRO A SE ESTIMAR PARA DETERMINAR A NECESSIDADE DE CONSERVAÇÃO DE UM DADO ECOSSISTEMA (DOAK & MARVIER, 2003). OPOSTOS AOS ECOSSISTEMAS ESTÁVEIS ESTÃO OS ECOSSISTEMAS FRÁGEIS, QUE APRESENTAM BAIXA RESISTÊNCIA E/OU RESILIÊNCIA DIANTE DE PERTURBAÇÕES. ASSIM, ECOSSISTEMAS FRÁGEIS PROVAVELMENTE SERIAM PRIORITÁRIOS EM COMPARAÇÃO AOS ESTÁVEIS E, DESTA FORMA, ESTIMAR A ESTABILIDADE PODERIA CONSTITUIR PASSO IMPORTANTE PARA TRAÇAR PRIORIDADES DE CONSERVAÇÃO. CONTUDO, ESTA NÃO É UMA TAREFA TRIVIAL. EXISTEM DIVERSAS FORMAS INDIRETAS DE SE ESTIMAR ESTABILIDADE, E A AUSÊNCIA DE MEDIDAS DIRETAS EM SI JÁ CARACTERIZA A LIMITAÇÃO DESTAS FERRAMENTAS. POR EXEMPLO, A ESTABILIDADE DE UM ECOSSISTEMA PODE SER ESTIMADA: A) A PARTIR DE SUA RESILIÊNCIA APÓS PERTURBAÇÃO; B) A PARTIR DA SUA COMPLEXIDADE; OU C) A PARTIR DA SUA DIMENSÃO FRACTAL. DISCUTO BREVEMENTE CADA UM DOS TRÊS CASOS A SEGUIR.       ASSIM TAMBÉM COMO A CONSOLIDAÇÃO DOS DOGMAS DISCUTIDOS ANTERIORMENTE, A PARTIR DE TEORIAS INSUFICIENTEMENTE ROBUSTAS E/OU DO POUCO ENTENDIMENTO DE CONCEITOS ECOLÓGICOS, REFLETE DIRETAMENTE NA TOMADA DE DECISÃO E NO ESTABELECIMENTO DE PRIORIDADES PARA CONSERVAÇÃO. UM EXEMPLO RECENTE DE ESTABELECIMENTO DE PRIORIDADE É A CLASSIFICAÇÃO DOS BIODIVERSITY HOTSPOTS PROPOSTA POR MYERS ET AL. (2000) E DISCUTIDA NESTE VOLUME NO CAPÍTULO DO PROGRAMA CBC-MATA ATLÂNTICA (2004). ESTA CLASSIFICAÇÃO APONTA 25 BIOMAS NO PLANETA COMO PRIORITÁRIOS PARA CONSERVAÇÃO, BASEADO NOS SEGUINTES CRITÉRIOS: ALTA DIVERSIDADE NUMÉRICA DE ESPÉCIES, ALTOS NÍVEIS DE ENDEMISMOS E ALTAS TAXAS DE DESTRUIÇÃO DE HABITAT. DOIS BIOMAS BRASILEIROS ATENDEM AOS CRITÉRIOS: A MATA ATLÂNTICA E OS CERRADOS. ESTA RIQUEZA NÃO TEM SIDO PRIORIDADE DE CONSERVAÇÃO NO BRASIL E NÃO ESTÁ CONTEMPLADA NA CLASSIFICAÇÃO DE HOTSPOTS E OUTRAS EXISTENTES. SE FOCALIZARMOS O EXEMPLO DAS RESTINGAS, ESTES BIOMAS TÊM BAIXO GRAU DE ENDEMISMO E DIVERSIDADE ALTA, EMBORA INFERIOR À DA MATA ATLÂNTICA SENSU STRICTO, E, TALVEZ POR ESTA COMBINAÇÃO DE FATORES, SÓ RECENTEMENTE O BRASIL TEVE MAIS UMA DENTRE POUCAS UNIDADES DE CONSERVAÇÃO FEDERAL CRIADA EM RESTINGAS: O PARQUE NACIONAL DA RESTINGA DE JURUBATIBA, EM 1998. BARBOSA ET AL. (2004) DISCUTEM O CONJUNTO DE ARGUMENTOS UTILIZADOS PARA CONVENCER OS TOMADORES DE DECISÃO DA NECESSIDADE DE CRIAÇÃO DO PARQUE. ALÉM DAS “DESVANTAGENS” RELACIONADAS À MENOR DIVERSIDADE E AO BAIXO ENDEMISMO, A ÁREA, POR SE TRATAR DE UMA ZONA DE PRAIA, TAMBÉM NÃO SE ENCAIXAVA NA RECOMENDAÇÃO DE “UNIDADES CIRCULARES AO INVÉS DE LINEARES”, DECORRENTE DA TBI. FELIZMENTE PREVALECEU O PRINCÍPIO DE QUE PROCESSOS SÃO MAIS PRIORITÁRIOS A SEREM CONSERVADOS QUE ESPÉCIES E O PARQUE VEIO A SER CRIADO. A ESTA ALTURA, UM LEITOR MAIS CRÍTICO PODE ARGUMENTAR QUE A CIÊNCIA NÃO RESPEITA FRONTEIRAS E QUE O ARCABOUÇO TEÓRICO PRODUZIDO NO MUNDO DESENVOLVIDO PODE E DEVE SER APLICADO NO MUNDO TODO E, EM GERAL, O É DE FATO (VER DRORI ET AL., 2003, PARA DISCUSSÃO SOBRE A GLOBALIZAÇÃO DA CIÊNCIA). A PESQUISA ECOLÓGICA BRASILEIRA, QUE DEFENDO SER ESSENCIAL PARA UMA MELHOR CONSERVAÇÃO DOS NOSSOS RECURSOS NATURAIS, TEM PRODUZIDO UMA GRANDE GAMA DE INTERESSANTES CASOS DE HISTÓRIA NATURAL E TEM, EM BEM MENOR FREQÜÊNCIA, TESTADO HIPÓTESES E/OU TEORIAS QUE SÃO EM GERAL PRODUZIDAS NO MUNDO DESENVOLVIDO, CONFORME JÁ DISCUTIDO. EMBORA ESTA PRODUÇÃO SEJA CLARAMENTE RELEVANTE, A BAIXA PRODUÇÃO DE TEORIAS LEVA A PROBLEMAS NA ESCALA GLOBAL E NA ESCALA LOCAL. O PROBLEMA LOCAL É DE CARÁTER ESTRATÉGICO. HORROCKS (2002) AFIRMA QUE A CIÊNCIA HOJE É MAIS IMPORTANTE DO QUE NUNCA, NÃO SÓ PELAS SUAS METAS DE RESPONDER ÀS GRANDES QUESTÕES SOBRE A VIDA, MAS TAMBÉM POR CAUSA DE SUAS RELAÇÕES COM O CAPITAL MULTICORPORATIVO E GLOBALIZADO E COM O COMPLEXO MILITARINDUSTRIAL. DAÍ EMERGIREM GRANDES CONTRADIÇÕES QUANDO A CIÊNCIA SE CONFRONTA COM PROBLEMAS LOCAIS RELACIONADOS À DESIGUALDADE ECONÔMICA, DISCÓRDIAS MORAIS E ÉTICAS E INDIFERENÇA POLÍTICA. COMO SUGERE LYOTARD (1979/1988), INFORMAÇÃO E CONHECIMENTO SÃO AS MAIS VALIOSAS MOEDAS CORRENTES DO MUNDO PÓS-MODERNO. A CIÊNCIA TRANSFORMA INFORMAÇÃO EM CONHECIMENTO ATRAVÉS DA TEORIA. LOGO, SE O BRASIL NÃO PRODUZIR TEORIA ECOLÓGICA, A RESULTANTE É QUE TEREMOS DE “COMPRAR” CONHECIMENTO E TECNOLOGIA APLICÁVEIS À CONSERVAÇÃO DA BIODIVERSIDADE, OS QUAIS, NUM CENÁRIO DE MUDANÇAS GLOBAIS, SERÃO “PRODUTOS” VENDIDOS CERTAMENTE A UM PREÇO MUITO ALTO.        PALAVRAS QUE NÃO CONHEÇO E SUAS DEFINIÇÕES    HOTSPOTS - TAMBÉM CHAMADOS DE HOTSPOSTS DE BIODIVERSIDADE, PODEM SER DEFINIDOS COMO ÁREAS COM GRANDE BIODIVERSIDADE, RICAS PRINCIPALMENTE EM ESPÉCIES ENDÊMICAS, E QUE APRESENTAM ALTO GRAU DE AMEAÇA. ESSAS ÁREAS SÃO, PORTANTO, LOCAIS QUE NECESSITAM DE ATENÇÃO URGENTE, SENDO CONSIDERADAS PRIORITÁRIAS NOS PROGRAMAS DE CONSERVAÇÃO.    ARCABOUÇO É UMA ESTRUTURA, O ESQUELETO NO CASO DOS HUMANOS E ANIMAIS, E TAMBÉM UM CONJUNTO EM QUE ALGO É BASEADO E CONSTRUÍDO. NO SENTIDO FIGURADO, ARCABOUÇO É A CAPACIDADE DE PRODUZIR ALGO. TER UM ARCABOUÇO TEÓRICO QUER DIZER TER A BASE OU DIRECIONAMENTOS INTELECTUAIS FORMADOS A PARTIR DA LEITURA DE UMA BIBLIOGRAFIA. CONSTITUI O INSTRUMENTAL NECESSÁRIO PARA COMPREENDER NOVAS TEORIAS, DESENVOLVER TESES OU SIMPLESMENTE EMBASAR UMA OPINIÃO.",MJ
":     TERMOS QUE NÃO CONHECIA   ROBUSTEZ: VIGOROSOS, FORÇA, CORAGEM OU DETERMINAÇÃO, FORTALEZA.  EPISTEMOLÓGICOS: É UMA PALVRA GREGA. SIGNIFICA CIÊNCIA, CONHECIMENTO, É O ESTUDO CIENTÍFICO QUE TRATA DOS PROBLEMAS RELACIONADOS COM A CRENÇA E O CONHECIMENTO, SUA NATUREZA E LIMITAÇÕES.   SUBSÍDIOS: ELEMENTOS DE ESTUDOS, DADOS.  ARQUIPÉLAGOS: SÃO CONJUNTOS DE ILHAS FORMADAS POR PROCESSOS VULCÂNICOS, CONTINENTAIS OU CORALÍNEO.  DOGMA: É UM TERMO DE ORIGEM GREGA QUE SIGNIFICA LITERALMENTE , O QUE SE PENSA É VERDADE.  VEGETACIONAL: RELATIVO A VEGETAIS OU A VEGETAÇÃO",FRL
"ARTIGO - PRIORIDADES PARA CONSERVAÇÃO: A LINHA TÊNUE QUE SEPARA TEORIAS E DOGMAS    DISCENTE;   DOS   DOCENTE:      1- TERMOS ABORDADOS  EPISTEMOLÓGICO: EPISTEMOLÓGICO VEM DE EPISTEMOLOGIA, QUE EM SENTIDO AMPLO É SINÔNIMO DA TEORIA DO CONHECIMENTO OU GNOSIOLOGIA. EM SENTIDO ESTRITO, DESIGNA A TEORIA DO CONHECIMENTO CIENTÍFICO. A EPISTEMOLOGIA TRATA DA NATUREZA, DA ORIGEM E VALIDADE DO CONHECIMENTO, E ESTUDA TAMBÉM O GRAU DE CERTEZA DO CONHECIMENTO CIENTIFICO NAS SUAS DIFERENTES ÁREAS, COM O OBJETIVO PRINCIPAL DE ESTIMAR A SUA IMPORTÂNCIA PARA O ESPÍRITO HUMANO.  DOGMAS: DOGMA É UM TERMO DE ORIGEM GREGA QUE SIGNIFICA LITERALMENTE “O QUE SE PENSA É VERDADE”. NA ANTIGUIDADE, O TERMO ESTAVA LIGADO AO QUE PARECIA SER UMA CRENÇA OU CONVICÇÃO, UM PENSAMENTO FIRME OU DOUTRINA  HOTSPOTS: FOCOS, EX. : “ BIODIVERSITY HOTSPOTS” – FOCOS DA BIODIVERSIDADE   ECÓTONOS: É UMA REGIÃO RESULTANTE DO CONTATO ENTRE DOIS OU MAIS BIOMAS FRONTEIRIÇOS. SÃO ÁREAS DE TRANSIÇÃO AMBIENTAL, ONDE ENTRAM EM CONTATO DIFERENTES COMUNIDADES ECOLÓGICAS  ABORDAGEM BOTTOM-UP: ENFOCAM CASOS ESPECÍFICOS E ESPERAM QUE DESTES ESTUDOS DE CASO EMERJAM EXPLICAÇÕES TEÓRICAS (DO CASO PARA A TEORIA).  ABORDAGEM TOP-DOWN: RECORREM A TEORIAS PARA IDENTIFICAR CAUSALIDADES EM SITUAÇÕES PARTICULARES (DA TEORIA PARA O CASO).  ARCABOUÇO: ESQUELETO.     2- “A BRAVE NEW WORLD”  CREIO QUE TUDO Q ESTA SENDO VISTO POR MIM NESSA CADEIRA DE  ESTA SENDO “NOVO” DEVIDO A IDÉIAS E PONTOS DE VISTAS, CREIO QUE, NUNCA FORA APRESENTADO A MIN, POR ISSO A INTITULAÇÃO “A BRAVE NEW WORLD” – UM BRAVO NOVO MUNDO, ESPERO COM O DECORRER DO PERÍODO LETIVO APRENDER E ABSORVER CONHECIMENTOS QUE ME TORNEM UM PROFISSIONAL CRITICO EM QUESTÕES COMO O MODO DE CONSERVAÇÃO EM QUE LIDAMOS HOJE E A PREOCUPAÇÃO COM POLÍTICAS PUBLICAS DEDICADAS AO TEMA.  RESUMO  	NESTE ARTIGO SCANARO, F.R. TEM COMO OBJETIVO DESTACAR COMO O AVANÇO NA PRODUÇÃO DE CONHECIMENTO E TEORIAS EM ECOLOGIA PODE-SE HAVER UMA CONSERVAÇÃO ROBUSTA AUMENTANDO SUA CAPACIDADE DE RESOLUÇÃO DE CASOS COMO TAMBÉM VEM APRESENTANDO TEORIAS APLICADAS ENCONTRADAS NO CAMPO DA CIÊNCIA DA CONSERVAÇÃO QUE ATUALMENTE INTERFEREM NA TOMADA DE DECISÕES E ESTABELECIMENTO DE PRIORIDADES DECORRENTE A CONSERVAÇÃO QUE POR MUITOS SÃO CONSIDERADO DOGMAS. SCANARO, F.R. CONTA AO LONGO DO TEXTO COMO TAIS IDÉIAS SURGIRAM E COMO ELAS SÃO TRATADAS POR ESPECIALISTAS TANTO NA PRATICA COMO NA TEORIA EM SI. DAS TAS IDÉIAS PODE-SE CITAR: A TBI (TEORIA DA CONSERVAÇÃO ILHA) E A TEORIA DA DIVERSIDADE VS. ESTABILIDADE COMO BASE PARA ALGUNS DOS DOGMAS CITADOS NO TEXTO, A APLICAÇÃO DE TAIS DOGMAS NA CLASSIFICAÇÃO DE HOTSPOSTS, COMO TAMBÉM NOS APRESENTA DOIS TIPOS DE ABORDAGEM QUE PODE-SE TRABALHAR NA ECOLOGIA PARA A RESOLUÇÃO DE PROBLEMAS (BOTTOM-UP E TOP-DOWN). POR FIM O AUTOR APRESENTA SEU PONTO DE VISTA DA CONSERVAÇÃO PARA COM O BRASIL E COMO O PAIS TEM POTENCIA DE PRODUÇÃO DE NOVAS TEORIAS QUE PODEM SER USADOS POR VÁRIOS PAÍSES FUTURAMENTE.",SDGV
"AV. , 921 - , - ,   FONE: (81) 2122-3500 FAX: (81)3423-3066        DISCIPLINA:  – PROFª  – TURMA: CIÊNCIAS BIOLÓGICAS –  NOITE  :    DA       DEFININDO PRIORIDADES DE CONSERVAÇÃO EM UM HOTSPOT DE BIODIVERSIDADE GLOBAL     DEVIDO À ATUAL CRISE DA BIODIVERSIDADE E A FALTA DE RECURSOS DESTINADOS À CONSERVAÇÃO AS ESPÉCIES AMEAÇADAS DEVEM SER DIFERENCIADAS UMAS DAS OUTRAS PARA QUE AQUELAS SOB MAIOR RISCO POSSAM RECEBER ATENÇÃO DELES. DENTRO DE UMA MESMA LINHAGEM AS ESPÉCIES TERÃO DIFERENTES IMPORTÂNCIAS RELATIVAS PARA A CONSERVAÇÃO DA DIVERSIDADE EVOLUTIVA E ECOLÓGICA ATUAL E PASSADA. OS CONSERVACIONISTAS CONSTANTEMENTE LUTAM COM A QUESTÃO DE COMO ALOCAR SEUS RECURSOS LIMITADOS A NECESSIDADES DIFERENTES. SEMPRE HÁ MAIS AMBIENTES AMEAÇADOS DO QUE RECURSOS PARA PROTEGÊ-LOS. PORÉM, SE ALGUMAS ÁREAS SÃO MAIS BIOLOGICAMENTE DIVERSAS DO QUE OUTRAS, ENTÃO TALVEZ SEJA MAIS EFICIENTE PROTEGER ESSAS ÁREAS EM VEZ DAQUELAS MAIS POBRES EM ESPÉCIES. DESDE OS ESTUDOS ORIGINAIS DE HOTSPOTS, A CIÊNCIA DE FIXAR PRIORIDADES MUDOU SEUS PARÂMETROS EM DIREÇÃO A ESCALAS MAIS REFINADAS PARA TENTAR DEFINIR ESSES PEDAÇOS MENORES. A META FINAL É IDENTIFICAR AS ÁREAS MAIS IMPORTANTES PARA A CONSERVAÇÃO E FAZER ISSO A UMA ESCALA PRÁTICA PARA IMPLEMENTAR AÇÕES CONSERVACIONISTAS. A COMUNIDADE CIENTÍFICA CONTINUA APERFEIÇOANDO NOSSO CONHECIMENTO SOBRE AS DISTRIBUIÇÕES DAS ESPÉCIES. NO PASSADO, NATURALISTAS FIZERAM NECESSARIAMENTE ISTO USANDO UMA APROXIMAÇÃO DE FORÇA BRUTA. PESSOAS IAM AO CAMPO, PROCURAVAM COISAS E ILUSTRAVAM SUA LOCALIZAÇÃO EM UM MAPA. É UMA APROXIMAÇÃO EFETIVA, MAS LENTA E CARA. ALÉM DISSO, QUANTO MENORES AS ESPÉCIES, MAIS DIFÍCIL ENCONTRÁ-LAS, E AS ESPÉCIES RESTANTES ESTÃO QUASE CERTAMENTE NA EXTREMIDADE MENOR. ACHAMOS PRIMEIRO TODAS AS ESPÉCIES GRANDES PORQUE ERAM FÁCEIS DE ENCONTRAR. A VANTAGEM É QUE OS RESULTADOS SÃO MAIS PRECISOS. A DESVANTAGEM É QUE APENAS PARA POUCAS ESPÉCIES EXISTEM DADOS SUFICIENTES PARA TAIS MODELOS. A MAIORIA DOS MODELOS ESTATÍSTICOS REQUER UMA LISTA DE LOCALIDADES ONDE UMA ESPÉCIE OCORRE, ALÉM DE MEDIDAS DE VARIÁVEIS AMBIENTAIS RELEVANTES PARA SEREM USADAS NA DERIVAÇÃO DE REGRAS ECOLÓGICAS PARA A DISTRIBUIÇÃO DAS ESPÉCIES. POR EXEMPLO, COM MUITAS LOCALIDADES INSPECIONADAS, É FÁCIL DEFINIR LIMITES ALTITUDINAIS OU CLIMÁTICOS DENTRO DOS QUAIS CERTAS ESPÉCIES OCORREM. TODAS ESTAS APROXIMAÇÕES, E OUTRAS QUE NÃO FORAM DISCUTIDAS, SÃO ÚTEIS. ELAS AUMENTAM NOSSO CONHECIMENTO DE ONDE AS ESPÉCIES ESTÃO, E OS MÉTODOS ESTÃO MELHORANDO. UMA VEZ QUE TEMOS TAL CONHECIMENTO, PODEMOS ENTÃO USÁ-LO PARA APERFEIÇOAR NOSSOS MAPAS DE PRIORIDADES DE CONSERVAÇÃO. NÓS, JUNTO COM NOSSOS COLEGAS, FIZEMOS ISSO USANDO O MODELO SIMPLES DE APROXIMAÇÃO NO HOTSPOT DA FLORESTA ATLÂNTICA. ES DE TERMOS UMA RESPOSTA DECISIVA. NÓS NÃO PRESUMIMOS TER A RESPOSTA DEFINITIVA PARA PRIORIDADES DE CONSERVAÇÃO NA FLORESTA ATLÂNTICA. CONSIDERAMOS SOMENTE AVES E UMA ÚNICA MEDIDA DE MUDANÇA DE HABITAT.",MJ
"ANÁLISE DO ARTIGO    1)  TAPEÇARIA INTRICADA, PELO QUE QUAL COMPREENDI QUE SÃO UM ENTRELAÇADO DE ESPÉCIES, OU SEJA, EM UM MESMO HABITAT HÁ INÚMEROS SERES OS QUAIS SE RELACIONAM E CONVIVEM .   CONCEITO DE TURNOVER, O QUAL ESTÁ RELACIONADO COM A ROTATIVIDADE DE ESPÉCIES EM DETERMINADO AMBIENTE.   DEPRESSÃO ENDOGÂMICA, QUE NO CASO SERIA UMA DIMINUIÇÃO NO PROCESSO DE SOBREVIVÊNCIA E REPRODUÇÃO, DIMINUINDO ASSIM A QUANTIDADE DE ESPÉCIMES DE DETERMINADA ESPÉCIES.     3) PONTUO OS SEGUINTES ARGUMENTOS:       FOI BASTANTE INTERESSANTE A EXPOSIÇÃO SOBRE A RELAÇÃO ESPÉCIE-ÁREA, ABRINDO MAIS A VISÃO SOBRE COMO E IMPORTANTE ESTUDAR NÃO APENAS O SER, MAS SUA RELAÇÃO E DESENVOLVIMENTO COM O MEIO, PARA PODER COMPREENDER COMO SE DAR O PROCESSO DE SOBREVIVÊNCIA NA DETERMINADA ÁREA.      OS PONTOS CENTRAIS DA ,  QUE SÃO A PREOCUPAÇÃO COM A EROSÃO DA BIODIVERSIDADE, CONHECIMENTO DE SUAS CAUSAS E AS AÇÕES NECESSÁRIAS PARA RESOLVER OU AMENIZAR ESSAS CAUSAS.       AS DIVERSIDADES EXISTENTES: DE ESPÉCIES, GENÉTICA E DE ECOSSISTEMAS. NA QUAL PERMITE UMA COMPREENSÃO MAIS AMPLA DE COMO SE ESTABELECE AS RELAÇÕES ENTRE OS DIVERSOS SERES, APESAR DE SUA INÚMERA VARIABILIDADE GENÉTICA E CONDIÇÕES ADAPTATIVAS.             :   DA   CURSO: CIÊNCIAS BIOLÓGICAS  PROFESSORA :",SDFI
"AV. , 921 - , - ,   FONE: (81) 2122-3500 FAX: (81)3423-3066        DISCIPLINA:  – PROFª  – TURMA: CIÊNCIAS BIOLÓGICAS –  NOITE  :    DA     O CONCEITO DA BIODIVERSIDADE E A HISTÓRIA DA .    1) QUAIS OS TERMOS NOVOS ENCONTRADOS NO TEXTO? BUSQUE O SIGNIFICADO E DEFINIÇÃO DOS TERMOS QUE VOCÊ NÃO CONHECE.    WILDERNESS – DESERTO    POOL GENÉTICO – É O CONJUNTO DE TODOS OS ALELOS ÚNICOS DE UMA DETERMINADA POPULAÇÃO OU ESPÉCIE QUE NUM DADO MOMENTO OCUPAM UMA DETERMINADA ÁREA GEOGRÁFICA QUE TROCAM LIVREMENTE ENTRE SI OS SEUS GENES E QUE FORMARÃO A BASE PARA O FUNDO GENÉTICO DA GERAÇÃO SEGUINTE.    SOB OS AUSPÍCIOS -  EQUIVALE A DIZER SOB A PROTEÇÃO, O APOIO OU O PATROCÍNIO DE … ANTIQUADO PRESSÁGIO BASEADO NA OBSERVAÇÃO DAS AVES (DO SEU NÚMERO, CANTO, VOO, ETC.); AGOURO; AUGÚRIO, SINAL DE QUE ALGUMA COISA, BOA OU MÁ, VAI ACONTECER, PRENÚNCIO, PRESSÁGIO.    FACULTOU – QUE É PERMITIDO; QUE RECEBEU PERMISSÃO; QUE SE PODE FACULTAR, PERMITIR. POSSIBILIDADE DE QUE ALGO ACONTEÇA OU SE DESENVOLVA: O PATROCÍNIO FOI FACULTADO AO EMPRESÁRIO.    INTRÍNSECO - QUE FAZ PARTE DA ESSÊNCIA DE ALGUÉM; QUE É CARACTERÍSTICO, PRÓPRIO, ESSENCIAL OU FUNDAMENTAL; INERENTE: QUALIDADE INTRÍNSECA.      2) QUAIS SUAS DÚVIDAS?    MESMO COM A LEITURA DO TEXTO QUE É BEM EXPLICATIVO, AINDA TENHO DÚVIDAS REFERENTES A QUANTAS ESPÉCIES DE NOSSA BIODIVERSIDADE ESTAMOS PERDENDO E QUAL É A CONSEQUÊNCIA DE TUDO ISSO, ONDE VAMOS PARAR? SEM FALAR QUE TENHO DUVIDADAS SOBRE QUAL É O CUSTO DO USO DA BIODIVERSIDADE?    3) O QUE VOCÊ DESTACARIA DO ARTIGO PARA COMPARTILHAR COM SEUS COLEGAS?    O QUANTO A BIODIVERSIDADE É IMPORTANTE, E O QUANTO É VARIÁVEL AS  FORMAS DE VIDA QUE PODEMOS ENCONTRAR EM UM AMBIENTE NATURAL COMO PLANTAS, ANIMAIS, MICRORGANISMOS E O MATERIAL GENÉTICO QUE OS FORMA.  ESTA DIVERSIDADE EM QUALQUER COMUNIDADE NATURAL IMPLICA EM UM EQUILÍBRIO DO ECOSSISTEMA EM QUESTÃO PORQUE CADA ESPÉCIE CUMPRE E DESENVOLVE UMA DETERMINADA FUNÇÃO ECOLÓGICA, POR ISSO É QUE A PERDA DA DIVERSIDADE, COMO CONSEQUÊNCIA DA AÇÃO VOLUNTÁRIA DO HOMEM ATRAVÉS DA CONTAMINAÇÃO, CAÇA DE ESPÉCIES QUE SE ENCONTRAM EM PROCESSO DE EXTINÇÃO, ENTRE OUTRAS QUESTÕES, ALARMAM MUITO PROFUNDAMENTE E PREOCUPAM ÀQUELES DEFENSORES DAS MESMAS E QUE NÃO DESEJAM FAZER PARTE DE UM PLANETA DEVASTADO E DESEQUILIBRADO PELAS MANOBRAS E FALTA DE CONSCIÊNCIA DE ALGUNS SERES HUMANOS.",MJ
":       1. QUAIS OS TERMOS NOVOS ENCONTRADOS NO TEXTO? BUSQUE O SIGNIFICADO E DEFINIÇÃO DOS TERMOS QUE VOCÊ NÃO CONHECE.  PROFÍCUAS -  ÚTIL, CONVENIENTE, PROVEITOSO, VANTAJOSO.  AUSPÍCIOS – PROTEÇÃO, FAVOR, RECOMENDAÇÃO .  ENTOMOLOGIA- É A ESPECIALIDADE DA BIOLOGIA QUE ESTUDA OS INSETOS SOB TODOS OS SEUS ASPECTOS E RELAÇÕES COM O HOMEM, AS PLANTAS, OS ANIMAIS E O MEIO-AMBIENTE.  ARROLADO- ATO DE ARROLAR, INVENTÁRIO, LISTA.  2 . QUAIS SUA DUVIDAS   AS ÚNICAS DÚVIDAS QUE EU TIVE AO DECORRER DA LEITURA FOI SOBRE OS SIGNIFICADOS DE ALGUMAS PALAVRAS, QUE JÁ FORAM SANADAS COM O ENCONTRO DOS SIGNIFICADOS.  3. ?  “PARECE-ME TRISTE QUE, DE UM LADO, CRIATURAS TÃO PRIMOROSAS VIVAM A VIDA INTEIRA E EXIBAM SEUS ENCANTOS APENAS NESSAS REGIÕES SELVAGENS E INÓSPITAS, FADADAS A UM BARBARISMO IRREDUTÍVEL AINDA POR MUITO TEMPO; DE OUTRO, CASO O HOMEM CIVILIZADO CHEGUE UM DIA A ESSAS TERRAS DISTANTES TRAZENDO CONSIGO LUZ MORAL, INTELECTUAL E FÍSICA AOS RECESSOS DESSAS FLORESTAS VIRGENS, PODEMOS TER CERTEZA DE QUE ELE PERTURBARÁ DE TAL MODO AS RELAÇÕES DELICADAMENTE EQUILIBRADAS DA NATUREZA ORGÂNICA E INORGÂNICA QUE PROVOCARÁ O DESAPARECIMENTO E, POR FIM, A EXTINÇÃO PRECISAMENTE DAQUELES SERES CUJA MARAVILHOSA ESTRUTURA E BELEZA SÓ ELE ESTÁ APTO A APRECIAR E DESFRUTAR: TAL CONSIDERAÇÃO CERTAMENTE NOS DIZ QUE TODAS AS COISAS VIVAS NÃO FORAM FEITAS PARA O HOMEM.”",FRL
"DISCIPLINA:   :      PROFª:      QUESTIONÁRIO RELACIONADO AO TEXTO “CONCEITO DE BIODIVERSIDADE  E A HISTÓRIA DA ”  	  DEVIDO AO FATO DE EU TER ENTRADO EM CONTADO PREVIAMENTE COM DISCIPLINAS COMO ECOLOGIA DE COMUNIDADES E ECOSSISTEMAS E BIOLOGIA DAS MUDANÇAS CLIMÁTICAS GLOBAIS HAVIA POUCOS TERMOS COM OS QUAIS EU NUNCA TIVE CONTATO. NO ENTANTO, HOUVE 3 PONTOS, UM DELES ERA NOVO E OS DEMAIS APENAS ESCLARECERAM MELHOR ALGUNS CONCEITOS PARA MIM.  A NOVIDADE FOI O CONCEITO DE WILDERNESS, ISTO É, A NATUREZA VISTA COMO SELVAGEM E INTOCÁVEL, QUASE DE FORMA POÉTICA. OS DOIS CONCEITOS QUE FICARAM MAIS CLAROS FORAM A DIFERENÇA DE ESPÉCIE EXÓTICA PARA ESPÉCIE INVASORA E A DIFERENÇA ENTRE OS TURNOVER  DA TBI E DA ECOLOGIA DE POPULAÇÕES.  NÃO TIVE GRANDES DÚVIDAS AINDA COM RELAÇÃO A ESSE TEXTO  EU DESTACARIA A IMPORTÂNCIA DE SABER CONCEITOS DE ECOLOGIA DE POPULAÇÕES E DE COMUNIDADES, ALÉM DE ALGUNS CONCEITOS SOBRE A DINÂMICA AMBIENTAL JÁ QUE A  SE UTILIZA DE TODAS ESSAS ÁREAS PARA DECIDIR SOBRE POR EXEMPLO QUE ÁREAS PRIORIZAR NAS AÇÕES CONSERVACIONISTAS.         QUAIS OS TERMOS NOVOS ENCONTRADOS NO TEXTO? BUSQUE O SIGNIFICADO E DEFINIÇÃO DOS TERMOS QUE VOCÊ NÃO CONHECE. 2. ? 3. ?",GM
"ATIVIDADE - ARTIGO NUMERO 1  “O CONCEITO DE BIODIVERSIDADE E A HISTÓRIA DA : DA PRESERVAÇÃO DA WILDERNESS À CONSERVAÇÃO DA BIODIVERSIDADE”    DISCENTE:   DOS   DOCENTE:    CURSO: CIÊNCIAS BIOLÓGICAS    1. QUAIS OS TERMOS NOVOS ENCONTRADOS NO TEXTO? BUSQUE O SIGNIFICADO E DEFINIÇÃO DOS TERMOS QUE VOCÊ NÃO CONHECE. 2. ? 3. ?     	1-   	AUSPÍCIOS – PROTEÇÃO, FAVOR, RECOMENDAÇÃO.  	PRESERVAÇÃO DA WILDERNESS – PRESERVAÇÃO DA VIDA SELVAGEM  	BIOLOGIA SISTEMÁTICA - A ÁREA DA BIOLOGIA QUE SE PREOCUPA EM ORGANIZAR, COMPREENDER E CLASSIFICAR OS SERES VIVOS.  	LIMNOLOGIA - A LIMNOLOGIA (DO GREGO, LIMNE - LAGO, E LOGOS - ESTUDO) É A CIÊNCIA QUE ESTUDA AS ÁGUAS CONTINENTAIS, INDEPENDENTE DA CONCENTRAÇÃO DE SAIS, EM RELAÇÃO AOS FLUXOS DE MATÉRIA E ENERGIA E SUAS INTERAÇÕES COM A COMUNIDADE BIÓTICA.  	INTERCAMBIÁVEL - SIGNIFICA QUE DUAS COISAS DIFERENTES PODEM SER USADAS ALTERNADAMENTE COM O MESMO PROPÓSITO SEM O QUE O RESULTADO SEJA PREJUDICADO.  	  	2-   	3- “PONTOS FUNDAMENTAIS DA : A BIODIVERSIDADE NÃO FOI FEITA PARA OS HUMANOS – E NEM POR ELES.”",SDGV
"QUESTÕES 1 E 2 DO TEXTO: TENDÊNCIAS E PERSPECTIVAS ATUAIS NO ENSINO DE CIÊNCIAS.  1) EM SUA OPINIÃO, ISTO NA PRÁTICA VEM ACONTECENDO? QUAIS AS SUAS CONSIDERAÇÕES ACERCA DESTE QUESTIONAMENTO?  R- COMO É TRATADO NO TEXTO, NÃO É ALGO QUE PODE-SE GENERALIZAR EM QUE TODOS OU NENHUM  SAI CAPACITADO E PREPARADO PARA SER UM CIDADÃO PADRÃO CONFORME O MODELO DA SOCIEDADE ATUAL. MAS DIANTE DA CRESCENTE MUDANÇA DE MODELO ESCOLAR (TRADICIONAL PARA O MODERNO) PERMITE E DEFENDE QUE OS PROFESSORES NÃO CUIDEM APENAS DA CONSTRUÇÃO DE CONHECIMENTOS DOS ASSUNTOS PADRÕES DE SALA DE AULA, MAS QUE EM CONJUNTO COM A FAMÍLIA, ENCAMINHEM A CRIANÇA EM FORMAÇÃO PARA OS DESAFIOS ALÉM DA CARREIRA PROFISSIONAL. INFELIZMENTE NÃO É ALGO 100% EFETIVO, PODENDO HAVER FALHA TANTO DO PROFESSOR, QUANTO DA AUSÊNCIA DA FAMÍLIA OU A PRÓPRIA INSTITUIÇÃO DE ENSINO/ ESTADO.     2) POR QUE OS ALUNOS SENTEM DIFICULDADES EM APRENDER CIÊNCIAS? COMO UMA DISCIPLINA QUE ESTUDA A VIDA E SEUS PROCESSOS NÃO MOTIVA O  A SE INTERESSAR EM APRENDER?  R- JUSTAMENTE POR ESTUDAR A VIDA, O  PRECISA ESTAR EM CONTATO COM O OBJETO DE ESTUDO E NÃO SER APRESENTADO À DISCIPLINA POR UM PROFESSOR QUE TRANSBORDA CONHECIMENTO, MAS NÃO SE APROFUNDA NA REALIDADE, APLICABILIDADE E A VIVÊNCIA QUE O CONTEÚDO PODE TRAZER. É FATO QUE A APRENDIZAGEM É ALGO PECULIAR DE  PARA , PORTANTO O DOCENTE PRECISA DE INÍCIO CONHECER A TURMA E IR MOLDANDO A SUA METODOLOGIA PARA QUE O ENSINAR E APRENDER POSSA SER EFETIVO E COMUM.",SABA
