Text,Author
"– – DISCIPLINA: METODOLOGIA ENSINO CIÊNCIAS BIOLOGIA DOCENTE: DISCENTE: SÍNTESE DESTACANDO PRINCIPAIS ASPECTOS ABORDADOS TEXTO LEITURA BNCC, ESPECIALMENTE DISCIPLINA CIÊNCIAS ANOS ACADÊMICOS GEROU PRESENTE ENSAIO. BNCC CONTRADIÇÃO PROPOSTAS CURRÍCULO. TRECHOS PROPOSTA CURRICULAR CRÍTICA ENGAJADA QUESTÕES SOCIOCIENTIFICAS AMBIENTAIS. CONTUDO MAIORIA BNCC OFERECE CURRÍCULO TECNICISTA. DÁ INÚMERAS HABILIDADES DISCIPLINA CIÊNCIAS ANOS FINAIS ENSINO FUNDAMENTAL, JUNTO QUAIS FALTA ESCLARECIMENTO MODO INVESTIGATIVO APLICA-LAS. BNCC CONCEPÇÕES CIÊNCIA TECNOLOGIA SOCIEDADE AMBIENTE ENTENDIDA MODO REDUCIONISTA PRINCIPALMENTE, POUCO ESCLARECIMENTO AÇÃO ANTRÓPICA DESASTRES NATURAIS EMBATES ESPECIALISTAS DEMANDAS SOCIAIS PROCESSO HISTÓRICO CIÊNCIAS. APAGAMENTO DIFERENÇAS MINORITÁRIAS BNCC, POIS CONSIDERA TODOS ALUNOS ANOS FINAIS E.F GRAU ABSTRAÇÃO INTELECTUAL. ENSINO CIÊNCIAS ALINHADO BASE FEITO TORNO TRÊS UNIDADES TEMÁTICAS ANO ANO. DOCUMENTO ESTRUTURA TRABALHO ESPIRAL, TRÊS EIXOS TEMÁTICOS REPETEM CADA ANO, PROGRESSÃO APRENDIZAGEM CONJUNTO HABILIDADES PROPOSTAS. OBJETIVO FACILITAR COMPREENSÃO, CONSTRUIR CONCEITOS GRADATIVAMENTE COMPLEXIDADE MAIOR LONGO TEMPO, CONFORME AVANÇA DESENVOLVIMENTO MATURIDADE ALUNOS. TRÊS EIXOS TEMÁTICOS TERRA UNIVERSO, MATÉRIA ENERGIA VIDA EVOLUÇÃO, MATÉRIA ENERGIA, PONTO CENTRAL DESENVOLVER CAPACIDADE ENTENDER NATUREZA MATÉRIA DIFERENTES USOS ENERGIA. ENVOLVE COMPREENDER ORIGEM, UTILIZAÇÃO PROCESSAMENTO RECURSOS NATURAIS ENERGÉTICOS. EIXO TERRA UNIVERSO, TODOS DEVEM COMPREENDER CARACTERÍSTICAS (DIMENSÕES, COMPOSIÇÃO, LOCALIZAÇÕES, MOVIMENTOS FORÇAS ATUAM ELES) TERRA, SOL, LUA OUTROS CORPOS CELESTES, BEM FENÔMENOS RELACIONADOS ELES. VIDA EVOLUÇÃO ENGLOBA ESTUDO TUDO RELACIONA SERES VIVOS: CARACTERÍSTICAS NECESSIDADES, PROCESSO EVOLUTIVO, INTERAÇÃO SERES VIVOS – PRINCIPALMENTE SER HUMANO ESTABELECE SI DEMAIS SERES VIVOS ELEMENTOS VIVOS AMBIENTE PRESERVAÇÃO BIODIVERSIDADE. BNCC INCENTIVA DEIXAR LADO MERA TRANSMISSÃO CONTEÚDO AULAS EXPOSITIVAS MEMORIZAÇÃO, AINDA PRESENTE MUITAS ESCOLAS. AGORA, PROFESSOR FUNÇÃO SER FONTE INFORMAÇÃO E, PRINCIPALMENTE, ORIENTAR AÇÕES INVESTIGATIVAS ALUNOS –ENSINANDO-OS UTILIZAR FERRAMENTAS PESQUISA, ANALISAR DADOS, CONTRAPOR INFORMAÇÕES ETC – APRENDAM AUTONOMIA. LETRAMENTO CIENTÍFICO DEVE SER DESENVOLVIDO LONGO ENSINO FUNDAMENTAL. PROPOSTA CRIANÇAS JOVENS ACESSO DIVERSIDADE CONHECIMENTOS CIENTÍFICOS PRODUZIDOS LONGO HISTÓRIA – MEIO, EXEMPLO, LEITURA, COMPREENSÃO INTERPRETAÇÃO ARTIGOS TEXTOS CIENTÍFICOS – PRINCIPAIS PROCESSOS, PRÁTICAS PROCEDIMENTOS INVESTIGAÇÃO CIENTÍFICA. RELAÇÃO CIÊNCIA-TECNOLOGIA MANTÉM OBJETO ESTUDO, ESTUDANTE UTILIZA CONCEITOS CIENTÍFICOS COMPREENDER TECNOLOGIA. MAS, AGORA, INDICAÇÃO DIRETA UTILIZAÇÃO TECNOLOGIAS DIGITAIS INFORMAÇÃO COMUNICAÇÃO PRODUZIR CONHECIMENTO RESOLVER PROBLEMAS CIÊNCIAS. QUAIS DESAFIOS METODOLÓGICOS PODE APONTAR ENSINO CIÊNCIAS MEDIANTE PROPOSTA BNCC ENSINO CIÊNCIAS? R.: PODEMOS ANALISAR DIVERSOS DESAFIOS, INCLUIR INVESTIGAÇÃO PROCESSO APRENDIZAGEM, TRABALHAR LETRAMENTO CIENTÍFICO, PROPÕE PROGRESSÃO APRENDIZAGEM HABILIDADES SENDO DESENVOLVIDAS ANO ANO. PROFESSOR HABITUADO ENSINAR VAI APARECER ORGANIZAÇÃO DIFERENTE: PRINCIPAIS NOVIDADES DENTRO METODOLOGIA ENSINO BIOLOGIA EIXOS TEMÁTICOS TERRA UNIVERSO, MATÉRIA ENERGIA VIDA EVOLUÇÃO.",MJ
"SÍNTESE TENDO VISTA CONHECIMENTOS APRENDIZAGEM BASE SEGUINTES CRITÉRIOS: • FUNDAMENTAL RELEVANTE. • SENDO ENSINADO. • QUE: APROFUNDAR MANEIRA SIGNIFICATIVA. ALÉM DISSO, SELEÇÃO DEVE PRIORIZAR OBJETOS CONHECIMENTO TANGE PROBLEMÁTICA ACERCA ASSUNTO. ISSO, ENSINO FUNDAMENTAL RELEVANTE PRECISO ENVOLVA HISTÓRIA NATUREZA ASSIM HOMENS MULHERES. ENTÃO PORQUE ENSINAR CIÊNCIAS, PONTO ESTUDANTES PRECISAM APRENDER POSICIONA-SE MANEIRA CRITICA CONSTRUTIVISTA SOCIEDADE. DEVE-SE ENSINAR CIÊNCIAS, FORMAÇÃO ÉTICA; TRANSFORMAR AMBIENTE DENTRO LIMITES CONHECERMOS CORPO; UTILIZAR DIFERENTES LINGUAGENS; UTILIZAR DIFERENTES FORMAR INFORMAÇÕES TECNOLÓGICAS DISCUSSÃO TEMÁTICAS SOBRE PROBLEMÁTICAS LOCAIS; MUNDO TODO PLANETA. APROFUNDAMENTO SIGNIFICATIVO ENSINO CIÊNCIAS DOCENTE SABER PERCEPÇÃO CRIANÇAS ADULTOS APRENDIZAGEM CONHECIMENTO DIFERENTES NECESSÁRIO CRIANÇAS APRENDAM NECESSÁRIO CONHECIMENTO FÍSICO AONDE PODERÃO PEGAR MATERIAL LOGO CRIANÇAS PODERÃO PASSAR CONHECIMENTO MATEMÁTICO PASSAM PERCEBER DIMENSÃO VOLUME PESO, LOGO CRIANÇAS PASSAM NOVA DIMENSÃO SOCIAL VAI SER CONVENÇÃO CORES POSSAM COMEÇAR PERCEBER DIFERENÇAS FIM ESCOLA ESCOLA MANTER REGRADA CRIANÇAS VÃO SENTIR ESCOLA, ENTRETANTO, ESCOLA DAR LIBERDADE ESTUDANTES FAZEREM PERGUNTAS ENFATIZAR SOBRE PENSAM SOBRE ASSUNTO. NESSE SENTIDO, PROFESSOR SALA AULA DEVE OBSERVAR CRIANÇAS DEVE PROVOCAR RACIOCÍNIO FAZENDO PERGUNTAS INTELIGENTES, MUNDO CHEIO DIFERENTES MÉTODOS TECNOLÓGICOS CRIANÇAS CONSEGUEM TER ACESSO CASAS OBTÉM NOVOS ESTÍMULOS APRENDIZAGEM MODO PRIMOROSA LÚDICA. DOCENTE IRÁ ABORDAR IDEIAS GERADORAS MODO DEVEM SER DESENVOLVIDAS SEQUÊNCIA COERENTE ATRAVÉS SEQUÊNCIA OBJETOS CONHECIMENTO HABILIDADES EXEMPLO: MATERIAIS TRANSFORMAÇÕES. SENDO IMPORTANTE EXPLICITAR OBJETIVOS DESTAS RELAÇÕES TEMAS DESENVOLVERIAM APROFUNDAR OBJETO CONHECIMENTO SOB PERSPECTIVA COMPLEMENTAR, TANTO PONTO VISTA FÍSICA IMPACTO SAÚDE. BNCC SER DOCUMENTO PLURAL, CONTEMPORÂNEO, ESTABELECER CLAREZA CONJUNTO APRENDIZAGENS ESSENCIAIS INDISPENSÁVEIS TODOS ESTUDANTES, CRIANÇAS, JOVENS ADULTOS DIREITOS. ENTRETANTO, REDES ESCOLAS SENDO PUBLICAS PRIVADAS PASSAM TER REFERENCIA CURRICULAR NACIONAL ELABORAÇÃO ADEQUAÇÃO METODOLOGIAS ENSINO. TRATANDO-SE POLITICA EDUCACIONAL ARTICULADA INTEGRADORA FAZENDO-SE CUMPRIR PRINCÍPIOS BNCC EXPLICITA COMPROMISSO ESTADO BRASILEIRO PROMOVER EDUCAÇÃO ACOLHEDORA, RECONHECIMENTO DESENVOLVIMENTO PLENO CAPACIDADE ESTUDANTES. CONSIDERA-SE QUE, TRÁS CONTEÚDO DESEJA APRENDA CONHECIMENTO MÍNIMO ESTUDANTE DEVE TER. BNCC DEFINE COMPETÊNCIAS TRÁS VISÃO EDUCAÇÃO VOLTADA MUNDO CIENTIFICO ENSINO CIÊNCIAS ABORDAGEM CONCEITOS PROCEDIMENTOS. NESSE DESDOBRAMENTO COMPETÊNCIAS VÃO ARTICULAR HABILIDADES DESENVOLVIDAS. DESAFIOS ENFRENTADOS: FALTA PRATICIDADE PROFESSOR IR DIRETO REALMENTE RELEVANTE SOBRE CONTEÚDO, FORMAÇÃO DOCENTE PEDAGOGIA SEMPRE BOA FORMAÇÃO PERSPECTIVA ENSINO CIÊNCIA, FAZER BONS QUESTIONAMENTOS APRENDA FAZER PERGUNTAS POIS NECESSÁRIO PLANEJAMENTO ANTECIPADO MEDIADOR NESSE PROCESSO ENSINO APRENDIZAGEM. PROFESSOR DEVE FAZER ATIVIDADES EXPERIMENTAIS FUNDAMENTAIS ELABORAÇÃO RELATÓRIOS SOBRE EXPERIMENTOS. FAZER REFLEXÃO SOBRE ANALISE FALHAS PROCESSO PORQUÊ TEREM ACONTECIDO, REFORÇANDO ASSIM IMPORTÂNCIA OBSERVAÇÃO COMPROMETIMENTO TODOS ENVOLVIDOS REALIZAÇÃO EXPERIMENTO ALUNOS.",BMM
"ANÁLISE CRÍTICA BNCC CIÊNCIAS - SÍNTESE DESAFIOS METODOLÓGICOS MEDIANTE PROPOSTA BNCC ENSINO CIÊNCIAS CONSTRUÇÃO BASE NACIONAL COMUM CURRICULAR (BNCC) BRASIL GRANDE AVANÇO PERMITIR ARTICULAÇÃO CLARA COESA OBJETIVOS EDUCAÇÃO. BASE ESTABELECE CONTEÚDOS DEVEM SER TRABALHADOS ALUNOS POSSAM ENFRENTAR, ÊXITO, DESAFIOS MUNDO CONTEMPORÂNEO. INCLUSÃO TECNOLOGIA ENGENHARIA EDUCAÇÃO BÁSICA, GARANTINDO ESTUDANTES RELACIONAR-SE TECNOLOGIAS IMPACTAM VIDAS COTIDIANAS APENAS USUÁRIOS PASSIVOS. ENSINAR, CRIANÇAS JOVENS, CONHECIMENTOS, ATITUDES HABILIDADES PERMITAM INTERAÇÃO TECNOLOGIAS MANEIRA PROATIVA, REFLEXIVA ÉTICA. FORMAR CIDADÃOS CAPAZES COMPREENDER, UTILIZAR CRIAR TECNOLOGIAS RESOLUÇÕES PROBLEMAS INDIVIDUAIS COLETIVOS. PRÁTICAS ENGENHARIA TÊM COMUM CIÊNCIA, DENTRO CONTEXTO TECNOLÓGICO PRINCÍPIOS ENGENHARIA SISTEMAS, DIVERSOS PAÍSES TÊM BASES UNIDADES SOBRE RESOLUÇÃO PROBLEMAS, ENGENHARIA TECNOLOGIA. TAL MUDANÇA PARADIGMA REQUER ABORDAGEM CONSISTENTE TEMA TECNOLOGIA ENGENHARIA DENTRO BNCC-C. EXPERIÊNCIAS INTERNACIONAIS DIVERSOS PAÍSES FIZERAM REVISÕES BASES CURRICULARES REVELAM ALTA RELEVÂNCIA TECNOLOGIA – PASSOU TEMA TRANSVERSAL ÁREA CONHECIMENTO CIÊNCIAS. TECNOLOGIA INFORMAÇÃO GARANTE MELHOR QUALIDADE VIDA, VISANDO ÁREA SAÚDE. ÁREA APLICAÇÕES SAÚDE VASTA COBRE DESDE USO TECNOLOGIA INFORMAÇÃO APOIO GESTÃO SAÚDE ASPECTOS ESPECIALIZADOS ASSISTÊNCIA, TAIS EXAMES TRATAMENTOS MÉDICOS. BNCC-C ALTERNA SER CURRÍCULO SER BASE, EXISTE DISTINÇÃO CONCEITO, ATIVIDADE SALA AULA PRÁTICA CIENTIFICA. PODE FALAR ENSINO CIÊNCIAS LEVAR CONSIDERAÇÃO PRÁTICA CIENTÍFICA. ENTANTO NECESSÁRIO DOIS COMPONENTES (CONCEITO PRÁTICA) CLARAMENTE DEFINIDOS ALINHADOS OBJETIVO DOCUMENTO. ATIVIDADES PRÁTICAS CONTRIBUEM INTERESSE APRENDIZAGEM CIÊNCIAS, ESPECIALMENTE INVESTIGATIVAS PROBLEMATIZADORAS. OBJETIVOS APRENDIZAGEM, VEZ, COMBINAM CONCEITO PRÁTICA. SEGUNDO ANÁLISE CRÍTICA, SELEÇÃO OBJETOS CONHECIMENTO APRENDIZAGEM SEGUE CRITÉRIO ÚNICO PRIORIZA TEMAS GERADORES CIÊNCIAS. AVANÇOS CIÊNCIA TECNOLOGIA, POSSÍVEL ENSINAR TODO CONHECIMENTO CIENTÍFICO DURANTE ANOS ESCOLARES. ALÉM DISSO, DESENVOLVIMENTO CIENTÍFICO CONTÍNUO NOVOS TEMAS CONTINUARÃO SURGIR. OUTRO LADO, INFORMAÇÃO FACILMENTE ACESSÍVEL MEIO INTERNET OUTROS MEIOS INFORMAÇÃO, SELEÇÃO OBJETOS CONHECIMENTO, BNCC-C, APARENTA SEGUIR CRITÉRIOS DESSE TIPO. ORA SELEÇÃO DETALHADA APROFUNDA TÓPICO, ORA DETÉM POUQUÍSSIMO TEMPO TÓPICO GERADOR, APARENTEMENTE CRITÉRIO CLARO. PRINCIPAIS DESAFIOS ENGLOBAM PRINCIPALMENTE FALTA POSSIBILIDADES INOVAÇÃO PRÁTICA PEDAGÓGICA, ONDE PROPÕE CONHECIMENTO ALÉM TÉORIA, ESSENCIALMENTE VIVÊNCIA, PROPONDO JOGOS LÚDICOS GRUPOS TORNAR AULA ATRATIVA SEQUENTEMENTE GARANTIR PARTICIPAÇÃO DISCENTES. AULA CAMPO OBJETIVO LEVAR MAIORES POSSIBILIDADES CONHECIMENTO ATRAVÉS VIVÊNCIA. NECESSITA ENTÃO APROXIMAÇÃO TEORIA PRÁTICA PROPORCIONA NOVOS HORIZONTES POSSIBILITAM BUSCAR NOVAS PRÁTICAS ENSINO FACILITEM APRENDIZAGEM EDUCANDOS. AULA PRÁTICA CONSTITUI IMPORTANTE RECURSO METODOLÓGICO FACILITADOR PROCESSO ENSINO-APRENDIZAGEM BIOLOGIA. ATRAVÉS EXPERIMENTAÇÃO VIVÊNCIA, ALIA TEORIA PRÁTICA POSSIBILITA DESENVOLVIMENTO PESQUISA PROBLEMATIZAÇÃO SALA AULA, DESPERTANDO CURIOSIDADE INTERESSE .",SDLMM
"AVALIAÇÃO DISCIPLINA METODOLOGIA ENSINO CIÊNCIAS BIOLOGIA. 1) DISCIPLINA ATENDEU EXPECTATIVAS? DESTACA NESSE SENTIDO? NÃO, POIS FAZIA IDEIA SOBRE TRATAVA DISCIPLINA ANTES AULAS. 2) DISCIPLINA COLABOROU EMPODERAMENTO ABORDAGEM CONTEÚDO CIÊNCIAS? FORMA? SIM, VÁRIAS FORMAS. EXEMPLO MUDAR IDEIA CRIADA ESCOLA SOBRE 2° GUERRA MUNDIAL, VÊ-LA OUTRA FORMA, VER GUERRA POLÍTICA INFLUENCIA ESCOLA CAMINHO CIÊNCIA SEGUE. 3) AVALIA ABORDAGEM UTILIZADA PROFESSOR? BOA, MANEIRA PROFESSORA ABORDOU ESTUDO CIÊNCIAS, TRAZEM PRÓXIMO REALIDADE. ALÉM LEMBRAR QUE, CIÊNCIAS ESTUDO DINÂMICO VIVO. 4) SOBRE MATERIAL PEDAGÓGICO DISPONIBILIZADO, AVALIAÇÃO? INTERESSANTE AJUDAM VER MUNDO FORMA CONSCIENTE CRÍTICA. 5) MANEIRA GERAL DÊ OPINIÃO ACERCA DISCIPLINA METODOLOGIA ENSINO. INTERESSANTE ESTUDO, TEMPO BASTANTE SER EXPLORADA APROFUNDADA. 6) DESTAQUE CONSIDEROU IMPORTANTE CONSTRUÇÃO APRENDIZAGEM. FORMA VER CIÊNCIAS NATURAIS BIOLOGIA, ENCANTOS PERIGOS, ALÉM FORMA SER TRABALHADA SALA. ANTES ACHAVA RUIM DIFÍCIL TRABALHAR CIÊNCIAS MÉTODO TRADICIONAL, AGORA ACHO IMPOSSÍVEL ENTENDER DESENVOLVER AULA 100% TRADICIONAL. 7) AVALIAÇÃO QUANTO SALA VIRTUAL UTILIZADA DISCIPLINA? DIFICULDADE TRABALHAR FALTA COSTUME, TRATAR FERRAMENTA NOVA. 8) SEMPRE POSSÍVEL APRIMORAR MODO APRESENTAR/ABORDAR TEMA ESTUDO, OPINIÃO VALIOSA.TEM SUGESTÕES? CAPAZ OPINAR PRESENTE MOMENTO.",PDJE
"1) DISCIPLINA ATENDEU EXPECTATIVAS? DESTACA NESSE SENTIDO? SIM, ATENDEU EXPECTATIVAS POIS DINÂMICO. 2) DISCIPLINA COLABOROU EMPODERAMENTO ABORDAGEM CONTEÚDO CIÊNCIAS? FORMA? SIM, POIS, PROFESSORA MOSTROU FORMAS DIFERENTES LIDAR CONTEÚDO CIÊNCIAS 3) AVALIA ABORDAGEM UTILIZADA PROFESSOR? BOA. 4) SOBRE MATERIAL PEDAGÓGICO DISPONIBILIZADO, AVALIAÇÃO? BOA QUALIDADE. 5) MANEIRA GERAL DÊ OPINIÃO ACERCA DISCIPLINA METODOLOGIA ENSINO DISCIPLINA NECESSÁRIA FORMAÇÃO FUTUROS PROFESSORES. 6) DESTAQUE CONSIDEROU IMPORTANTE CONSTRUÇÃO APRENDIZAGEM FORMA ABORDADA CONTEÚDO. 7) AVALIAÇÃO QUANTO SALA VIRTUAL UTILIZADA DISCIPLINA? BOM RECURSO UTILIZAR. 8) SEMPRE POSSÍVEL APRIMORAR MODO APRESENTAR/ABORDAR TEMA ESTUDO, OPINIÃO VALIOSA. SUGESTÕES? COMPARTILHE AQUI: CONTINUE ASSIM, ÓTIMA DIDÁTICA.",VE
": AVALIAÇÃO PERCURSO DISCIPLINA METODOLOGIA ENSINO CIÊNCIAS BIOLOGIA 1) DISCIPLINA ATENDEU EXPECTATIVAS? DESTACA NESSE SENTIDO? COMEÇO DISCIPLINA CONFESSO SENTI MEIO PERDIDO “O EXATAMENTE ESTUDANDO? ” PASSAR DISCIPLINA, CONSEGUIU ATENDER EXPECTATIVAS CONSEGUI SITUAR. 2) DISCIPLINA COLABOROU EMPODERAMENTO ABORDAGEM CONTEÚDO CIÊNCIAS? FORMA? SIM, COLABOROU, POIS, MOSTROU, VÁRIAS FORMAS MANEIRAS, APRESENTAR CONTEÚDO CIÊNCIAS, ASSUNTO FOR, FORMAS CRIATIVAS INOVADORAS POSSÍVEIS. 3) AVALIA ABORDAGEM UTILIZADA PROFESSOR? MIM FORMA SATISFATÓRIA, POIS, APESAR SABER APRENDENDO, PROFESSORA QUERIA PASSAR, COMEÇO, PASSAR TEMPO ENTENDI REAL ENSINAMENTO DISCIPLINA. 4) SOBRE MATERIAL PEDAGÓGICO DISPONIBILIZADO, AVALIAÇÃO? MATERIAL BOA QUALIDADE, BOAS FONTES. 5) MANEIRA GERAL DÊ OPINIÃO ACERCA DISCIPLINA METODOLOGIA ENSINO ACHEI DISCIPLINA COMPLETA TOTALMENTE NECESSÁRIA FUTURO PROFESSOR, TODOS PROFESSORES DEVEM OBRIGATORIAMENTE PASSAR, LONGO GRADUAÇÃO. 6) DESTAQUE CONSIDEROU IMPORTANTE CONSTRUÇÃO APRENDIZAGEM METODOLOGIA PROFESSORA PASSAR CONTEÚDO FORMA IMPRESSIONA. 7) AVALIAÇÃO QUANTO SALA VIRTUAL UTILIZADA DISCIPLINA? ÓTIMO FACILITADOR VIDA ACADÊMICA 8) SEMPRE POSSÍVEL APRIMORAR MODO APRESENTAR/ABORDAR TEMA ESTUDO, OPINIÃO VALIOSA. SUGESTÕES? COMPARTILHE AQUI: MIM SATISFATÓRIO JEITO FOI, PORÉM, ENTENDI COMECEI ACHAR FINAL DISCIPLINA. BOAS FESTAS PROFESSORA! TUDO BOM, FELIZ NATAL! FELIZ ANO NOVO!! OBRIGADO :D",SDEG
"– CIÊNCIAS BIOLÓGICAS DISCIPLINA: METODOLOGIA ENSINO BIOLOGIA PROFª: AUTOR: AVALIAÇÃO DISCIPLINA METODOLOGIA ENSINO CIÊNCIAS DISCIPLINA ATENDEU EXPECTATIVAS? DESTACA NESSE SENTIDO? R: SIM, VERDADE DISCIPLINA SUPEROU EXPECTATIVAS, PRIMEIRA CADEIRA CURSO VOLTADA DIDÁTICA APLICAÇÕES METODOLÓGICAS PROCESSO ENSINO APRENDIZAGEM. DESTACO METODOLOGIA UTILIZADA PROFESSORA TROUXE CONHECIMENTOS CIENTÍFICOS REALIDADES EXEMPLOS COTIDIANO, FACILITANDO APRENDIZAGEM, DIÁLOGO DEBATES. DISCIPLINA COLABOROU EMPODERAMENTO ABORDAGEM CONTEÚDO CIÊNCIAS? FORMA? R: EXPANDIDO LEQUE CONHECIMENTO VÁRIAS METODOLOGIAS PODEM SER UTILIZADAS GANHO BENÉFICO PROCESSO ENSINO APRENDIZAGEM, METODOLOGIAS ATIVAS. AVALIA ABORDAGEM UTILIZADA PROFESSOR? R: DITO ANTERIORMENTE METODOLOGIA UTILIZADA PROFESSOR AULAS EXCELENTES. SOBRE MATERIAL PEDAGÓGICO DISPONIBILIZADO, AVALIAÇÃO? R: PROFESSORA SOUBE DISTRIBUIR BEM MATERIAIS UTILIZADOS AULA DISPONIBILIZADOS LEITURA CASA, TENDO SOBRECARREGADO, MAXIMIZADO APRENDIZADO ATRAVÉS LEITURAS SOBRE METODOLOGIAS ATIVAS, APRENDIZAGEM SIGNIFICATIVA TEXTO CRÍTICO SOBRE BNCC, ALÉM OUTROS. MANEIRA GERAL DÊ OPINIÃO ACERCA DISCIPLINA METODOLOGIA ENSINO. R: DISCIPLINA APLICADA MANEIRA COESA OBJETIVA, TENDO SEMPRE FOCO TEMAS PERTINENTES DOCÊNCIA APLICAÇÕES METODOLOGIAS DIFERENCIADAS AULAS TRADICIONAIS, ALÉM SER INTRODUZIDA AULA HISTÓRIA CIÊNCIA SURPREENDENTE BASTANTE CHOCANTE TRAZER REALIDADE MEIO CIENTÍFICO ONDE TUDO LINDO. DESTA CONSIDEROU IMPORTANTE CONSTRUÇÃO APRENDIZAGEM. R: DINÂMICA MAPA MENTAL ÚLTIMAS AULAS. AVALIAÇÃO QUANTO SALA VIRTUAL UTILIZADA DISCIPLINA? R: SALA VIRTUAL MOSTROU FERRAMENTA BASTANTE ÚTIL APROXIMA BASTANTE TURMA/PROFESSOR, FACILITANDO BASTANTE CONTATO SALA. SEMPRE POSSÍVEL APRIMORAR MODO APRESENTAR/ABORDAR TEMA ESTUDO, OPINIÃO VALIOSA. SUGESTÕES? COMPARTILHE AQUI. R: CONVICÇÃO NADA PERFEITO PROFESSORA CERTEZA CONSEGUIRÁ APRIMORAR AINDA PROGRAMA DISCIPLINA PRÓXIMA TURMA, ESTUDANTE INICIANTE CURSO SINTO INSUFICIENTE INCREMENTAR CONTEÚDO PROGRAMA APRESENTADO.",FLG
"PRIMEIRA ETAPA, ACHEI POUCO EXPECTATIVA. TODAVIA SEGUNDO MOMENTO COMEÇOU TER APREÇO FAZENDO REFLETIR POUCO SOBRE ENSINANDO CIÊNCIA MEIO SOCIEDADE CAPITALISTA DEIXA LADO BOA QUALIDADE AMBIENTE VOLTA. METODOLOGIAS DIFERENCIADAS FINAL SEMESTRE BEM BACANAS. MELHOROU APRENDIZAGEM MODO TROUXE ESTÍMULO. SIM. POIS PERMITIU TER OLHAR ANALÍTICO, TANTO CONTEÚDO SI,, FORMA ESTRUTURADO TRANSMITIDO. ABRIU MENTE LIMITAR APENAS MÉTODOS TRADICIONAIS, IR ALÉM BUSCANDO ATENDER DEMANDAS SURGEM TURMA MODO ALCANÇAR TODOS ALUNOS. INICIALMENTE POUCO TRAVE, POIS SITUANDO BEM ABORDAGENS. PASSAR AULAS CONTEÚDOS SENDO ABORDADAS FORMA SISTEMATIZADA. PONTO BEM POSITIVO INTERAÇÃO PROFESSORA SEMPRE REFLETINDO PODEMOS FAZER MUITAS COISAS OLHARMOS OLHAR CRÍTICO SOBRE DEMANDAS SALA AULA. BEM SIMPLES, PORÉM INFORMAÇÕES NECESSÁRIAS APROFUNDAR CONTEÚDOS DISCIPLINA. IMPORTANTE FAZER REFLETIR PODEMOS SER AGENTES TRANSFORMADORES SOCIEDADE INSERIDOS. ASSIM PODER FAZER CIÊNCIAS SAIA TEORIA PRÁTICA ALGO REALMENTE FAZ DIFERENÇA COTIDIANO.. CONHECER NOVAS FERRAMENTAS POSSIBILIDADES FAZER CIÊNCIAS MODO CLARO FOCO NECESSIDADE , SENDO CAPAZ TER AUTONOMIA FAZER NOVO. FERRAMENTA PRÁTICA, TODA VIA PARTICULAR GOSTO MUITO. VEZES ATRAPALHOU EXECUÇÃO ALGUMAS ATIVIDADES. TALVEZ FALTE INTERESSE PARTE. FATO TUDO DEPENDE ADAPTAÇÃO, SEMPRE PROCESSO RÁPIDO. BEM UTILIZADA PROFESSORA ALGUNS ALUNOS. . DINAMIZAR AULAS TODAS OPORTUNIDADES. POIS PERCEBI INICIADA AULAS INTERATIVAS CRONOGRAMA BEM APERTADA.",SDFI
"RESPOSTAS QUESTIONÁRIO AVALIAÇÃO DISCIPLINA PARTE ATENDEU EXPECTATIVAS. DESTACO AULAS 2º. UNIDADE INTERESSANTES, DINÂMICAS DESDE INCIO DEVERIAM SER ASSIM. SIM, COLABOROU. DISCIPLINA PODEMOS APRENDER ABORDAR ASSUNTOS CIÊNCIAS FORMA TRANSDISCIPLINAR ABORDAGEM UTILIZADA PROFESSOR BOA . DEMOCRÁTICA CONSTRUTIVA MATERIAL DIDÁTICO GRANDE VALIA FERRAMENTAS PODEREMOS UTILIZAR PRÁTICA. INTERESSANTE DISPONIBILIZAÇÃO BNCC . GOSTARIA MATERIAIS SOBRE TÉCNICAS DINÂMICAS PODEM SER UTILIZADAS PRÁTICA DOCÊNCIA. DISCIPLINA FORMA GERAL BOA, 1º. UNIDADE ABORDAMOS MUITOS PONTOS HISTÓRICOS, ENTENDO IMPORTANTE, PORÉM DEVERÍAMOS UTILIZAR DINAMIZAR TEMPO ASSUNTOS PRÁTICOS , 2º. UNIDADE. IMPORTANTE ABORDAR ASSUNTOS FORMA INTERDISCIPLINAR TRANSDISCIPLINAR BOA SIM SUGESTÕES . PODERÍA TRAZER DINÂMICAS TÉCNICAS POSSAM SER UTILIZADAS SALA AULA FAZER ALUNOS APLIQUEM PRÓPRIOS COLEGAS SALA AULA, ABORDANDO CONTEÚDOS PERTINENTES CIÊNCIAS BIOLÓGICAS.",SDMJ
"1) DISCIPLINA ATENDEU EXPECTATIVAS? DESTACA NESSE SENTIDO? R: POUCO. DISCIPLINA SI CAPAZ PASSAR TUDO EMENTA DIZIA RESPEITO, PORÉM ACHEI DISCIPLINA MOMENTOS PRÁTICOS ÚLTIMAS AULAS. 2) DISCIPLINA COLABOROU EMPODERAMENTO ABORDAGEM CONTEÚDO CIÊNCIAS? FORMA? R: SIM, DITO RESPOSTA ANTERIOR, DISCIPLINA CARREGOU TEOR ALTO ABORDAGENS IMPORTANTES ENSINO CIÊNCIAS FEZ-SE IMPORTANTE ACERCA VISÃO FUTUROS PROFESSORES BIOLOGIA. 3) AVALIA ABORDAGEM UTILIZADA PROFESSOR? R: APESAR AINDA FALTAR ALGUNS ASPECTOS, PROFESSORA SOUBE PASSAR CONTEÚDO FORMA CLARA AMPLIFICADA QUANTO DIZIA EMENTA. 4) SOBRE MATERIAL PEDAGÓGICO DISPONIBILIZADO, AVALIAÇÃO? R: APESAR TODO MATERIAL AJUDAR FIXAR CONTEÚDO, ACHO CADEIRA PODERIA EXPANDIR AINDA CONHECIMENTO. EXEMPLO, UTILIZAÇÃO NOVOS MÉTODOS AULA PASSAR CONTEÚDO CADEIRA, FORMA TODOS ALUNOS PUDESSEM VER CADEIRA SI RICA. 5) MANEIRA GERAL DÊ OPINIÃO ACERCA DISCIPLINA METODOLOGIA ENSINO. R: CADEIRA SI INTERESSANTE IMPORTANTE TODOS NÓS. ESPERAVA CADEIRA. AULAS DIVERSIFICADAS, DIFERENTES MANEIRAS APLICAR CONTEÚDO DIFERENTES MANEIRAS TRABALHAR CIÊNCIAS FUTURAS SALAS AULA. MANEIRA GERAL CADEIRA FEZ JUS FATO PROPOSTO. PROFESSORA SOUBE DOMINAR ASSUNTO, PORÉM SURPREENDEU ESPERARA. 6) DESTAQUE CONSIDEROU IMPORTANTE CONSTRUÇÃO APRENDIZAGEM R: MANEIRA... TODAS AULAS REALIZADAS ÚTLIMAS SEMANAS LINDAS PROVEITOSAS. 7) AVALIAÇÃO QUANTO SALA VIRTUAL UTILIZADA DISCIPLINA? R: SALA VIRTUAL SEMPRE IMPORTANTE DURANTE PROCESSO. ENTÃO TUDO COMPARTILHADO, ELABORADO DOCENTE ALUNOS IMPORTANTE DURANTE PERÍODO AULA. 8) SEMPRE POSSÍVEL APRIMORAR MODO APRESENTAR/ABORDAR TEMA ESTUDO, OPINIÃO VALIOSA. SUGESTÕES? COMPARTILHE AQUI: R: SUGESTÃO PROFESSORA POSSA TRABALHAR OUTRAS MANEIRAS PASSAR CONTEÚDO. AULA DIDÁTICA, INTERATIVA DIVERSIFICADA. GRADUANDOS ALI PRESENTES POSSAM LEVAR EXPERIÊNCIAS SI.",SDLL
"AVALIAÇÃO PERCURSO DISCIPLINA METODOLOGIA ENSINO CIÊNCIAS BIOLOGIA 1) DISCIPLINA ATENDEU EXPECTATIVAS? DESTACA NESSE SENTIDO? R – POUCO, APRENDE METODOLOGIA ENSINO SER SATISFATÓRIA ATENDER TODOS GRUPO. 2) DISCIPLINA COLABOROU EMPODERAMENTO ABORDAGEM CONTEÚDO CIÊNCIAS? FORMA? R – POUCO, LER ABNCC AJUDOU-ME TER NOÇÃO SOBRE ENSINO CIÊNCIAS. 3) AVALIA ABORDAGEM UTILIZADA PROFESSOR? R – ULTIMAS AULAS METODOLOGIA PRAGMÁTICA, SEJA, OBJETIVOS DEFINIDOS CONTEXTUALIZADAS. 4) SOBRE MATERIAL PEDAGÓGICO DISPONIBILIZADO, AVALIAÇÃO? R – ATENDEU POUCO EXPECTATIVAS 5) MANEIRA GERAL DÊ OPINIÃO ACERCA DISCIPLINA METODOLOGIA ENSINO. R – ESPERA FOSSEMOS APRENDER SOBRE ALGUMAS DIVERSAS FORMAS METODOLOGIAS ATIVAS. 6) DESTAQUE CONSIDEROU IMPORTANTE CONSTRUÇÃO APRENDIZAGEM. R – IMPORTÂNCIA ENSINO CARÁTER SIGNIFICATIVO APRENDIZ 7) AVALIAÇÃO QUANTO SALA VIRTUAL UTILIZADA DISCIPLINA? R – PONTE LIGAÇÃO CONTINUAÇÃO ESTUDANTES DOCENTE, CONTRIBUI DISPONIBILIDADE CONTEÚDOS LEVANTAMENTO DÚVIDAS ACERCA ASSUNTO ESTUDADO. 8) SEMPRE POSSÍVEL APRIMORAR MODO APRESENTAR/ABORDAR TEMA ESTUDO, OPINIÃO VALIOSA. SUGESTÕES? R – GOSTARIA ABORDAGENS ENSINO OBJETIVAS, CLARAS MUITA REDUNDÂNCIA CHEGAR RESULTADO FINAL.",BMM
"– – IMPORTANCIA UTILIZAÇÃO MODELOS DIDATICOS BIOLOGIA: ENSINO – APRENDIZAGEM AGENTES PATOÓGICOS INFECTO CONTAGIOSOS IMPORTANCIA UTILIZAÇÃO MODELOS DIDATICOS BIOLOGIA: ENSINO – APRENDIZAGEM AGENTES PATOLOGICOS INFECTO CONTAGIOSOS PROBLEMÁTICA MÉTODO UTILIZE MODELOS DIDÁTICOS AUXILIAR ENSINO – APRENDIZAGEM BIOLOGIA REALMENTE EFICAZ? BIOLOGIA CIÊNCIA ESTUDA VIDA. DEFINIÇÃO, VALIDO NECESSÁRIO ENTENDER ESTUDO VIDA VAI ALÉM ORGANISMOS, ECOSSISTEMAS, FUNCIONAMENTO CORPO HUMANO, VÍRUS BACTÉRIAS, FAUNA FLORA. ESTUDO VIDA PERPASSA OUTROS FATORES CUJAS TEMÁTICAS INTERLIGAM CONTEÚDO APLICADO SALA AULA CUNHO SOCIAL, AMBIENTAL, ECONÔMICO, POLÍTICO HISTÓRICO. INFELIZMENTE REALIDADE PROFESSOR DENTRO SALA AULA BASTANTE COMPLEXA. APRESENTAR TODOS CONTEÚDOS PROPOSTOS DIVERSAS VERTENTES BIOLOGIA MANEIRA ALUNOS CONSIGAM CONTEXTUALIZAR ASSUNTOS ABORDADOS DRIBLANDO FALTA ESTRUTURA FÍSICA ESCOLAS, AUSÊNCIA DEFASAGEM LABORATÓRIOS AULAS PRATICAS CONSEQUENTEMENTE EVASÃO ESCOLAR. TORNA-SE CADA VEZ NECESSÁRIO ENSINO BIOLOGIA UTILIZAÇÃO DIFERENTES MODALIDADES DIDÁTICAS AUXILIAR CONTEXTUALIZAÇÃO APROXIMAÇÃO CONTEÚDOS TRATADOS SALA AULA VIVENCIA PRATICA BIOLOGIA VIDA DESSE . FACILITAR PROCESSO ENSINO-APRENDIZAGEM DESAFIO NOVOS DOCENTES CIÊNCIAS NATURAIS PRECISAM APRESENTAR CONTEÚDO PROGRAMADO DENTRO PLANO ENSINO FUJA RECURSOS MÉTODOS DIDÁTICOS ENSINO TRADICIONAL, BUSCANDO ALTERNATIVAS INCENTIVEM INTERESSE DENTRO CONTEXTO ESCOLAR MANEIRA LÚDICA, INCITANDO CAPACIDADE COGNITIVA DICENTES INTERAÇÃO / PROFESSOR. HIPOTESE PROJETO OBJETIVO APRESENTAR IMPORTÂNCIA UTILIZAR MÉTODOS DIDÁTICOS ENSINO BIOLOGIA ENFOQUE AGENTES PATOLÓGICOS INFECTOCONTAGIOSOS PRESENTES REALIDADE COTIDIANO SOCIEDADE FIM ESCLARECER DÚVIDAS, TRAZER MAIOR CONHECIMENTO ACERCA ASSUNTOS ABORDADOS SALA AULA QUEBRAR ALGUNS PARADIGMAS AINDA EXISTENTES DENTRO CONTEXTO EDUCACIONAL SOBRE DETERMINADAS TEMÁTICAS ENVOLVEM DOENÇAS COMUNS RESPECTIVOS AGENTES PATOLÓGICOS.",CB
"– – SUSTENTABILIDADE: SUBSTITUIÇÃO COPOS CANUDOS PLASTICO BIODEGRADAVEIS INSTITUIÇÃO . SUSTENTABILIDADE: SUBSTITUIÇÃO COPOS CANUDOS PLASTICO BIODEGRADAVEIS INSTITUIÇÃO TRABALHO DESENVOLVIDO DISCIPLINA PESQUISA EDUCAÇÃO, 6º PERÍODO CIÊNCIAS BIOLÓGICAS . PROFESSOR ORIENTADOR: . SUSTENTABILIDADE: SUBSTITUIÇÃO COPOS CANUDOS PLASTICO BIODEGRADAVEIS INSTITUIÇÃO AUTOR: , ORIENTADOR: , – E-MAIL: EVELYNN_VATYCIANI@HOTMAIL.COM 1 PROBLEMÁTICA POLUIÇÃO MEIO AMBIENTE, AFIM AMENIZAR USO PLÁSTICO. 2 HIPÓTESE PROMOVER SUBSTITUIÇÃO COPOS CANUDOS PLÁSTICO BIODEGRADÁVEIS INSTITUIÇÃO, AFIM AMENIZAR USO PLÁSTICO MELHORAR SITUAÇÃO PROBLEMÁTICA ANTERIOR, TRATA CONSUMO DESREGULAR.",VE
"– – TECNOLOGIAS EDUCAÇÃO: GAMEFICAÇÃO ENSINO-APRENDIZAGEM . TECNOLOGIAS EDUCAÇÃO: GAMEFICAÇÃO ENSINO-APRENDIZAGEM TRABALHO DESENVOLVIDO DISCIPLINA PESQUISA EDUCAÇÃO, 6º PERÍODO CIÊNCIAS BIOLÓGICAS . PROFESSOR ORIENTADOR: . TECNOLOGIAS EDUCAÇÃO: GAMEFICAÇÃO ENSINO-APRENDIZAGEM AUTOR: , ORIENTADOR: , – E-MAIL: GABRIEL_ERMINIO@OUTLOOK.COM 1 HIPÓTESE DIANTE ENSINO-APRENDIZAGEM TRADICIONAL SALA AULA, ALUNOS IRÃO ASSIMILAR MELHOR DETERMINADO ASSUNTO GAMEFICAÇÃO? 2 PROBLEMÁTICA PROCESSO ENSINO-APRENDIZAGEM USO GAMEFICAÇÃO IMPORTANTE POIS AJUDA RECURSOS DIGITAIS TENDE TER MAIOR INTERESSE DETERMINADO ASSUNTO, ASSIM ENSINO-APRENDIZAGEM TORNA PRAZEROSO CONSEQUENTEMENTE CÉREBRO CONSEGUE ASSIMILAR MELHOR DETERMINADO ASSUNTO.",SDEG
