Text,Author,Link
"Em seu artigo mais recente, “Quando o impossível é uma certeza”, o economista, agrônomo e professor sênior do Instituto de Estudos Avançados da USP José Eli da Veiga, um dos maiores especialistas em sustentabilidade no Brasil, afirma que “se ampliam exponencialmente as chances de novas e mais sofisticadas armas de destruição em massa’”.

Dois trechos do artigo:

“Caso cuidem razoavelmente da biosfera, humanos – e possíveis sucessores – ainda poderão usufruir de longuíssimo prazo de validade neste planeta: até uns 8 milhões de anos, conforme as melhores estimativas. A dúvida é se, muito antes deste limite, haverá auto-aniquilamento, por efeito adverso das mais admiráveis proezas tecnológicas”.

“Agora, da biologia à microeletrônica, ampliam-se exponencialmente as chances de novas e mais sofisticadas “armas de destruição em massa”. Tornou-se perfeitamente possível fabricar vírus muitíssimo mais poderosos que os já conhecidos, sem incentivos para que as empresas capacitadas realizem efetiva triagem das encomendas”.

Em seu artigo você menciona um estudo dizendo que a chance da civilização sobreviver a este século é de 50%. Como se pensar sobre a pandemia do coronavírus dentro desta perspectiva?

Isso fica implícito. Muito se fala de uma catástrofe iminente. Neste artigo, me refiro a um grupo de pesquisadores do “risco existencial”. Eles chamam isso de privilegiar o pior cenário, mas com embasamento mais sólido e universal do que mera psicologia do incerto.

É possível fabricar um vírus hoje em dia?

Sim, hoje é possível fabricar um vírus. Esta foi uma questão levantada no último Fórum de Davos. Existe tecnologia para fabricar um vírus, e essas empresas, capazes de produzir um vírus, precisam passar por um sistema de checagem e uma série de protocolos antes de serem liberadas para produzir o vírus.

No relatório mostrado no Fórum de Davos, o que chama a atenção é que está ficando cada vez mais caro para seguir esses procedimentos de checagem e sistemas de controle de empresas que querem produzir vírus e cada vez mais barato os meios e as tecnologias para produzir esses vírus — uma preocupação muito séria.

Mas voltando ao coronavírus, seria um absurdo dizer que o SARS teria sido desenvolvido artificialmente. O mais provável é que seu surgimento tenha sido tão natural quanto o HIV, que passou dos primatas à espécie humana. O que a gente tem assistido nos últimos anos são fenômenos como esses, de vírus que nunca tinham frequentado a espécie humana, e que agora estão chegando em nós.

Seria o covid-19 um produto de nossos tempos, de alguma forma?

Em termos genéricos, o fato da gente ter desmatado tanto e da gente ter tido bastante contato com os animais silvestres pode sim ter influenciado o aparecimento do covid-19 em nós. Esse vírus que gerou a pandemia de agora não é o primeiro e nem será o último a causar outras pandemias. O que era menos frequente no passado. O que eu vejo é que fenômenos desse tipo podem ter acelerado.

E é possível estabelecer uma relação disso com a maneira que nós viemos lidando com a natureza.

Você acha que em alguma medida a quarentena pode ajudar a conscientizar as pessoas sobre o desenvolvimento sustentável?

Esse confinamento não vai ser só benéfico pela questão sanitária e de saúde, ele vai ser benéfico também pela questão pedagógica.

Infelizmente os governos são sempre os últimos a perceberem as coisas, mas eu como cidadão, quando vejo as imagens tiradas pela NASA do que seria o céu da China, é incrível como está “azul”, ver a diferença entre o antes da quarentena e o depois. Em apenas algumas semanas é brutal a discrepância. Como as águas em Veneza agora tem peixes, como os passarinhos voltaram às ruas de Paris. O silêncio nas ruas, a despoluição sonora. Em apenas algumas semanas de lockdown esses lugares tiveram inesperadamente, melhoras significativas em relação à poluição e ao meio ambiente.

Este é um momento propício para se refletir. As energias fósseis por exemplo, deveriam parar, já as energias renováveis deveriam crescer.

Esse é o lado pedagógico da crise.

Você acha que essa crise pode modificar o papel do Estado na perspectiva das políticas sociais e econômicas?

Não. O Bolsonaro deveria seguir o exemplo do Getúlio Vargas. Mas ele não tem coragem.

A minha impressão é de que ele vai sair, que não vai durar os quatro anos, mas não por impeachment, porque isso seria muito custoso, o Brasil já teve um recentemente que foi bem dramático.

Eu acho realmente possível uma articulação política da Câmara, que o Ministério Público solicite uma junta médica e examine o presidente, para uma avaliação mental. É a proposta do Miguel Reale, por exemplo. Mas seria muito mais simples se ele seguisse o exemplo do Getúlio Vargas, mas ele não tem coragem e não tem condições de escrever uma carta-testamento. Não dá para saber, o futuro é uma grande incógnita.

Como está o Brasil em termos de economia sustentável?

Nós somos o país mais privilegiado em termos de recursos naturais primários, mas por uma série de razões históricas fizemos tudo ao contrário. O exemplo mais chocante é de que nenhum país no mundo teria mais vantagens relacionadas à energia solar do que o Brasil. Mas não as desenvolvemos.

O nosso sistema de tecnologia e inovação parece o de um país “infantil”. Para caminharmos na direção de um desenvolvimento sustentável precisamos ter um sistema de tecnologia e inovação que seja prioridade nacional e isso envolve a educação também.

O problema não é só do governo, a sociedade brasileira não tem essa noção. Assim como a gente fez com a educação, acho que fez pior com a ciência e a tecnologia.

Eu não tenho nada de positivo para falar em relação ao desenvolvimento sustentável no Brasil. E isso independe do governo ser do Bolsonaro ou não.

Os outros países já tomaram uma dianteira tão grande que fica difícil correr atrás. E acabamos ficando dependentes de ficar importando da China.

Nós temos muitas vantagens comparativas, mas não desenvolvemos as vantagens competitivas.

 ", KM ,https://brasil.estadao.com.br/blogs/inconsciente-coletivo/jose-eli-da-veiga-o-que-essa-pandemia-esta-mostrando-e-o-futuro-nos-estamos-enxergando-as-consequencias-so-agora-porque-fomos-obrigados/
"Os dados aqui fora são assutadores – mais de 20 mil mortos e meio milhão de infectados no mundo –, mas lá dentro poderão ser ainda piores.

Com os destemperos de Jair Bolsonaro à parte, as principais recomendações da OMS (Organização Mundial da Saúde) com relação à pandemia é de se evitar aglomerações e cultivar o isolamento social, mantendo ambientes arejados e higienizando as mãos e o ambiente, para conter a proliferação do Covid-19.

O Brasil é o terceiro país com a maior população carcerária do mundo – com quase 800 mil presos, sendo que 41,5% deles são presos provisórios ou seja, ainda não foram julgados. As condições de moradia como se sabe são extremamente insalubres; falta de ventilação nos ambientes, falta de insumos de higiene e carência de médicos e medicamentos. Não espanta o longo histórico de doenças contagiosas, como a tuberculose e sarna; há mais de 10 mil casos de tuberculose confirmados em 2018 nas cadeias brasileiras. E pessoas que convivem com tuberculose, como se sabe, estão entre os grupos que podem ser mais afetados pelo novo coronavírus.

Ao longo dessas duas últimas semanas ocorreram uma série de acontecimentos ligados ao surto dentro do sistema carcerário brasileiro.

Na segunda-feira, dia 16, na cadeia Pública Milton Dias Moreira, na Baixada Fluminense, com a maior hiperlotação do Estado, foram identificados quatro casos suspeitos de Covid-19. O Ministério da Justiça decidiu então suspender as visitas aos presídios federais por um prazo inicial de 15 dias e dos atendimentos por advogados por cinco.

A população carcerária reagiu. Houve notícias de 4 rebeliões em presídios e 1300 presos fugiram de penitenciárias paulistas.

O Instituto de Defesa do Direito de Defesa enviou pedido ao STF cobrando ações para reduzir a população carcerária brasileira para evitar que o vírus se espalhe rapidamente, como tem ocorrido em outros lugares do mundo, inclusive Estados Unidos. Entre os pedidos, está o de prisão domiciliar para gestantes, presos soropositivos para HIV ou aqueles sofram de doenças respiratórias e a liberdade condicional a detentos que tenham 60 anos ou mais. Mas o STF negou o pedido.

Quais são as condições de salubridade e hiperlotação nos presídios brasileiros?

Os presídios brasileiros enfrentam condições precárias de salubridade, o que é agravado pelo fato de que há muito mais pessoas do que vagas em unidades prisionais. De acordo com os dados do levantamento mais recente do Departamento Penitenciário Nacional, a população privada de liberdade era de 766.752 pessoas para 460.750 vagas.

Chega a 26% a fatia das unidades sem qualquer tipo de módulo de saúde. Presos convivem com sujeira, ausência de produtos de higiene, falta de água e circulação de ar precária. Não à toa a incidência de doenças causadas por essas condições, como tuberculose e sarna, é muito maior entre pessoas presas que na população como um todo.

Vale lembrar que um possível avanço do coronavírus dentro da prisão terá consequências para fora de seus muros. Milhares de pessoas que trabalham em unidades prisionais também ficam com a saúde comprometida em razão desse quadro. Elas transitam entre as unidades e suas casas e podem levar o vírus a seus familiares e consequentemente a outras pessoas.

No Rio de Janeiro, por exemplo, há cerca de 3.735 presos com saúde vulnerável (idosos, diabéticos, soropositivos, tuberculosos, hipertensos) e 4 mil servidores públicos operacionais que trabalham nos presídios. Não há equipamentos de proteção individual, testes ou material de higiene suficientes. O Instituto Igarapé está atuando em uma coalizão da sociedade civil que busca, entre outras ações, doações para o sistema prisional e para as forças de segurança pública operarem com proteção adequada durante a pandemia.

Como o governo brasileiro e outros governos pelo mundo estão se preparando para a pandemia, em termos de política carcerária?

No Brasil, grande parte das ações até agora envolvem suspensão de visitas e atendimentos de advogados. A opção por esse tipo de medida sem que elas sejam complementadas por melhorias nas condições de higiene e sobre ocupação são insuficientes e podem trazer resultados perigosos em termos de segurança.

A recomendação do Conselho Nacional de Justiça é que juízes reavaliem prisões provisórias, sobretudo de mulheres gestantes, lactantes, mães e pessoas em estabelecimentos penais que estejam com ocupação superior à capacidade e que não disponham de equipe de saúde.

São medidas que já deveriam orientar o nosso sistema de Justiça, mesmo sem a atual pandemia, uma vez que a prisão tem custos altos, tanto do ponto de vista humano quanto do financeiro. Portanto ela deveria ser mais restrita, por exemplo aos casos envolvendo violência, danos coletivos graves ou formação de grupos criminais. É importante dizer que há relatos de que a resolução do CNJ está sendo colocada em prática de maneira limitada nos Estados.

A possibilidade de o novo coronavírus se espalhar no sistema penitenciário e a inação de governos é um alerta em diversas partes do mundo. Na Colômbia, ao menos 23 presos morreram no fim de semana depois de protestos contra a falta de medidas de autoridades. A Itália também registrou rebelião. Nos Estados Unidos, começaram a ser tomadas medidas para libertar pessoas que foram presas por crimes com menor potencial ofensivo e as mais vulneráveis à doença. No Irã, foi concedida liberdade temporária para 85 mil prisioneiros e, na Turquia, é possível que até 100 mil pessoas saiam da prisão.

As necessidades de unidades prisionais brasileiras são básicas e vão de demandas de material de higiene até reformas estruturais que garantam o fornecimento regular de água. Falamos muito sobre a construção de novas vagas, mas as vagas existentes estão localizadas em unidades com necessidades urgentes de intervenções em suas infraestruturas. A crise do novo coronavírus é uma oportunidade para pensarmos nisso.

O Ministério da Justiça determinou a suspensão das visitas aos presídios federais por um prazo inicial de 15 dias e dos atendimentos por advogados por cinco. Foi uma boa medida? Como avalia a atuação do ministro Moro no controle da pandemia nos presídios?

Para além da suspensão de visitas nos presídios federais, ampliada para 30 dias, o Ministério da Justiça publicou

estabelecendo padrões mínimos de conduta a serem adotados em âmbito prisional para a prevenção da disseminação do COVID-19. O documento tem 14 recomendações para gestores prisionais, a maior parte tratando de restrições de visitas, limitação de transferências, suspensão temporária de audiências, suspensão ou redução de atividades educacionais, de trabalho. Ou seja, medidas restritivas, que parecem estar sendo as priorizadas pelos Estados. O documento traz também menção a assepsia de celas, promoção de campanhas educacionais, prisão domiciliar em casos específicos e realização de mutirões carcerários virtuais para analisar progressões de regime, o que é positivo.

Em termos de posicionamento público, no entanto, o ministro Sergio Moro toma um caminho perigoso ao afirmar que é contra libertar presos por isso significar “a pretexto de proteger a população prisional, vulnerar excessivamente a população que está fora das prisões”. Infelizmente esse tipo de declaração gera uma confusão entre medidas racionais focadas em presos provisórios, pertencentes a grupos vulneráveis e que cometeram crimes sem violência e um “libera geral”.

Na segunda passada (16), o Ministério da Justiça suspendeu a saída temporária de mais de 34 mil detentos para evitar risco de contágio pelo coronavírus. No mesmo dia 1.379 presos fugiram por meio de rebeliões de quatro presídios paulistas. Como fica a atmosfera dentro dos presídios? Que sinais o PCC tem emitido?

A pandemia tem potencial de acirrar ânimos em um sistema que já vive em constante pressão. Nos últimos anos, testemunhamos diversas ondas de rebeliões nos presídios brasileiros. A suspensão de direitos de pessoas privadas de liberdade sem a adoção de medidas de melhorias de condições de higiene, saúde e infraestrutura podem sim ser motivação para novos episódios.

Até o momento ainda não há clareza sobre como grupos criminais brasileiros vão se comportar. Autoridades dizem que as fugas e rebeliões que ocorreram em São Paulo no dia 16 de março não foram iniciadas a partir de ordens do PCC. No Rio de Janeiro, fora do sistema prisional, os relatos são de que grupos de traficantes e milícias estão impondo toques de recolher em algumas comunidades em razão da pandemia.

De Roraima chegou a notícia de que o governador deixou presos sem água em presídios superlotados. E de que houve um surto de piodermite – uma doença derivada da sarna humana – que “comeu vivo” 24 detentos e até o meio de fevereiro contava com 700 doentes. O que explica essa barbárie?

Infelizmente, parte da nossa sociedade ainda vê pessoas privadas de liberdade como menos merecedoras de direitos básicos, como alimentação, saúde, trabalho. O objetivo do sistema penitenciário, conforme apresenta a própria Lei de Execução Penal, é não apenas cumprir a pena, mas também garantir que essas pessoas tenham condições de voltar à liberdade preparadas para um convívio social harmônico, o que hoje não acontece. Precisamos lembrar que a barbárie dentro de presídios fortalece grupos criminais que atuam nas lacunas deixadas pelo Estado. Ou seja, ela alimenta ciclos de violência que atingem toda a sociedade. Nós pagamos por essas escolhas equivocadas, e pagamos caro.", KM ,https://brasil.estadao.com.br/blogs/inconsciente-coletivo/coronavirus-e-o-sistema-penitenciario-uma-tragedia-anunciada/
