Text,Author,Link
"Nos últimos dias, temos assistido (literalmente) à explosão da quantidade de “lives” -transmissões de vídeos ao vivo nas redes sociais. Elas deixaram de ser uma moda entre adolescentes para se tornar uma poderosa ferramenta de negócios e de promoção de qualquer coisa.

O grande impulsionador disso é o isolamento social por conta do Covid-19. Como muita gente não sai mais de casa e eventos públicos estão proibidos, as “lives” se tornaram a melhor alternativa para conversar com seu público. Assim, as transmissões se multiplicam, com pessoas ensinando um pouco do que sabem, fazendo propaganda de seus serviços, reunindo grupos em torno de interesses em comum. E não podemos deixar de mencionar as “superlives”, shows online ao vivo -especialmente de artistas sertanejos- que têm reunido milhões de pessoas que os assistem ao mesmo tempo, um público que não caberia em nenhum espaço físico.

Por que as “lives” fazem tanto sucesso afinal? De onde elas vieram? E o que é preciso para fazer a sua?

Saiba mais sobre esse assunto no vídeo abaixo:


As “lives” começaram a ficar mais populares com o YouTube, que lançou o recurso em 2010. Depois vieram muitas outras plataformas, como o Twitch (mais focado em games, criado em 2011 e comprado pela Amazon em 2014) e o Periscope (criado em 2015 e incorporado depois pelo Twitter). E a coisa ficou mesmo popular quando o Facebook e o Instagram lançaram esse recurso em suas plataformas, em 2016.

Mas pouca gente sabe que transmissões ao vivo digitais existem desde antes da Web, quando a Internet ainda era um ambiente árido e restrito a cientistas e militares.

A primeira coisa que poderia ser chamada de “live” foi criada em 1991 por alguns estudantes da Universidade de Cambridge, no Reino Unido. Eles apontaram uma câmera para a cafeteira de um dos laboratórios da universidade, para saber se tinha café sem ter que ir até lá.

Depois que a Internet comercial foi lançada, em 1994, surgiu a primeira transmissão ao vivo regular de uma pessoa: a JenniCam. E que transmissão: ela durou incríveis sete anos e oito meses!

Em 3 de abril de 1996, Jennifer Ringley uma estudante de economia da Universidade Dickinson, na Pensilvânia (EUA), então com 19 anos, ligou uma câmera no seu dormitório estudantil, que transmitia em tempo real tudo que ela fazia lá. Na maior parte do tempo, o quarto estava vazio, mas a câmera chegou a capturar até cenas de sexo da estudante. Cerca de 4 milhões de pessoas assistiam à vida de Jennifer no seu quarto, o que é impressionante, se considerarmos que existiam apenas 36 milhões de internautas no mundo na época. Isso a transformou na primeira celebridade digital.

Mas isso é história. As “lives” hoje duram de poucos minutos a algumas horas e transmitem desde conversas de amigos até shows superproduzidos.

Por exemplo, no último dia 4, a dupla sertaneja Jorge e Mateus fez um show em uma “live” que durou quatro horas e meia e teve 3,1 milhões de pessoas assistindo ao vivo, um recorde absoluto no YouTube. Mas esse recorde foi ultrapassado apenas quatro dias depois, no show da “Rainha da Sofrência”, Marília Mendonça, que juntou 100 mil pessoas a mais na sua “superlive”.

Além de arrecadar uma enorme quantidade de doações para a luta contra o novo coronavírus, as “lives” foram patrocinadas. Uma fonte de uma agência de publicidade afirma que uma delas levantou, só em merchandising, R$ 5 milhões! Nada mal para algo feito com uma produção relativamente barata, incrivelmente mais simples que a estrutura de qualquer show em um estádio.

É importante que fique claro que esses artistas já tinham uma presença bem forte nas redes sociais antes de tudo isso. Marília Mendonça, por exemplo, tem mais de 30 milhões de seguidores no Instagram.

Mas não só de “superlives” de artistas vive o período de distanciamento. Tenho visto uma explosão de oferta desse formato, especialmente no Instagram, de “lives” de todo tipo. São pessoas ensinando algo, oferecendo serviços, fazendo propaganda de seu trabalho ou simplesmente “fazendo um social” de dentro do seu distanciamento.

Não se trata mais de uma coisa restrita a adolescentes ou nerds. As “lives” vieram para ficar e estão se transformando em uma nova linguagem, uma nova forma de comunicação. E são muito fáceis de serem produzidas: basta um celular e uma conta em uma das plataformas já citadas. E é tudo grátis!

O poder do vídeo interativo é inegável. Aliás, a interatividade é uma das características das “lives”. Diferentemente dos vídeos gravados, as “lives” permitem que o público deixe seus comentários nelas em tempo real. E o dono da “live” ou sua equipe podem responder, também em tempo real. É comum também que as pessoas que estão assistindo à “live” acabem conversando entre si.

Essa dinâmica é algo que não existe em nenhuma outra mídia, e é muito interessante! Isso é diferente de uma videoconferência, outra coisa que também já existe há muito tempo e que ganhou força com o distanciamento social. Sim, as videoconferências também são transmissões de vídeo ao vivo, com várias pessoas interagindo. Mas, ao contrário das “lives”, elas não são públicas. Por isso, normalmente são usadas para reuniões de trabalho ou aulas. Já as “lives” são totalmente abertas, e quanto mais gente entrar, melhor, mesmo que sejam desconhecidos.

Até grandes eventos estão se transformando em “lives”. Por exemplo, dois megaeventos da área de tecnologia que costumo cobrir e que aconteceriam agora no início de maio, foram convertidos em uma sequência de “lives”. O primeiro é o Red Hat Summit, que aconteceria esse ano em San Francisco (EUA), e agora será online, nos dias 28 e 29 de abril. O outro é o SAP Sapphire Now, que seria em Orlando (EUA), e acontecerá online nos dias 12 a 14 de maio. São congressos que reuniriam, em um único espaço, mais de 15 mil pessoas, e agora potencialmente juntarão muito mais gente online!

Muitos outros eventos importantes estão acontecendo dessa forma. Eu mesmo tenho dado palestras em eventos, agora sem sair de casa.

O fenômeno é tão intenso que muita gente está creditando às “lives” uma sobrecarga sentida na Internet nos últimos dias. Afinal, elas acontecem, na maioria dos casos, no mesmo horário: no fim da tarde ou começo da noite. E, como expliquei na semana passada, existe mesmo um enorme pico de uso da Internet entre 15h e 21h, mas não podemos creditar isso apenas às “lives”.

É curioso que, nesse momento em que todos podem praticamente se tornar pequenas emissoras de TV, vejo que os veículos de comunicação, inclusive as próprias emissoras de TV, não estão aproveitando esse recurso. Talvez achem que não precisem disso, pois já têm os seus formatos consolidados. Mas é uma pena, pois as “lives” são mais que uma curiosidade online: elas são uma verdadeira linguagem nova do tempo em que vivemos.

Eu mesmo tenho usado o formato para criar um programa jornalístico, aproveitando a sua característica interativa. O Jornal da Live vai ao ar toda quinta no LinkedIn, onde sou um dos poucos brasileiros já autorizados a fazer essas transmissões, que ainda estão em teste na plataforma. O programa dura cerca de uma hora e nele eu discuto algumas das notícias mais importantes do momento com todos os participantes, um jeito totalmente novo de se fazer jornalismo, com uma participação inédita e intensa do público!

Tudo isso é sinal do que vivemos. O novo coronavírus e o isolamento social têm provocado intensas e rápidas mudanças na vida das pessoas e das empresas. Muitas pessoas têm me perguntado recentemente se a vida será a mesma depois que isso tudo passar. Certamente não! Já não é a mesma!

Muitas coisas que estamos aprendendo agora, às vezes de maneira dolorosa, permanecerão depois. E as “lives” certamente estarão entre elas. Mais que exibicionismo, elas mudaram a maneira como nos relacionamos e criaram uma nova linguagem.

E aí, vamos criar “lives”?",SP ,https://brasil.estadao.com.br/blogs/macaco-eletrico/o-isolamento-nos-transformou-em-pequenas-emissoras-de-tv/
"Desde a semana passada, muitas pessoas vêm relatando diversos problemas com a Internet. Eles vão desde falhas em conversas por vídeo, serviços online de todo tipo ficando mais lentos ou caindo, piora em plataformas de vídeo e até demora para enviar mensagens no WhatsApp.

É fácil explicar o problema! Com o distanciamento social, com muita gente trabalhando em casa, sem falar nas crianças e adolescentes confinados, o consumo na rede cresceu muito! Isso acontece não só porque as pessoas estão usando todo tipo de sistema para trabalhar e estudar, mas também porque a diversão cada vez mais migra para as redes.?

Saiba mais sobre esse assunto no vídeo abaixo:


Será que a gente bateu no limite da Internet? O que a gente pode fazer para melhorar isso?

Para responder isso, a gente precisa entender como a transmissão de dados na Internet funciona e qual o tamanho do problema.

Segundo o IX.br (Brasil Internet Exchange), divisão de infraestrutura do Comitê Gestor da Internet no Brasil, a infraestrutura brasileira da rede apresentou um tráfego de 11 Tb/s já no dia 23 de março. Para se ter uma ideia de quanto isso é fora do normal, a média registrada ao longo de 2019 foi de 4,69 Tb/s.

Claro que existe um aumento natural do consumo de Internet, e ele é forte, como se pode ver nos dois gráficos a seguir, do próprio IX.br. O primeiro mostra o crescimento ao longo dos últimos doze meses; o seguinte, ao longo dos últimos dez anos. Em ambos, fica claro o pico a partir de março agora.



Outra coisa que se observa é uma evidente mudança do consumo ao longo do dia, como pode ser visto no terceiro gráfico. Na Internet doméstica, existia um pico logo de manhã e outro à noite, ou seja, antes de as pessoas saírem de casa para o trabalho ou a escola e depois que voltavam.


Agora esse pico da manhã se transforma no início de uma subida ininterrupta que vai até às 13h, quando o uso se mantém lá no alto. Daí cresce ainda mais a partir das 19h, batendo no máximo do dia lá pelas 21h, quando começa a cair com força, atingindo um mínimo lpor volta de 6h, quando começa tudo de novo.

Alguns podem argumentar que o aumento do tráfego doméstico é compensado pela queda do tráfego nas empresas. Mas isso é apenas meia-verdade. Isso porque muitas, muitas atividades que são feitas hoje online em casa antes eram feitas presencialmente nas empresas e nas escolas.

E o problema se agrava por dois motivos. O primeiro é uma explosão no uso de serviços digitais, desde filmes online até pedir comida por aplicativo. O segundo é que a estrutura da Internet nas casas não costuma ser tão boa quanto a das empresas. Ou seja, o crescimento do tráfego esperado por todo ano aconteceu em uma semana.

Mesmo com tudo isso, segundo o Comitê Gestor da Internet, a rede no Brasil é bem robusta e ainda opera com folga. Então por que estamos sofrendo isso tudo?

Temos que entender que existem diferentes redes compondo a Internet. Partindo da sua casa ou de empresa, existem as redes de acesso, que se conectam às operadoras contratadas. A partir delas, os dados são trafegados entre servidores em conexões mais parrudas, chamadas de backbones nacionais. Por fim, entre países, existem as conexões internacionais.

Com exceção das primeiras, que conectam nossas casas e empresas, nas demais existem esquemas de redundância, ou seja, se uma rota estiver congestionada, os dados automaticamente vão por outro caminho. Ele pode ser mais longo, demorará um pouco, porém entregará a informação.

Entretanto, na chamada “última milha”, a rede que chega em casa ou no escritório, isso não existe. E quanto mais pessoas e quanto mais equipamentos se pendurarem nessas redes, pior! É como se tivéssemos mais carros ao mesmo tempo em uma avenida estreita e sem vias alternativas: mais carros geram congestionamento e velocidades menores, o mesmo acontece com os dados.

A situação se agrava quando nos afastamos dos grandes centros urbanos. Na verdade, se você for para a periferia de uma cidade como São Paulo, a qualidade da Internet fica sofrível, tanto a fixa quanto a móvel, pois a infraestrutura é obsoleta ou insuficiente.

Se qualquer uma dessas redes fica congestionada, sofremos o impacto com lentidão e serviços caindo.

Há ainda um outro fator que pode causar isso, e provavelmente é onde a maior parte do problema está agora: os servidores dos serviços digitais. Qualquer serviço online roda em um computador -seu servidor- que tem capacidade finita, claro. E essas máquinas estão fortemente sobrecarregadas.

Ou seja, o caminho saindo de nossos celulares, nossos computadores, nossas TVs e tudo mais que conectamos à Internet até os servidores dos serviços que usamos está “segurando as pontas”, mas os servidores desses serviços não estão “aguentando o tranco”.

A lentidão tem sido observada até em serviços singelos, como trocas de mensagens pelo WhatsApp. Em serviços que exigem mais dados e processamento, como videoconferências e vídeos online, a coisa fica mais dramática.

E por falar em vídeos, quero falar das lives, as transmissões ao vivo que qualquer um de nós pode fazer em serviços como Instagram, Facebook ou YouTube. A oferta delas explodiu nos últimos dias, sejam de famosos, sejam de anônimos. Tenho ouvido reclamações de que a maioria dessas transmissões é muito ruim, com pessoas consumindo a rede apenas para jogar conversa fora.

Pode até ser verdade, mas temos que tomar cuidado ao apontar dedos. Primeiramente porque todo mundo tem o mesmo direito de usar esse recurso. Depois porque, nesse momento de distanciamento social, as lives acabam sendo uma boa maneira de apresentar o seu trabalho. E nem todo mundo domina a tecnologia ou a narrativa para fazer lives incríveis. A maioria está aprendendo a fazer isso agora, e “na marra”!

Diante de tudo isso, o que a gente deve fazer para melhorar a experiência online de todos?

Cada um tem seu papel e todos devem colaborar, começando pelas operadoras de telecomunicações. A Anatel (Agência Nacional de Telecomunicações) firmou um compromisso público com as principais empresas provedoras para manter o país conectado. A agência vai monitorar o tráfego e, junto com as operadoras, tomar ações para resolver problemas que surjam. As teles também trabalham nos sistemas para desviar dados de rotas congestionadas para alternativas mais vazias no momento.

Quanto aos serviços online, precisam ajustar suas entregas e ampliar seu parque de servidores. O Google, por exemplo, já reduziu a qualidade dos vídeos do YouTube de alta definição para padrão. A Netflix fez algo semelhante, economizando 25% da banda e o mesmo foi praticado por alguns concorrentes, como Amazon Prime Video e Globoplay. Até o WhatsApp se mexeu: o sistema limitou os vídeos nos status de seus usuários na Índia, onde é muito popular, a 15 segundos.

Por fim, nós mesmos. Como todo recurso que está escasso, precisamos fazer um uso inteligente dele. Claro que não estou pedindo para não usar o meio digital nesse momento, pelo contrário. Mas use apenas o que for preciso ou razoável. Se possível, divida o uso da Internet pelas pessoas na casa ao longo do dia. Além disso, tente realizar atividades que exigem mais da rede fora dos horários de pico.

São medidas simples, mas que podem trazer um alívio para a rede e par nossas mentes, aumentando a produtividade nesses dias em que estamos sendo obrigados a repensar muito de nosso cotidiano.", SP ,https://brasil.estadao.com.br/blogs/macaco-eletrico/batemos-no-limite-da-internet/
"Mantenha a cabeça no lugar enquanto estiver em casa
MARCH 30, 2020
Por conta do isolamento social que todos nós devemos fazer por causa do novo coronavírus, um novo problema surge: manter a cabeça no lugar!

O isolamento mais intenso começou há poucos dias, mas parece que já fosse há muito mais tempo. E essa percepção está ligada à quebra da nossa rotina de maneira tão dramática. Além disso, existe uma incerteza tremenda sobre o que acontecerá com nosso trabalho e os inevitáveis impactos na economia. Há ainda o fator de que nosso trabalho também está se transformando, e, para muita gente, de forma intensa!

Sem falar no medo individual, mais ou menos declarado, da doença em si.

Afinal, o que pode acontecer com cada um de nós?

Saiba mais sobre esse assunto no vídeo abaixo:


A primeira coisa que temos que ter em mente é que, por mais que isso doa, por mais que nos recusemos a aceitar, por mais que isso esteja nos provocando mudanças profundas e até prejuízos, o planeta está se transformando de maneira aceleradíssima nas últimas semanas.

O mundo no qual começamos o ano está sendo substituído por algo novo, que todos nós estamos construindo, de maneira rápida e um tanto dolorosa. Decisões e mudanças que normalmente tomaríamos em meses -talvez anos- estão acontecendo em semanas, dias.

Claro que isso insere uma dose cavalar de risco, incerteza e até medo no processo. Afinal, estamos construindo o avião em pleno voo. E é um voo com fortíssima turbulência.

Em um cenário em que temos que buscar fazer à distância tudo que for possível, o meio digital obviamente se torna crítico. Mas simplesmente dizer isso seria simplista demais e não resolveria muita coisa.

Transformar algo presencial em um equivalente online implica muito mais que a tecnologia. Temos que evoluir nossos modelos de negócios e estarmos dispostos a flexibilizar a maneira como nós trabalhamos. Precisamos ser mais tolerantes e compreensivos com o outro, pois todos nós estamos nessa transformação: muitas coisas não acontecerão como acharíamos o ideal.

Por exemplo, quando falamos em como fazer um home office produtivo, uma das dicas básicas é termos um espaço em casa para o trabalho, onde possamos evitar distrações. Só que, agora, a família inteira está em casa: até as crianças “estão em home office”. Não há como conseguir aquela tranquilidade para trabalhar.

Muita gente pode achar isso inadequado, inaceitável! Em condições normais, daquele mundo que deixou de existir, talvez fosse. Mas não dá mais para ser assim! Temos que demonstrar empatia com o outro, que se esforça para fazer o melhor, mas nem sempre conseguirá!

Ainda assim, os novos formatos podem ser surpreendentemente bons, inovadores e criativos. Mas, para isso acontecer, todos os envolvidos -inclusive clientes- precisam se esforçar e aceitar que fazem parte desse processo. É um tremendo desafio, qualquer que seja a sua área, até mesmo conter a ansiedade que toda essa incerteza nos provoca.

No meio disso tudo, para preservar as faculdades mentais, manter-se ocupado e produtivo é essencial.

Caso você seja o dono de um negócio ou gestor, entenda que possivelmente terá que mudar -e muito- suas entregas. Mas não encare isso com pesar, como o fim do mundo. Talvez seja até uma oportunidade para criar um novo produto ou modelo de negócios.

Se você continua trabalhando na empresa por ser um serviço essencial, concentre-se nas suas tarefas e tome todos os cuidados necessários. Por outro lado, se estiver fazendo home office, procure melhorar a sua produtividade com foco e tecnologia, mas adote também a resiliência e a empatia, como explicado acima. Mas, se estiver simplesmente em casa sem poder trabalhar, ocupe sua mente com coisas prazerosas e produtivas.

Pense positivo! Não se entregue à tristeza, ao medo, à ansiedade. Faça coisas que lhe deem prazer sozinho e com quem estiver com você. Aproveite para estudar, aprender uma nova habilidade profissional, um novo idioma ou qualquer coisa para o seu crescimento pessoal.

Por fim, mas não menos importante, se a coisa estiver muito difícil, não tenha dúvidas: procure ajuda profissional, de psicólogos. Se você já fazia terapia, continue! Ninguém melhor que o seu psicólogo para lhe dar o apoio necessário para passar por esse momento. E, como estamos isolados, o atendimento pode perfeitamente ser feito à distância.

Estamos juntos nisso tudo! Cuidem-se! Continuem produtivos e ocupados. Fiquem em casa o máximo que puderem. E mantenham a cabeça no lugar.", SP ,https://brasil.estadao.com.br/blogs/macaco-eletrico/mantenha-a-cabeca-no-lugar-enquanto-estiver-em-casa/
