Text,Author,Link
"Sempre chega o dia em que não há mais escapatória e, uma a uma, as pessoas são obrigadas a reconhecer que estão ficando velhas. Há anos se repete que o Brasil é um país de jovens, por mais que as estatísticas agora demonstrem o contrário (veja o gráfico).

O alastramento do coronavírus, que pôs os mais velhos no grupo de risco, mostra que o Brasil não se preparou para lidar com essa relevante mudança demográfica. O envelhecimento da população não teve correspondência em políticas de saúde apropriadas.

Não é apenas o Sistema Único de Saúde (SUS) que se mostra desequipado para atender à cada vez maior demanda pelos idosos. Também o setor privado expõe graves deficiências. A principal delas é a de que os planos de saúde cobram mensalidades impraticáveis dos associados mais velhos para lhes garantir atendimento médico, exames clínicos e internação hospitalar.

André Fattori, professor de Geriatria da Faculdade de Ciências Médicas da Universidade de Campinas (Unicamp), adverte: “Agentes de saúde, como enfermeiros e médicos, não estão capacitados para lidar com problemas mais comuns da idade avançada”.

As universidades cuidam do ensino e treinamento dos futuros médicos, enfermeiros e outros profissionais de saúde, mas preveem pouca carga horária para tratar de geriatria e de gerontologia. Continua excessivo o foco na pediatria, num país cuja taxa de natalidade vem caindo. Não por acaso, essa situação se reflete sobre toda a rede nacional de saúde, que atua com profissionais pouco habilitados para isso.

Mesmo diante da omissão das universidades na adaptação dos seus currículos, há o que pode ser feito imediata e diretamente no SUS em benefício da população sênior. Fattori explica que o foco do atendimento deveria se ater ao prolongamento das funcionalidades cognitiva e motora do idoso, para que ele se mantenha autônomo e se sinta acolhido durante o maior tempo de vida possível. Uma debilidade nos ossos, por exemplo, pode comprometer a independência, o que não acontece se um diagnóstico de diabetes é devidamente acompanhado. O tratamento intensivo de doenças crônicas pode se tornar insuficiente para a saúde integral dos mais velhos no dia a dia.

Como afirma Luiz Roberto Ramos, professor de Geriatria da Universidade Federal de São Paulo (Unifesp), é preciso aumentar o escopo da atenção primária nas Unidades Básicas de Saúde (UBS), com o objetivo de prevenir doenças. Os médicos de família, por exemplo, precisam saber recepcionar os idosos para avaliar sinais de demência e perdas de funções orgânicas e, ao mesmo tempo, conferir se as dosagens dos remédios estão corretas.

Além disso, acrescenta ele, faltam profissionais especializados que complementem o trabalho do médico de família. É preciso formar mais fisioterapeutas e fonoaudiólogos que encaminhem adequadamente demandas específicas e ajudem a montar redes de apoio aos idosos. Ele também sugere que seja expandido o atendimento domiciliar, para que, assim, se poupem os que têm dificuldades de locomoção.

No entanto, falar em cuidados para idosos pode ser algo genérico demais, adverte o geriatra Marcos Daniel Saraiva, da Santa Casa de Misericórdia de São Paulo. “O envelhecimento não depende só de fatores genéticos. Pesam, também, fatores ambientais, culturais, psicológicos e o estilo de vida”, diz. Estes são decisivos no registro de tantas diferenças. Enquanto muitos com mais de 80 anos se mantêm independentes e ativos, outros, com menos de 70, se mostram prostrados, incapazes dos cuidados mais simples consigo próprios.

Saraiva recomenda que os investimentos públicos destinados ao atendimento dos idosos não se restrinjam a questões de saúde somente, mas também contemplem as atividades das secretarias de urbanismo, cultura e transportes, de modo a garantir maior inclusão daqueles que logo serão a maior parte da população brasileira.", MC ,"https://economia.estadao.com.br/noticias/geral,saude-despreparada-notratamento-dos-idosos,70003242070"
"A irresponsabilidade do presidente Bolsonaro manifestada no pronunciamento de terça-feira em rede nacional não está nas teses subjacentes que defende ou ataca, mas no seu comportamento, que desorganiza e divide, e na sua incapacidade de coordenar a guerra contra a pandemia.

O ponto de vista dele, de acabar com o isolamento (lockdown) e de reabrir imediatamente as escolas e o comércio, chegou a ser inicialmente adotado pela Inglaterra. Mas os resultados dessa abordagem foram tão desastrosos que seus dirigentes tiveram de voltar atrás. Também o presidente Trump, dos Estados Unidos, assopra o mesmo trombone. Avisou que tudo deve voltar à normalidade na Páscoa da Ressurreição (dentro de 18 dias), justamente quando, pelas advertências do governador de Nova York, Andrew Cuomo, os serviços de saúde do seu Estado deverão entrar em colapso.

Essa estratégia, de deixar rolar a pandemia e de deixar que os mortos enterrem seus mortos, só poderia dar certo se o Brasil adotasse a política da Coreia do Sul, de aplicar testes em massa para, aí sim, isolar os infectados – e apenas eles – e deixar que a vida siga. Mas não temos essa possibilidade. Só haverá testes para cerca de 9% da população.

A contradição maior não está fora do governo, nem entre o governo e os governadores, nem mesmo entre o governo e outros políticos. A contradição maior está dentro do governo. O ministro da Saúde, Luiz Henrique Mandetta, está sendo publicamente desautorizado. Falta saber por que ainda não foi demitido ou por que ainda não pediu demissão, em nome de um mínimo de coerência entre políticas.

A situação é esquizofrênica e a esquizofrenia em matéria de políticas públicas leva à desarticulação e ao pandemônio. Se há uma estratégia nesse comportamento do presidente é a de aproveitar o caos que daí adviesse para seus já conhecidos propósitos autoritários.

Mesmo se estivesse correto no tratamento dispensado ao flagelo, o capitão não poderia ridicularizar as famílias que enfrentam mortes e graves contaminações por obra de um reles agente disseminador de “gripezinhas” e “resfriadinhos”, como ele vem afirmando, especialmente em quem não é “atleta”, como ele próprio se considera.

Mesmo se ele estivesse correto na escolha da estratégia de combate à pandemia, é condenável sua atitude de tentar jogar a população contra os governadores por ele acusados de adotar a política do povo cita, de terra arrasada. Em vez de liderar a classe política na tentativa de encontrar a melhor saída para a crise, Bolsonaro ataca também a classe política. Ele insiste que as recomendações dadas pelo seu próprio ministro da Saúde não passam de “histeria” provocada pela imprensa e por alguns epidemiologistas, com o único fim de derrubá-lo e de montar seu próprio jogo de poder. Foi o recado que passou pessoalmente nesta quarta-feira ao governador de São Paulo, João Doria: “Saia do palanque”.

Não dá nem mesmo para dizer que, bem ou mal, Bolsonaro optou por uma resposta técnica, embora não fosse a defendida pela Organização Mundial da Saúde, nem pela comunidade dos epidemiologistas, nem pelo seu próprio ministro da Saúde. Ele está desesperado porque perdeu a âncora dos bons resultados da economia e não tem outra para apresentar em seu lugar. É a mesma síndrome que vai ameaçando a sobrevivência política de Trump, com a diferença de que as eleições presidenciais nos Estados Unidos se realizarão dentro de oito meses, e as do Brasil, só dentro de dois anos e meio.

O que fazer com um despreparado que só escuta um bando de malucos e que aposta na polarização, na ruptura, no colapso das políticas públicas e nas saídas autoritárias, e não na união nacional, para enfrentar o novo perigo para salvação do povo e da coisa pública?

Os panelaços vistos desde a semana passada podem apontar para uma resposta para esta pergunta.

» Por que esconder os laudos?

Se os testes de coronavírus do presidente Bolsonaro apresentaram resultados negativos, por que esconder os laudos?

» Operação ocultamento

O Hospital das Forças Armadas, onde Bolsonaro fez os testes, omitiu dois nomes de pacientes infectados. Há dois dias, o presidente editou medida provisória que proíbe repartições públicas de divulgar informações sobre o estado de saúde de seus pacientes. Reforça-se a hipótese de que esteja contaminado.", MC ,"https://economia.estadao.com.br/noticias/geral,bolsonaro-opta-pelo-confronto-e-pela-ruptura,70003247957"
"A globalização vai encolher? As notícias recorrentes que dão conta sobre esse encolhimento são comemoradas agora por qualquer agrupamento de xenófobos. Mas será essa a tendência? Ou não acontecerá o contrário? A pandemia afundará ou aprofundará a globalização?

O vírus desconhece fronteiras, chega por terra, mar e ar. E se instala. O único continente definitivamente livre do flagelo é a Antártida.

Quarentena e isolamento, fechamento de fronteiras, cancelamento de voos, das excursões por navios de cruzeiro, das viagens de trem e de ônibus... Tudo isso e tanta coisa mais parecem avisar que a melhor resposta a esse vírus global é transformar cada pessoa num ermitão. Para completar a paisagem desolada, por toda a parte o comércio, os bares, os restaurantes, os hotéis e as praças de esportes cerram suas portas. O resultado é o colapso dos transportes e do comércio internacional, duas marcas indeléveis da globalização. O Tratado de Schengen, entre 26 países da Europa, que garante a livre circulação das pessoas, enfartou subitamente, sem prazo para recuperação.

Ou seja, as primeiras respostas à ação de um vírus globalmente devastador foi drástico recuo da globalização. O que, afinal, isso diz sobre o futuro do processo de integração?

Nesta quinta-feira, os dirigentes do G-20, grupo das 20 principais potências econômicas e políticas do mundo, do qual o Brasil faz parte, realizaram um encontro virtual, sob a presidência da Arábia Saudita, e deram uma primeira resposta global coordenada, destinada a combater esse agente que destrói a interconectividade das nações.

Antes disso, os grandes bancos centrais e boa parte dos chefes de governo já haviam tomado providências conjuntas para enfrentar a hora ruim. No documento do G-20 ficou dito que governos e bancos centrais vêm despejando nada menos que US$ 5 trilhões para combater a pandemia. O simples acordo bipartidário nos Estados Unidos que decidiu distribuir US$ 2 trilhões para socorrer cidadãos e empresas atingidas pela pandemia dissipou a maior parte do pânico que havia derrubado os mercados. Os mercados respiram..

E agora até mesmo dirigentes dos Estados Unidos, antes empenhados em travar uma guerra comercial feroz com a China, comemoram as primeiras indicações que apontam para a normalização das atividades produtivas e comerciais por lá, onde a doença começou.

Nenhuma resposta conjunta seria possível, mesmo fora do âmbito do G-20, se a extensa rede de comunicações e de internet não houvesse possibilitado a circulação de informações garantiram ampla divulgação sobre a natureza e o comportamento do vírus, a identificação dos grupos expostos aos maiores riscos, a troca de conhecimentos científicos, os procedimentos adotados e as melhores estratégias de combate.

Quando vier a recuperação da saúde das pessoas e da economia, ainda haverá quem trate de trancar tudo, de reforçar muros e fronteiras e de pregar o isolamento, como já se via ao redor do mundo. Mas será impossível bloquear as viagens, o comércio, a interconexão de cadeias produtivas e o intercâmbio tecnológico. A economia pede não só fluxo de recursos. Pede, também, coordenação de políticas globais.

» Preços do petróleo despencam

O gráfico mostra o comportamento dos preços no mercado futuro da principal referência do petróleo brasileiro, o Brent. Os números são impressionantes. Apenas em março, caíram 46,6%. No acumulado do ano, até esta quinta-feira, o tombo foi de 59,4%. A principal mortandade a partir desse desabamento de preços deverá acontecer no segmento de óleo de xisto dos Estados Unidos, que opera a custos superiores aos preços vigentes. O governo Trump deverá socorrê-lo, mas sabe-se lá até que ponto.", MC ,"https://economia.estadao.com.br/noticias/geral,a-globalizacao-e-o-virus-sem-fronteiras,70003249467"
"O maior equívoco do presidente Bolsonaro não é o de que pense diferentemente da Organização Mundial da Saúde (OMS), da maioria dos infectologistas e da opinião majoritária no País sobre a melhor maneira de enfrentar a pandemia.

É o de não atuar como chefe de governo. Em vez de unir o País, optou pela ruptura. Quando se refere ao vírus, ignora sua gravidade. Classifica-o como agente que não produz mais do que uma “gripezinha”, um “resfriadinho”. E desdenha do sofrimento da legião de infectados e das mortes que tendem agora a aumentar. Prefere dizer que o povo está acostumado a se meter no esgoto sem apanhar doenças.

Mas, ainda assim, poderia defender tratamento diverso do adotado pela maioria dos governadores e prefeitos. Mais do que promover procedimentos recomendados pelos especialistas, teria de tomar a iniciativa de conduzir um debate responsável. Mas preferiu desancar quem não pensa como ele.

Está mais do que na hora de entender que não dá para contar com o presidente para uma ação coordenada para o contra-ataque ao flagelo. Se isso é assim, o que fazer com ele?

Já houve quem sugerisse sua interdição, sem dizer como se faz isso. Não haveria sentido apresentar um atestado subscrito por meia dúzia de especialistas e internar o presidente, sabe-se lá em que condições. Também apareceram propostas de colocar em marcha um processo de impeachment, procedimento normalmente demorado, sujeito a complicados trâmites políticos e judiciais, portanto inviável.

A prática começa a sugerir outro tipo de saída. Sem partir para a truculência, governadores, líderes do Congresso, juízes do Judiciário e até mesmo membros do governo, como no pacote de crédito de sexta-feira, começam a atuar de maneira autônoma. Contra a palavra de ordem de que “o Brasil não pode parar”, governadores e prefeitos, por exemplo, ordenaram o recolhimento da maior parte da população, o fechamento de escolas e do comércio não essencial. E, independentemente de ideologias e de filiação partidária, têm se reunido para coordenar políticas. Autoridades do Judiciário passaram a vetar algumas das decisões descabidas do presidente, como o artigo de medida provisória que restringiu a Lei de Acesso à Informação. E, sem chutar o pau da barraca, o Legislativo e outros setores do governo vêm preparando e aprovando medidas destinadas a reduzir o sofrimento da população e a paradeira das empresas.

A solução de confinar politicamente o presidente, de deixá-lo falando sozinho, entregue à lira de Nero – como aponta a última edição da revista The Economist –, não é evidentemente a ideal. Ele continua pilotando uma caneta poderosa, continua sendo o editor do Diário Oficial e tem lá uns 20% de seguidores que o apoiam ferozmente nas redes sociais.

Vai, também, que não será preciso isolar politicamente o presidente. A pandemia pode acabar por bater tão implacavelmente o Brasil, como preveem especialistas, que não sobrará saída técnica senão o confinamento. Mas se não foi capaz até aqui de liderar o País na guerra contra o vírus, também não será capaz de liderar depois que tudo der errado, como deu errado na Itália e na Espanha.

» Nem sempre o ouro segura

Ouro e imóveis nem sempre garantem segurança e rentabilidade que muita gente pensa. O valor das cotas dos fundos imobiliários, por exemplo, despencou e, mesmo assim, poucos conseguem revendê-las. Os imóveis à venda não têm interessados. E as cotações do ouro estão voláteis. Nos 30 dias terminados nesta sexta-feira caíram 1,4%. Em março, o preço da onça-troy (31,1 g) ainda teve uma valorização de 2,2%. É um pouco daquilo que está no ‘Manifesto’ de 1848: “O que é sólido desmancha no ar”.", MC ,"https://economia.estadao.com.br/noticias/geral,o-que-fazer-quando-o-presidente-nao-lidera,70003251200"
"O futuro já era incerto antes da pandemia. Agora, será adiado indefinidamente.

Não se trata apenas de afundamento das projeções do crescimento e do tamanho do PIB deste ano e, provavelmente, também dos dois seguintes. PIB é renda e a renda vai mergulhar porque a produção cairá e porque seu valor também será bem mais baixo.

Certos setores deverão perder mais. Indústria de transformação e serviços estão entre eles. Em princípio, o agronegócio deverá ser menos prejudicado porque a alimentação continua sendo despesa essencial no orçamento do consumidor. O assalariado e os trabalhadores que ralam na informalidade também sofrerão com a queda do emprego e da contratação de serviços.

Outro fator de empobrecimento será a desvalorização do patrimônio familiar. Aplicações financeiras (incluídas aí as de renda fixa, ações e imóveis) já perderam e tendem a perder mais valor e preço. Paradoxalmente, a melhor forma de manter patrimônio enquanto durar o flagelo é manter dinheiro vivo, em caixa ou em conta corrente.

O custo social do contra-ataque ao vírus será da ordem de centenas de bilhões de reais. Ficará mais alto do que teria sido, pelo bate-cabeças e pela falta de coordenação demonstrada até aqui pelo governo federal. Não basta reconhecer que a vida tem mais valor do que a economia; será preciso assumir os compromissos derivados da opção já feita. O Congresso prepara um orçamento de guerra e, apenas neste ano, o rombo das contas públicas deverá dobrar, para a altura dos 7% do PIB. A esse custo deverão ser acrescentadas as perdas de arrecadação que virão na cola da queda da arrecadação do governo federal, dos Estados e dos municípios.

Esse preço não poderá ser pendurado indefinidamente. Logo começará a distribuição de contas a pagar. Como das outras vezes, isso acontecerá com aumento de impostos, expansão da dívida, emissão de moeda, perda de benefícios distribuídos pelo governo ou, ainda, por uma combinação desses fatores. A redução dos salários dos servidores públicos, sugerida pelo presidente da Câmara, Rodrigo Maia, poderá fazer parte do ajuste.

O tempo dirá em que proporções tudo isso acontecerá. Está aberta a temporada da disputa social tanto pela apropriação da renda, agora mais magra, quanto para tirar proveito no jogo de empurra das contas a pagar. O brasileiro não perderá apenas renda e patrimônio. Este será um período de quebra ou de suspensão de certos direitos adquiridos, inclusive os pagos com sacrifício pelas classes médias.

Um exemplo: a maioria dos planos privados de saúde, que operam como empresas de seguro, não está preparada para o brutal aumento das despesas diante da nova onda de sinistros. Fica para ser demonstrado até que ponto terão condições de honrar seus compromissos com seus participantes. Pode-se esperar que o governo intervenha ou que a Justiça os obrigue a cumprir o que está nos contratos. Mas, espera por espera, seguro pode desmaiar ou morrer de velho.

Se há uma lição que poderia ser aprendida no isolamento e na reclusão, é a de que lidamos mal com as incertezas. Quando o inimigo é poderoso, ao menos podemos tentar escapar de sua sanha. Mas quando é invisível, fica mais difícil enfrentá-lo e, assim, estar em condições de continuar a desenhar nosso futuro.

» As exportações de março

A tabela mostra como se comportaram as exportações em março, quando a pandemia avançou não só por aqui, mas também entre os principais clientes do Brasil. A queda dos embarques para a China até que não foi tão expressiva. Mais forte foi o recuo das exportações para os Estados Unidos, para o Japão e para o Oriente Médio. Esses números deverão sofrer maiores mudanças em abril, quando a maioria dos países do mundo estará semiparalisada e terá reduzido suas importações.", MC ,"https://economia.estadao.com.br/noticias/geral,a-conta-vai-chegar,70003257039"
"Depois que tudo tiver passado, nada será como antes. Será?

Na TV, nas redes sociais e nas outras mídias, veem-se os apelos para mudança, radical e definitiva, dos padrões de consumo e de conduta, em direção ao mais simples, à revalorização do natural, da amizade, da ternura e da compaixão.

Tantas e tantas vezes no passado o mundo atravessou grandes turbulências, até mais dolorosas do que as de agora. A cada período de guerra prolongada, a cada devastação produzida pela peste ou pelo cholera morbus, a cada grande catástrofe, o propósito geral também foi esse, o de que, uma vez enterrados os mortos e cicatrizadas as feridas, as mudanças seriam inevitáveis e para sempre.

Alguma coisa pode de fato ter mudado nessas ocasiões, mas, passada a abominação da desolação, tudo o que era antes tendeu a se repetir, como se sabe desde os tempos do Êxodo e da caminhada pelo deserto, quando os hebreus repentinamente se esqueceram do valor da liberdade, voltaram a adorar o bezerro de ouro e sentiram saudades das cebolas do Egito.

Mas o esquecimento dos propósitos de superação e a volta ao barro de onde viemos não é tudo. Muita coisa vem mudando, um tanto lentamente, mas vem mudando, até para melhor. No tempo da peste, por exemplo, que exterminou metade da população da Europa, nem mesmo os estudiosos sabiam o que era aquilo. Há apenas 116 anos, o Rio esteve entregue à Revolta da Vacina, porque ninguém aceitava o tratamento proposto por Oswaldo Cruz para erradicar a febre amarela. E, hoje, a população corre atrás de vacinas contra a gripe comum. Há cem anos, atacadas pela gripe espanhola, 50 milhões de pessoas morreram no mundo, mais do que na 1.ª Grande Guerra, sem ter como se defender do flagelo. Agora, em questão de semanas, os biólogos sequenciaram o genoma do novo coronavírus.

Independentemente desses progressos, certos comportamentos econômicos que já vinham mudando antes da pandemia devem acentuar a mudança depois de ultrapassadas as agruras da hora. Um deles tem a ver com o uso do dinheiro. Notas de papel-moeda e moedas de metal propriamente dito parecem com seus dias contados, não apenas porque são veículos de transmissão de vírus, bactérias e imundícies variadas, não passíveis de ser desinfetadas, mas porque a substituição das moedas físicas por moedas digitais já vem ocorrendo. O país mais adiantado nesse movimento é a China, que já avançou na adoção de blockchain, nos pagamentos e nas transferências de recursos por aplicativos que dispensam até mesmo a exigência de contas bancárias. Não está longe o dia em que até mesmo esmolas se darão por meio de operações com aplicativos.

As compras online são outra área em transformação. O isolamento a que se viu obrigado o consumidor mostrou ao comércio varejista no Brasil e no mundo que as empresas despreparadas para as vendas online ficaram para trás e agora terão de recuperar o tempo perdido. Não se trata apenas de continuar fisgando o consumidor nas horas de reclusão inevitável, como agora, mas de reduzir substancialmente os custos com estocagem e com logística, como estão fazendo as empresas que já têm boa quilometragem rodada no sistema, como Magazine Luiza, Lojas Americanas e Ponto Frio.

E há a não novidade do home office, ou seja, do trabalho preferencialmente em casa. Um bom serviço de internet e acesso aos arquivos e aos sistemas da empresa são quase tudo o que é necessário para dispensar rotineiras viagens de ida e volta aos escritórios e ou às sedes das empresas, com a vantagem adicional para o empregado de não ter de trabalhar sob o crivo direto do chefe. Mas, convenhamos, esse modelo não serve para tudo, não serve para ser adotado no chão de fábrica, nas linhas de montagem, nos canteiros de obras e na maioria dos serviços pessoais. Apenas parcialmente, pode funcionar no ensino e no treinamento de pessoal.

Essas e eventualmente outras mudanças que agora se acentuam talvez não definam o mundo novo em formação. Mas dão uma ideia do que poderão vir a ser certas relações de trabalho.

Infelizmente, ainda não dá para contar com as tão necessárias mudanças na área ambiental. Imagens de satélite mostraram como melhoraram as condições atmosféricas nesses tempos de reclusão e de carros recolhidos às garagens. Mas essa ainda não parece demonstração capaz de mudar sistemas e de apressar a adoção de políticas destinadas a reverter o aquecimento global. O lucro fácil continua tendo a última palavra.

Apesar do avanço da ciência e do aumento da previsibilidade, uma coisa não muda. Não muda o medo, essa emoção primária que está dentro de cada um de nós.", MC ,"https://economia.estadao.com.br/noticias/geral,o-que-nao-sera-como-antes,70003258323"
